news_url,title,text,source_name,date,topics,tickers
https://www.reuters.com/business/retail-consumer/amazon-microsoft-back-effort-restrict-nvidias-exports-china-wsj-reports-2025-11-14/,"Amazon, Microsoft back effort to restrict Nvidia's exports to China, WSJ reports","Amazon is joining Microsoft in backing legislation to further limit chipmaker Nvidia's ability to export to China, the Wall Street Journal reported on Thursday, citing people familiar with the matter.",Reuters,"Thu, 13 Nov 2025 21:21:02 -0500",[],AMZN
https://www.wsj.com/tech/amazon-and-microsoft-back-effort-that-would-restrict-nvidias-exports-to-china-21e29e01,Amazon and Microsoft Back Effort That Would Restrict Nvidia's Exports to China,Legislation in Washington would give tech leaders preferential access to chips at their data centers around the world.,WSJ,"Thu, 13 Nov 2025 21:00:00 -0500",['paywall'],AMZN
https://seekingalpha.com/article/4843425-amazon-the-best-opportunity-out-of-the-magnificent-7,Amazon: The Best Opportunity Out Of The Magnificent 7?,"Amazon.com, Inc. stands out as a structurally diversified tech leader, making it a compelling long-term portfolio core among the Magnificent 7 stocks. AMZN's growth is driven by AWS, advertising, and third-party marketplace services, with recent heavy CapEx investments expected to fuel future free cash flow rebounds. Despite short-term free cash flow compression and competitive risks, AMZN's fundamentals remain strong, supported by operational efficiency and a robust balance sheet.",Seeking Alpha,"Thu, 13 Nov 2025 16:48:48 -0500",['paylimitwall'],AMZN
https://www.fool.com/investing/2025/11/13/2-magnificent-seven-stocks-to-buy-before-they-soar/,"2 ""Magnificent Seven"" Stocks to Buy Before They Soar at Least 20%, According to Select Wall Street Analysts","Meta Platforms may be spending vast amounts of cash on projects that are far from paying off, but its profit margins are still wide. The growth of Amazon's cloud-computing operation isn't slowing, which will likely drive strong increases in its operating profits.",The Motley Fool,"Thu, 13 Nov 2025 15:29:00 -0500",['StocksToWatch'],AMZN
https://www.geekwire.com/2025/project-kuiper-no-more-amazon-renames-satellite-internet-venture-leo-on-path-to-commercial-service/,‘Project Kuiper' no more: Amazon renames satellite internet venture ‘Leo' on path to commercial service,Amazon is rebranding its ambitious effort to expand global access to high-speed internet: Project Kuiper will now be known as Amazon,GeekWire,"Thu, 13 Nov 2025 12:04:44 -0500",[],AMZN
https://www.fool.com/investing/2025/11/13/best-artificial-intelligence-ai-stock-to-hold-amzn/,The Best Artificial Intelligence (AI) Stock to Hold in Uncertain Times,Amazon's cloud business drives the majority of its operating income. The company's P/E ratio has become increasingly attractive in recent years.,The Motley Fool,"Thu, 13 Nov 2025 10:33:00 -0500",[],AMZN
https://www.zacks.com/stock/news/2790438/4-stocks-to-add-to-your-portfolio-as-dow-hits-all-time-closing-high?cid=CS-STOCKNEWSAPI-FT-analyst_blog|investment_ideas-2790438,4 Stocks to Add to Your Portfolio as Dow Hits All-Time Closing High,"As the Dow hits a record above 48,000, optimism grows for a year-end rally -- making AMZN, NVDA, JPM, and MMM top stocks to watch.",Zacks Investment Research,"Thu, 13 Nov 2025 10:05:54 -0500",[],AMZN
https://www.forbes.com/sites/greatspeculations/2025/11/13/buy-or-sell-amazon-stock/,Buy Or Sell Amazon Stock?,"We believe there is little to worry about with AMZN stock given its overall Strong operating performance and financial status. Year-to-date, the stock has gained just about 10%, trailing the Nasdaq-100's 20% plus advance.",Forbes,"Thu, 13 Nov 2025 08:55:03 -0500",['paylimitwall'],AMZN
https://seekingalpha.com/article/4842631-amazon-path-to-3-trillion,Amazon: Path To $3 Trillion,"Amazon.com, Inc. remains a Strong Buy, driven by robust financials, expanding AI initiatives, and strategic positioning in e-commerce and cloud. AMZN delivered strong Q3 2025 results, with revenue and EPS growth outpacing expectations, highlighting operating leverage and improved cash flow. Aggressive AI infrastructure investments, highlighted by the $38B OpenAI deal, and expanding AWS partnerships reinforce AMZN's leadership in cloud and innovation.",Seeking Alpha,"Thu, 13 Nov 2025 08:00:00 -0500",['paylimitwall'],AMZN
https://seekingalpha.com/article/4843047-2-years-of-rise-of-magnificent-seven-tech-stocks,2 Years Of The Rise Of The 'Magnificent Seven' Tech Stocks,"The seven companies that make up the S&P 500's ""Magnificent Seven"" stocks have been on the rise for some time. Two years ago, they combined to account for 30% of the total valuation of the S&P 500 (SPX).",Seeking Alpha,"Thu, 13 Nov 2025 07:36:00 -0500",['paylimitwall'],AMZN
https://seekingalpha.com/article/4842560-forget-ai-race-build-income-to-survive-next-market-crash,Forget The AI Race: Build Income First To Survive The Next Market Crash,Recessions can force investors to sell growth stocks too soon. Income first: Ensure bills are paid before speculating on growth. Diversification with income holdings provides an all-terrain portfolio.,Seeking Alpha,"Thu, 13 Nov 2025 07:35:00 -0500",['paylimitwall'],AMZN
https://www.fool.com/investing/2025/11/13/one-best-retail-stocks-own-next-10-years/,What Is One of the Best Retail Stocks to Own for the Next 10 Years?,"Amazon's focus on improving the shopping experience with AI makes the stock an attractive long-term investment. Its Rufus AI shopping assistant has driven $10 billion in incremental annualized sales, and that's just the start.",The Motley Fool,"Thu, 13 Nov 2025 07:10:00 -0500",[],AMZN
https://www.fool.com/investing/2025/11/13/the-best-warren-buffett-stock-to-buy-with-500-righ/,The Best Warren Buffett Stock to Buy With $500 Right Now,Buffett declined to invest in Amazon for years. Berkshire Hathaway finally invested in 2019.,The Motley Fool,"Thu, 13 Nov 2025 04:52:00 -0500",['wbuffett'],AMZN
https://www.fool.com/investing/2025/11/13/what-is-one-of-the-best-artificial-intelligence-ai/,What Is One of the Best Artificial Intelligence (AI) Stocks to Own for the Next 10 Years?,"Amazon has huge opportunities in artificial intelligence (AI), which is already bringing in billions for the company. AWS sales growth accelerated in the third quarter.",The Motley Fool,"Thu, 13 Nov 2025 03:05:00 -0500",[],AMZN
https://www.fool.com/investing/2025/11/12/if-youd-invested-100-in-hot-ticker-stock-1510-year/,"If You'd Invested $100 in Amazon Stock 3 Years Ago, Here's How Much You'd Have Today","Three years ago, Amazon was saddled with costs from its lockdown-era capacity improvements. The company's stock had fallen by nearly 50% in November 2022.",The Motley Fool,"Wed, 12 Nov 2025 17:00:54 -0500",[],AMZN
https://nypost.com/2025/11/12/business/amazon-warehouse-employees-sue-over-punitive-handling-of-absences/,Amazon warehouse employees sue over ‘punitive' handling of absences,"The e-commerce giant was accused of docking unpaid time off when it orders New York employees seeking accommodations for disabilities to stay home, and then threatening to fire them for missing too much work.",New York Post,"Wed, 12 Nov 2025 15:25:38 -0500",[],AMZN
https://seekingalpha.com/article/4842664-amazon-dont-let-forward-pe-fool-you-stock-still-cheap,Amazon: Don't Let The Forward P/E Fool You - The Stock Is Still Cheap,"Amazon.com, Inc. is a dominant force in e-commerce and cloud computing, with a $2.6 trillion market cap and strong outperformance versus the benchmark. AMZN benefits from AI-driven demand, rapid top- and bottom-line growth, a robust balance sheet, and a significant competitive moat with a sticky customer base. Despite a forward P/E of 35x, AMZN stock could be undervalued if growth continues, justifying a Strong Buy rating and a $300 price target for 21% upside.",Seeking Alpha,"Wed, 12 Nov 2025 15:15:35 -0500",['paylimitwall'],AMZN
https://www.businessinsider.com/amazon-whole-foods-absorb-workforce-project-cremini-2025-11,Amazon plans to absorb Whole Foods' entire workforce as part of 'Project Cremini',Amazon will integrate all Whole Foods frontline workers into its core business systems. Whole Foods is finally being absorbed into Amazon's broader operations.,Business Insider,"Wed, 12 Nov 2025 15:10:22 -0500",['paywall'],AMZN
https://www.pymnts.com/amazon/2025/amazon-debuts-ai-powered-tools-for-business-clients/?utm_source=snapi,Amazon Debuts AI-Powered Tools for Business Clients,"Amazon is introducing a series of AI-powered solutions to help business clients. These new offerings, announced Wednesday (Nov. 11), include the new Amazon Business Assistant which is available to Amazon Business at no added cost.",PYMNTS,"Wed, 12 Nov 2025 14:47:50 -0500",[],AMZN
https://www.reuters.com/business/world-at-work/amazon-sued-over-punitive-handling-employee-absences-2025-11-12/,Amazon sued over 'punitive' handling of employee absences,"Amazon.com was sued on Wednesday in a proposed class action saying the retailer subjects thousands of warehouse employees with disabilities to a ""punitive"" policy governing workplace absences.",Reuters,"Wed, 12 Nov 2025 13:51:01 -0500",[],AMZN
https://nypost.com/2025/11/12/business/amazon-backed-anthropic-commits-50b-to-build-us-data-centers/,Amazon-backed Anthropic commits $50B to build US data centers,"Tech companies have announced massive spending plans this year, as President Trump pushes for investments on American soil to maintain the country's edge in the AI sector.",New York Post,"Wed, 12 Nov 2025 13:01:54 -0500",[],AMZN
https://www.fool.com/investing/2025/11/12/what-is-one-of-the-best-artificial-intelligence-st/,What Is One of the Best Artificial Intelligence Stocks to Own for the Next 5 Years?,"Amazon is investing hundreds of millions of dollars in its AI business. It has a huge AI business on the AWS platform, and it also has a minority stake in Anthropic, maker of the Claude LLM.",The Motley Fool,"Wed, 12 Nov 2025 10:28:00 -0500",[],AMZN
https://www.zacks.com/stock/news/2789801/will-aws-growing-capital-spending-boost-or-burden-amazon-stock?cid=CS-STOCKNEWSAPI-FT-analyst_blog|quick_take-2789801,Will AWS' Growing Capital Spending Boost or Burden Amazon Stock?,AMZN's more than $75 billion capital spending plan for AWS infrastructure positions the cloud leader to capitalize on surging AI demand despite near-term margin pressure.,Zacks Investment Research,"Wed, 12 Nov 2025 09:31:21 -0500",[],AMZN
https://www.businesswire.com/news/home/20251112715364/en/Patrick-Ryan%E2%80%99s-Buckeye-Tops-Amazon%E2%80%99s-Best-Books-of-2025-List/,Patrick Ryan's Buckeye Tops Amazon's Best Books of 2025 List,"SEATTLE--(BUSINESS WIRE)--Amazon (NASDAQ: AMZN) today unveiled its Best Books of 2025 list. Patrick Ryan's Buckeye claims the No. 1 spot, chosen by the Amazon Editors for its captivating multigenerational storytelling. The top five also include Virginia Evans' The Correspondent, Nina Willner's The Boys in the Light, Ocean Vuong's The Emperor of Gladness, and Charlotte McConaghy's Wild Dark Shore. For 25 years, the Amazon Editors have read and debated thousands of new releases to create the annu.",Business Wire,"Wed, 12 Nov 2025 09:15:00 -0500",['PressRelease'],AMZN
https://www.reuters.com/sustainability/cop/across-bay-cop30-police-patrol-amazon-island-buffaloes-2025-11-12/,"Across the bay from COP30, police patrol Amazon island on buffaloes","As officials and activists gather in the Brazilian city of Belem for the COP30 United Nations climate talks, the town of Soure across the water on Marajo Island features an unusual mode of sustainable transport: buffaloes.",Reuters,"Wed, 12 Nov 2025 08:57:02 -0500",[],AMZN
https://seekingalpha.com/article/4842382-amazon-amazon-q3-beat-the-street-but-aws-is-the-weak-link,"Amazon: Amazon Q3 Beat The Street, But AWS Is The Weak Link","Amazon delivered strong Q3 earnings, beating expectations on revenue and EPS, but AWS cloud growth lags competitors like GOOG and MSFT. AMZN's free cash flow is pressured by heavy capex, yet robust returns on invested capital and a reasonable forward PEG ratio support a bullish outlook. Technical analysis suggests positive momentum, but short-term pullbacks toward $235 could offer attractive entry points for long positions.",Seeking Alpha,"Wed, 12 Nov 2025 08:20:00 -0500","['earnings', 'paylimitwall']",AMZN
https://247wallst.com/investing/2025/11/12/amazon-stock-amzn-price-prediction-and-forecast/?utm_source=snapi,Amazon Stock (NASDAQ: AMZN) Price Prediction and Forecast 2025-2030 for November 12,Shares of Amazon.com Inc. (NASDAQ: AMZN) gained 0.50% over the past five trading sessions after gaining 7.59% the five prior.,24/7 Wall Street,"Wed, 12 Nov 2025 08:00:37 -0500",[],AMZN
https://www.businesswire.com/news/home/20251112781484/en/Amazon-Business-Unveils-Next-Generation-AI-Solutions-to-Help-Organizations-and-Small-Businesses-Save-Time-and-Money/,Amazon Business Unveils Next Generation AI Solutions to Help Organizations and Small Businesses Save Time and Money,"SEATTLE--(BUSINESS WIRE)--Today, at Amazon Business' Reshape conference, Amazon (NASDAQ: AMZN) announced a number of new AI-powered solutions including the Amazon Business Assistant to help organizations discover savings, automate routine tasks, and make spending easier and more efficient. These innovations, all powered by Amazon Bedrock, AWS's fully managed service for building and scaling generative artificial intelligence (AI) applications, represent the next step in Amazon Business' smart b.",Business Wire,"Wed, 12 Nov 2025 08:00:00 -0500",['PressRelease'],AMZN
https://www.marketbeat.com/originals/amazon-is-one-of-the-clearest-buys-if-the-market-dips-again/?utm_source=snapi,Amazon Is One of the Clearest Buys If the Market Dips Again,"Amazon.com Inc. NASDAQ: AMZN has once again shown why it remains one of the most reliable names in the market. The stock has held firm near $250, even as the broader indices retreated through the end of last week.",MarketBeat,"Wed, 12 Nov 2025 07:06:12 -0500",[],AMZN
https://www.fool.com/investing/2025/11/12/how-does-amazon-make-money/,How Does Amazon Make Money?,"Amazon is investing in AI infrastructure to support its cloud business and long-term growth goals. E-commerce is still responsible for most of its revenue, but its cloud business is the most profitable.",The Motley Fool,"Wed, 12 Nov 2025 06:17:00 -0500",[],AMZN
https://www.businesswire.com/news/home/20251112216141/en/Amazon-Web-Services-becomes-the-Official-Cloud-Provider-of-the-DP-World-Tour/,Amazon Web Services becomes the Official Cloud Provider of the DP World Tour,"SURREY, England--(BUSINESS WIRE)--The DP World Tour and Amazon Web Services (AWS) today announced a strategic partnership that will see the world's most comprehensive and broadly adopted cloud become the Official Cloud Provider of golf's global Tour. Leveraging AWS's industry-leading AI infrastructure, the DP World Tour will roll-out a suite of solutions that combine real-time data with historical context to revolutionise the media, spectator and player experience. Enhancing and Personalising t.",Business Wire,"Wed, 12 Nov 2025 04:00:00 -0500",['PressRelease'],AMZN
https://www.fool.com/investing/2025/11/12/amazon-earnings-show-why-the-stock-is-a-buy/,Amazon Earnings Show Why the Stock Is a Buy,Amazon's third-quarter revenue rose 13% year over year. The company's operating cash flow grew even faster than sales during the period.,The Motley Fool,"Wed, 12 Nov 2025 03:56:00 -0500",['earnings'],AMZN
https://nypost.com/2025/11/11/business/amazons-massive-layoffs-include-nearly-700-terminations-in-nyc-state-department-of-labor/,"Amazon cuts 700 jobs in NYC alone on quest to streamline by slashing 30,000 positions","“The size of the Amazon cuts remains a head scratcher given the battle for talent and [the] AI revolution in motion,” said Wedbush analyst Dan Ives.",New York Post,"Tue, 11 Nov 2025 18:48:58 -0500",['Layoffs'],AMZN
https://www.youtube.com/watch?v=62SSFPpFHBA,"Amazon is probably an AI winner, says Evercore's Mark Mahaney","Mark Mahaney, Evercore ISI head of internet research, joins 'The Exchange' to discuss Mahaney's thoughts on the AI trade,  if investors should wait for a pullback and much more.",CNBC Television,"Tue, 11 Nov 2025 13:36:15 -0500",[],AMZN
https://www.zacks.com/stock/news/2789300/amazon-amzn-is-a-top-ranked-growth-stock-should-you-buy?cid=CS-STOCKNEWSAPI-FT-tale_of_the_tape|zacks_education_growth_score-2789300,Amazon (AMZN) is a Top-Ranked Growth Stock: Should You Buy?,"Wondering how to pick strong, market-beating stocks for your investment portfolio? Look no further than the Zacks Style Scores.",Zacks Investment Research,"Tue, 11 Nov 2025 10:46:19 -0500",[],AMZN
https://deadline.com/2025/11/amazon-prime-video-ad-supported-reach-315-million-viewers-1236613887/,Amazon Prime Video Ad-Supported Reach Hits 315M Monthly Viewers,"Amazon says advertising on Prime Video now reaches 315 monthly viewers, up from 200 million in April 2024. The step-up was announced Tuesday at unBoxed, the annual Amazon Ads event, being held this year in Nashville, TN.",Deadline,"Tue, 11 Nov 2025 10:05:22 -0500",[],AMZN
https://www.zacks.com/stock/news/2789103/5-stocks-to-buy-despite-a-subdued-holiday-shopping-forecast-this-year?cid=CS-STOCKNEWSAPI-FT-analyst_blog|investment_ideas-2789103,5 Stocks to Buy Despite a Subdued Holiday Shopping Forecast This Year,"Muted holiday sales growth is expected, but retailers like AMZN, WMT, TPR, DG and EXPE still shine as smart seasonal picks.",Zacks Investment Research,"Tue, 11 Nov 2025 09:11:10 -0500",['StocksToWatch'],AMZN
https://www.fxempire.com/forecasts/article/amzn-aapl-and-goog-forecast-major-us-stocks-quiet-in-premarket-1560434,"AMZN, AAPL and GOOG Forecast – Major US Stocks Quiet in Premarket","Tech stocks were subdued in pre-market trading on Tuesday. The analyst sees short-term consolidation across Amazon, Apple, and Google but maintains a bullish long-term outlook, viewing any pullbacks as potential buying opportunities.",FXEmpire,"Tue, 11 Nov 2025 08:45:18 -0500",[],AMZN
https://www.fool.com/investing/2025/11/11/amazon-cloud-business-aws-actually-thriving-stock/,Is Amazon's Cloud Business Actually Thriving? Some Data Tells a Different Story.,Amazon Web Services' top and bottom lines both continued their long-established growth in Q3. Other measures suggest AWS doesn't have the marketability it did just a few quarters back.,The Motley Fool,"Tue, 11 Nov 2025 04:00:00 -0500",[],AMZN
https://www.fool.com/investing/2025/11/10/5-warren-buffett-stocks-to-hold-forever/,5 Warren Buffett Stocks to Hold Forever,Berkshire Hathaway has massive investments in Apple and American Express. Amazon Web Services is growing quickly.,The Motley Fool,"Mon, 10 Nov 2025 21:02:00 -0500",['wbuffett'],AMZN
https://www.zacks.com/commentary/2788873/stocks-to-watch-for-the-first-trillion-dollar-holiday-shopping-season?cid=CS-STOCKNEWSAPI-FT-investment_ideas-2788873,Stocks to Watch for the First Trillion Dollar Holiday Shopping Season,"Savvy investors are eyeing the retail sector, with this holiday shopping season expected to be the first in U.S. history to exceed $1 trillion in sales.",Zacks Investment Research,"Mon, 10 Nov 2025 18:13:25 -0500",['StocksToWatch'],AMZN
https://www.zacks.com/commentary/2788850/making-sense-of-the-market-s-tech-worries?cid=CS-STOCKNEWSAPI-FT-earnings_preview-2788850,Making Sense of the Market's Tech Worries,"The recent pullback in leading artificial intelligence stocks has rekindled concerns about the group's stock price momentum and market leadership. The absence of economic data due to the government shutdown, at a time of economic vulnerabilities, is adding to market angst.",Zacks Investment Research,"Mon, 10 Nov 2025 15:29:21 -0500",[],AMZN
https://www.youtube.com/watch?v=kbe-poaOXoY,Trade Tracker: Bill Baruch buys more Amazon and Uber,"Bill Baruch, founder & president at Blue Line Capital, joins CNBC's 'Halftime Report' to detail his latest portfolio moves. The Investment Committee debate the trades.",CNBC Television,"Mon, 10 Nov 2025 15:09:15 -0500",[],AMZN
https://www.benzinga.com/markets/tech/25/11/48761826/amazons-150-billion-ai-capex-surge-could-force-its-first-big-bond-deal-in-years?utm_source=snapi,Amazon's $150 Billion AI Capex Surge Could Force Its First Big Bond Deal In Years,"For a company that practically prints cash, Amazon.com Inc. (NASDAQ:AMZN) might soon need Wall Street's help again. The e-commerce and cloud giant has not issued a major bond deal since 2021, when it raised $18.5 billion to fund the MGM acquisition — its last significant borrowing in over four years.",Benzinga,"Mon, 10 Nov 2025 13:41:19 -0500",['paywall'],AMZN
https://www.fool.com/investing/2025/11/10/amazon-stock-just-hit-an-all-time-high-is-it-too-l/,Amazon Stock Just Hit an All-Time High: Is It Too Late to Buy the Stock?,Amazon hit it out of the park with its third-quarter results. The company's fastest-growing segments should eventually improve both its sales growth and margins.,The Motley Fool,"Mon, 10 Nov 2025 13:21:00 -0500",[],AMZN
https://www.pymnts.com/amazon/2025/amazon-marks-haul-expansion-with-11-cent-deals/?utm_source=snapi,Amazon Marks ‘Haul' Expansion With 11-Cent Deals,"Amazon said it is marking the one-year anniversary of its “Haul” service with $1 deals. It‘s part of a two-day “shopping event” scheduled for Monday (Nov. 10) and Tuesday (Nov. 11), with the eCommerce giant selling tens of thousands of products priced at $1 on the first day, and “exclusive $0.",PYMNTS,"Mon, 10 Nov 2025 12:35:32 -0500",[],AMZN
https://247wallst.com/investing/2025/11/10/amazon-still-plans-to-replace-250k-new-jobs-with-robots/?utm_source=snapi,Amazon Still Plans To Replace 250k New Jobs With Robots,"It struck me how confident Amazon seemed heading into the holidays. When I told Lee about their plan to hire 250,000 seasonal workers, he didn't hesitate.",24/7 Wall Street,"Mon, 10 Nov 2025 11:20:07 -0500",[],AMZN
https://www.fool.com/investing/2025/11/10/3-technology-buys-that-wall-street-loves/,3 Technology Buys That Wall Street Loves,Wall Street analysts advise buying these stocks and expecting them to climb in the coming 12 months. These companies are key players in the artificial intelligence market.,The Motley Fool,"Mon, 10 Nov 2025 05:15:00 -0500",[],AMZN
https://www.fool.com/investing/2025/11/10/growth-stock-buy-nvidia-alphabet-3-trillion-club/,"1 Spectacular Growth Stock to Buy Before It Joins Nvidia, Apple, Microsoft, and Alphabet in the $3 Trillion Club","Nine American companies are currently worth $1 trillion or more, but only four have graduated into the $3 trillion club. Amazon is one of the world's most diverse tech companies, with dominant positions in e-commerce, cloud computing, digital advertising, and more.",The Motley Fool,"Mon, 10 Nov 2025 04:56:00 -0500",[],AMZN
https://www.fool.com/investing/2025/11/10/want-to-invest-in-quantum-computing-3-stocks-that/,Want to Invest in Quantum Computing? 3 Stocks That Are Great Buys Right Now,Alphabet's Google Quantum AI achieved quantum advantage with its Willow quantum chip last month. Amazon thinks its technology can dramatically lower the costs of quantum error correction.,The Motley Fool,"Mon, 10 Nov 2025 04:44:00 -0500",[],AMZN
https://247wallst.com/investing/2025/11/10/amazon-stock-price-prediction-where-will-it-be-in-1-year/?utm_source=snapi,Amazon (NASDAQ: AMZN) Stock Price Prediction for 2025: Where Will It Be in 1 Year,Shares of Amazon.com Inc. (NASDAQ: AMZN) lost 0.81% over the past five trading sessions after gaining 7.35% the five prior.,24/7 Wall Street,"Mon, 10 Nov 2025 04:38:05 -0500",[],AMZN
https://www.fool.com/investing/2025/11/09/warren-buffetts-portfolio-for-2026/,23% of Warren Buffett's $257 Billion Portfolio for 2026 Is Invested in These 2 Unstoppable Stocks,"Warren Buffett generally doesn't invest in tech stocks, but he couldn't resist the following two. These players have something Buffett likes: fantastic moats, or competitive advantages.",The Motley Fool,"Sun, 09 Nov 2025 19:30:00 -0500",['wbuffett'],AMZN
https://www.cnbc.com/2025/11/09/top-wall-street-analysts-favor-3-tech-stocks-for-their-growth-outlook.html,Top Wall Street analysts favor these 3 tech stocks for their growth outlook,"TipRanks' ranking service discusses three stocks that are favored by Wall Street, including Amazon and Alphabet.",CNBC,"Sun, 09 Nov 2025 07:28:05 -0500",[],AMZN
https://www.fool.com/investing/2025/11/09/3-reasons-to-buy-this-top-tech-stock-thats-likely/,"3 Reasons to Buy This Top Tech Stock That's Likely to Join Nvidia, Apple, Microsoft, and Alphabet in the $3 Trillion Market Cap Club Next Year",AWS sales are accelerating Amazon is investing in many new AI services that create real value for clients. It's adding new products to its marketplace and reaching more regions with same-day grocery delivery.,The Motley Fool,"Sun, 09 Nov 2025 06:15:00 -0500",[],AMZN
https://www.fool.com/investing/2025/11/09/the-biggest-risk-for-amazon-stock-investors-right/,The Biggest Risk for Amazon Stock Investors Right Now,"Amazon's (AMZN +0.56%) management team is increasing spending in this critical category, and it could be risky for investors.",The Motley Fool,"Sun, 09 Nov 2025 06:03:00 -0500",['podcast'],AMZN
https://www.fool.com/investing/2025/11/09/3-reasons-amazon-is-a-no-brainer-buy-right-now/,3 Reasons Amazon Is a No-Brainer Buy Right Now,Amazon's advertising business is its fastest-growing segment. AWS is gaining traction in the AI space.,The Motley Fool,"Sun, 09 Nov 2025 05:00:00 -0500",[],AMZN
