news_url,title,text,source_name,date,topics,tickers
https://www.proactiveinvestors.com/companies/news/1081582?SNAPI,"Meta, Amazon, Apple, Microsoft, Alphabet: Big Tech leads packed week of earnings","Oppenheimer & Co analysts late Thursday weighed in on Reddit (NYSE:RDDT)'s third quarter earnings and revenue results, which exceeded Wall Street expectations.",Proactive Investors,"Fri, 31 Oct 2025 14:46:04 -0400",['earnings'],AMZN
https://invezz.com/news/2025/10/31/amazon-shares-surge-12-lifting-markets-as-aws-revival-sparks-stock-surge/?utm_source=snapi,"Amazon shares surge 12%, lifting markets as AWS revival sparks stock surge",Amazon shares soared more than 12% on Friday to a 52-week high after the company posted stronger-than-expected third-quarter results and signaled renewed momentum in its cloud computing and advertising businesses.,Invezz,"Fri, 31 Oct 2025 14:42:37 -0400",[],AMZN
https://seekingalpha.com/article/4836483-amazon-the-boat-is-re-accelerating-rating-upgrade,Amazon: The Boat Is Re-Accelerating (Rating Upgrade),"Amazon is upgraded to a 'Buy' as AWS shows strong reacceleration, alleviating previous concerns about slowing growth. AWS posted 20.2% YoY growth, driven by robust AI and infrastructure demand, reinforcing Amazon's dominant cloud position and investor confidence. Despite Azure and Google Cloud growing faster, AWS remains the largest cloud platform, with recent outages highlighting enterprise reliance on its services.",Seeking Alpha,"Fri, 31 Oct 2025 14:22:09 -0400",['paylimitwall'],AMZN
https://www.youtube.com/watch?v=MFM6kQpMDYk,"AMZN ""Impressive"" Earnings: AWS Continues Momentum, Trims Tariff Fears","Charlie O'Shea considers Amazon's (AMZN) earnings pretty strong, bolstered by AWS cloud. He sees A.I.",Schwab Network,"Fri, 31 Oct 2025 14:00:33 -0400",['earnings'],AMZN
https://www.youtube.com/watch?v=QMXLrUdP4zo,Investors buy Amazon's vision for AI,CNBC's MacKenzie Sigalos reports on the winners and losers from the latest megacap tech earnings.,CNBC Television,"Fri, 31 Oct 2025 13:52:08 -0400",[],AMZN
https://www.zacks.com/stock/news/2782843/amazon-amzn-is-an-incredible-growth-stock-3-reasons-why?cid=CS-STOCKNEWSAPI-FT-tale_of_the_tape|yseop_template_11_growth-2782843,Amazon (AMZN) is an Incredible Growth Stock: 3 Reasons Why,"Amazon (AMZN) is well positioned to outperform the market, as it exhibits above-average growth in financials.",Zacks Investment Research,"Fri, 31 Oct 2025 13:51:15 -0400",[],AMZN
https://www.youtube.com/watch?v=xI5ULKJeerk,"Finally got to see Amazon's revenue acceleration from AI, says Citi's Ronald Josey","Ronald Josey, Citi senior internet analyst, joins 'The Exchange' to discuss Josey's thoughts on Amazon's earnings results, why AWS is positioned for growth and more.",CNBC Television,"Fri, 31 Oct 2025 13:48:26 -0400",[],AMZN
https://www.investors.com/news/technology/amazon-stock-ai-shopping-jassy-walmart-chatgpt/,Amazon CEO Expects Future AI Shopping Partnerships Following Walmart-OpenAI Alliance,"Amazon stock was rallying following its Q3 report, which included an update on its approach to agentic commerce.",Investors Business Daily,"Fri, 31 Oct 2025 13:45:07 -0400",['CEO'],AMZN
https://www.benzinga.com/news/25/10/48568925/dow-falls-over-100-points-amazon-posts-upbeat-q3-results?utm_source=snapi,Dow Falls Over 100 Points; Amazon Posts Upbeat Q3 Results,Amazon.com Inc. (NASDAQ:AMZN) reported upbeat third-quarter financial results Thursday after market close.,Benzinga,"Fri, 31 Oct 2025 13:33:57 -0400","['earnings', 'paywall', 'pricemovement']",AMZN
https://www.youtube.com/watch?v=MxtQ7_PCvgo,Tony Wang: Earnings reinforce that AI continues to be the key investment for Mag 7,"Tony Wang, T. Rowe Price science and technology fund manager, joins CNBC's 'Squawk on the Street' to discuss outlooks on earnings.",CNBC Television,"Fri, 31 Oct 2025 13:18:45 -0400",['earnings'],AMZN
https://www.youtube.com/watch?v=bXFmyMnjqbA,"Disney pulls content from YouTube TV, Amazon adds $300B in market value","Market Catalysts anchor Julie Hyman breaks down the latest market news for October 31, 2025 Amazon added $300 billion in market value as shares surged following the company's latest earnings report. The company beat Wall Street expectations for the third quarter, with Amazon Web Services (AWS) accounting for a significant portion of the company's growth and revenue.",Yahoo Finance,"Fri, 31 Oct 2025 13:05:50 -0400",[],AMZN
https://seekingalpha.com/article/4836426-amazon-the-most-misunderstood-ai-stock-on-wall-street,Amazon: The Most Misunderstood AI Stock On Wall Street,"Amazon.com, Inc. is rated a Strong Buy due to its aggressive AI investments, which reinforce its competitive moat across AWS, retail, and advertising. AMZN's 20% AWS growth signals a new cycle of AI-driven monetization, with robust backlog and rapid cluster adoption fueling expansion. Short-term earnings were impacted by one-off costs, but underlying North America retail margins and group operating income remain strong after adjustments.",Seeking Alpha,"Fri, 31 Oct 2025 13:05:01 -0400",['paylimitwall'],AMZN
https://techcrunch.com/2025/10/31/aws-exceeds-wall-streets-expectations-as-demand-for-cloud-infra-remains-high/,AWS exceeds Wall Street's expectations as demand for cloud infra remains high,"Amazon's cloud infrastructure service, Amazon Web Services (AWS), is on track to record its strongest year of growth in three years, fueled by the AI industry's unprecedented demand for computing power.",TechCrunch,"Fri, 31 Oct 2025 12:59:18 -0400",['earnings'],AMZN
https://www.investopedia.com/top-stock-movers-now-amazon-reddit-newell-brands-and-more-11841080,"Top Stock Movers Now: Amazon, Reddit, Newell Brands, and More","Major U.S. equities indexes climbed Friday afternoon, helped by a rally in shares of Amazon (AMZN) after the tech giant posted better-than-expected earnings. The Dow, S&P 500, and Nasdaq all advanced.",Investopedia,"Fri, 31 Oct 2025 12:50:37 -0400",[],AMZN
https://www.youtube.com/watch?v=8aODg7uMf7E,Amazon surges on blowout quarter,CNBC's MacKenzie Sigalos joins CNBC's 'Money Movers' with the latest earnings details from Amazon.,CNBC Television,"Fri, 31 Oct 2025 12:48:04 -0400",['earnings'],AMZN
https://www.zacks.com/stock/news/2782763/pre-market-traders-fill-their-bags-on-halloween?cid=CS-STOCKNEWSAPI-FT-ahead_of_wall_street-2782763,Pre-market Traders Fill Their Bags on Halloween,"The Nasdaq leads major indexes this morning, +350 points on strength in Amazon following Q3 earnings yesterday.",Zacks Investment Research,"Fri, 31 Oct 2025 12:20:53 -0400",[],AMZN
https://www.youtube.com/watch?v=nmkKyQ7uu0M,Amazon and Apple report earnings: Here's what to know,CNBC's MacKenzie Sigalos and Steve Kovach join 'Squawk on the Street' with the latest news earnings from Amazon and Apple.,CNBC Television,"Fri, 31 Oct 2025 11:51:46 -0400",['earnings'],AMZN
https://www.zacks.com/stock/news/2782562/brokers-suggest-investing-in-amazon-amzn-read-this-before-placing-a-bet?cid=CS-STOCKNEWSAPI-FT-fundamental_analysis|average_broker_rating-2782562,Brokers Suggest Investing in Amazon (AMZN): Read This Before Placing a Bet,"The recommendations of Wall Street analysts are often relied on by investors when deciding whether to buy, sell, or hold a stock. Media reports about these brokerage-firm-employed (or sell-side) analysts changing their ratings often affect a stock's price.",Zacks Investment Research,"Fri, 31 Oct 2025 11:37:41 -0400",[],AMZN
https://www.youtube.com/watch?v=0XYozzOuRJ0,"Apple and Amazon show strong growth outlooks, Brooks Running CEO talks shoes and NYC Marathon","Yahoo Finance executive editor Brian Sozzi breaks down the latest market news for October 31, 2025. Apple and Amazon reported strong earnings reports.",Yahoo Finance,"Fri, 31 Oct 2025 11:36:50 -0400",['CEO'],AMZN
https://www.zacks.com/stock/news/2782707/don-t-be-spooked-by-tariffs-enjoy-4-stock-etf-treats-on-halloween?cid=CS-STOCKNEWSAPI-FT-etf_news_and_commentary-2782707,Don't be Spooked by Tariffs: Enjoy 4 Stock & ETF Treats on Halloween,"Halloween spending to hit a record $13.1B despite tariffs. Treat yourself with stocks HSY, TJX, HD, AMZN, and ETFs RTH, XLY, SOCL, ONLN this season.",Zacks Investment Research,"Fri, 31 Oct 2025 11:35:45 -0400",[],AMZN
https://www.youtube.com/watch?v=JZHmYmxNmRA,"Amazon AWS ""Clear Win,"" AMZN Soars to All-Time High",Amazon's (AMZN) dominance in ecommerce was backed by its AWS cloud that added lots of muscle to the Mag 7 giant's earnings. Jenny Horne talks about how the cloud services platform sets the groundwork for more growth after Amazon already showed strong numbers on Thursday.,Schwab Network,"Fri, 31 Oct 2025 11:30:14 -0400",[],AMZN
https://nypost.com/2025/10/31/business/amazon-shares-soar-11-on-strong-cloud-growth-easing-investor-fears-over-ai-spending/,"Amazon shares soar 11% on strong cloud growth, easing investor fears over AI spending",Revenue in its cloud unit jumped 20.2% in the most recent quarter – beating Wall Street estimates of 18.1%.,New York Post,"Fri, 31 Oct 2025 11:29:24 -0400",[],AMZN
https://www.schaeffersresearch.com/content/news/2025/10/31/post-earnings-record-draw-bulls-to-amazon-com-stock,Post-Earnings Record Draws Bulls to Amazon.com Stock,"Amazon.com Inc  (NASDAQ:AMZN) stock is up 10.5% to trade at $245.86 at last glance, reinstating Big Tech faith after the company surpassed third-quarter earnings and revenue estimates.",Schaeffers Research,"Fri, 31 Oct 2025 11:23:16 -0400",['earnings'],AMZN
https://www.youtube.com/watch?v=K6r2v9uJvO8,"Amazon's blowout quarter, Apple issues strong holiday outlook, Exxon and Chevron beat expectations","Morning Brief anchor Julie Hyman breaks down the latest market news for October 31, 2025. Amazon reported the fastest cloud unit growth in three years.",Yahoo Finance,"Fri, 31 Oct 2025 11:10:23 -0400",['earnings'],AMZN
https://www.proactiveinvestors.com/companies/news/1081565?SNAPI,"Amazon shares climb, analysts raise price targets on AWS momentum","Amazon.com Inc (NASDAQ:AMZN) shares surged almost 11% to about $246 after a third quarter earnings beat, with analysts at Oppenheimer and Wedbush highlighting Amazon Web Services (AWS) and AI initiatives as key growth drivers. Following the report, Oppenheimer raised its 12 to 18-month price target to $290, maintaining an 'Outperform' rating, citing accelerating AWS revenue growth.",Proactive Investors,"Fri, 31 Oct 2025 11:05:22 -0400",['earnings'],AMZN
https://www.fxempire.com/forecasts/article/sp500-amazon-earnings-lift-tech-stocks-as-china-trade-risk-eases-today-1558592,S&P500: Amazon Earnings Lift Tech Stocks as China Trade Risk Eases Today,"Amazon's earnings spark a tech rebound, lifting the S&P 500. Easing China trade risks support a bullish near-term forecast for US stocks and indices today.",FXEmpire,"Fri, 31 Oct 2025 10:57:25 -0400",['earnings'],AMZN
https://www.marketwatch.com/story/still-no-sign-of-surging-layoffs-despite-amazon-ups-job-cuts-a9962483,"Still no sign of surging layoffs despite Amazon, UPS job cuts","Amazon's plans to discard at least 14,000 employees and the elimination of 48,000 jobs at UPS suggest layoffs in the U.S. are on the rise, but there's just one problem: There's little evidence to support it.",Market Watch,"Fri, 31 Oct 2025 10:53:00 -0400","['Layoffs', 'paylimitwall']",AMZN
https://www.forbes.com/sites/tylerroush/2025/10/31/jeff-bezos-is-24-billion-richer-as-amazon-shares-hit-record/,Jeff Bezos Is $24 Billion Richer As Amazon Shares Hit Record,"Bezos is the world's third-richest person with a fortune valued at $259.4 billion, according to Forbes' latest estimates. Bezos, who holds 8% equity in Amazon, had his net worth swell by roughly $24 billion (10.2%) as of Friday morning, after a $6.6 billion slide as shares dropped Thursday.",Forbes,"Fri, 31 Oct 2025 10:30:11 -0400",['paylimitwall'],AMZN
https://247wallst.com/investing/2025/10/31/wall-street-loves-apple-amazon-and-nvidia/?utm_source=snapi,"Wall Street Loves Apple, Amazon and Nvidia","Coinbase (NASDAQ: COIN): Bernstein reiterated an outperform rating on Coinbase, noting that the crypto giant is firing on all cylinders.",24/7 Wall Street,"Fri, 31 Oct 2025 10:20:48 -0400",[],AMZN
https://www.benzinga.com/markets/tech/25/10/48560221/andy-jassy-is-turning-amazon-into-the-worlds-largest-startup-one-layer-at-a-time?utm_source=snapi,Andy Jassy Is Turning Amazon Into The 'World's Largest Startup' — One Layer At A Time,"Amazon.com Inc's (NASDAQ:AMZN) latest reorganization isn't a cost-cutting move — it's a cultural reset. CEO Andy Jassy wants to make Amazon ""the world's largest startup,"" he said while responding to analyst questions on the third-quarter earnings call.",Benzinga,"Fri, 31 Oct 2025 10:04:38 -0400","['CEO', 'paywall']",AMZN
https://www.forbes.com/sites/jjkinahan/2025/10/31/amazon-and-apple-set-the-pace/,Amazon and Apple Set the Pace,Amazon.com and Apple are going to kick us off in a big way today as the market continues to drive higher. It is very encouraging to see two of the stalwarts of the market be the further drivers of the rally.,Forbes,"Fri, 31 Oct 2025 10:00:13 -0400",['paylimitwall'],AMZN
https://www.cnbc.com/2025/10/31/amazon-amzn-stock-earnings-revenue-ai-cloud.html,Amazon's stock soars 12% on third-quarter beat and increased spending guidance,"Amazon exceeded third-quarter estimates in its earnings report and lifted its capital expenditures forecast for the year to $125 billion from $118 billion. The company's cloud computing unit, Amazon Web Services, was a big growth driver, with revenue climbing 20% from a year earlier.",CNBC,"Fri, 31 Oct 2025 09:33:17 -0400",[],AMZN
https://www.youtube.com/watch?v=v_FufLPXQrE,"AAPL & AMZN Push SPX Higher, NFLX 10-for-1 Stock Split & SNAP Benefits Ending","""What a difference a day makes,"" says Kevin Hincks, noting Apple (AAPL) and Amazon (AMZN) earnings reversing much of Thursday's down action in Friday's premarket. One signal of trouble ahead: SNAP benefits ending on November 1st as the U.S. government shutdown enters day 31.",Schwab Network,"Fri, 31 Oct 2025 09:31:09 -0400",[],AMZN
https://www.cnbc.com/2025/10/31/tech-ai-google-meta-amazon-microsoft-spend.html,Tech's $380 billion splurge: This quarter's winners and losers of the AI spending boom,"Google, Microsoft, Meta and Amazon all raised their forecasts for capital expenditures in their earnings reports this week. Their announcements show that the hefty spending on artificial intelligence is only increasing.",CNBC,"Fri, 31 Oct 2025 09:27:05 -0400",[],AMZN
https://www.barrons.com/articles/sps-commerce-earnings-stock-price-amazon-b5cf4d59,This Supply Chain Stock Plummets 31%. Why Amazon Is Part of the Story.,"SPS Commerce reports trouble in its revenue recovery platform, which is used by Amazon third-party sellers.",Barrons,"Fri, 31 Oct 2025 09:19:00 -0400",['paywall'],AMZN
https://247wallst.com/investing/2025/10/31/bezos-net-worth-rises-10-billion-on-amazon-earnings/?utm_source=snapi,Bezos Net Worth Rises $10 Billion on Amazon Earnings,"Jeff Bezos, founder and former CEO of Amazon.com Inc. (NASDAQ: AMZN), has a net worth of just over $246 billion.",24/7 Wall Street,"Fri, 31 Oct 2025 09:15:36 -0400",['earnings'],AMZN
https://247wallst.com/investing/2025/10/31/5-dividend-etfs-that-could-pay-you-for-life/?utm_source=snapi,5 Dividend ETFs That Could Pay You for Life,"Whether you're just beginning to invest or sailing into retirement, you can benefit from a lifetime stream of passive income.",24/7 Wall Street,"Fri, 31 Oct 2025 09:02:38 -0400",['dividend'],AMZN
https://www.youtube.com/watch?v=nYZppZZ6tjg,"Nvidia strikes deal with South Korea to supply AI chips, Apple and Amazon report strong earnings","Morning Brief: Market Sunrise host Allie Canal breaks down the latest market news for October 31, 2025. Nvidia announced a deal with the South Korean government and companies to supply hundreds of thousands of AI chips as the country accelerates its push for AI.",Yahoo Finance,"Fri, 31 Oct 2025 08:57:41 -0400",['earnings'],AMZN
https://www.zacks.com/stock/news/2782453/buy-amzn-amid-solid-q3-earnings-driven-by-extensive-ai-applications?cid=CS-STOCKNEWSAPI-FT-analyst_blog|investment_ideas-2782453,Buy AMZN Amid Solid Q3 Earnings Driven by Extensive AI Applications,"AMZN's Q3 earnings soar past estimates as AI-fueled growth in AWS, advertising, and retail drives a 13% after-hours stock jump.",Zacks Investment Research,"Fri, 31 Oct 2025 08:56:04 -0400",['earnings'],AMZN
https://www.forbes.com/sites/greatspeculations/2025/10/31/how-amzn-stock-rises-to-500/,How AMZN Stock Rises To $500?,"Following Amazon's exceptional Q3 2025 earnings disclosed on October 30th, which saw the stock rise 12% in after-hours trading, the crucial question is: Is this the start of a significant surge that could elevate AMZN stock to $500 or more? It's certainly a possibility.",Forbes,"Fri, 31 Oct 2025 08:40:07 -0400",['paylimitwall'],AMZN
https://www.youtube.com/watch?v=CZkDAHeMUo0,"AMZN's Big Beat, COIN Climbs Higher, Levels to Watch Today",Kevin Green joins Morning Movers with a look at Amazon (AMZN) after earnings. Shares of the e-commerce giant and AWS provider are on track for all-time highs after a massive revenue beat and guiding for north of $206B in 4Q revenue.,Schwab Network,"Fri, 31 Oct 2025 08:33:40 -0400",[],AMZN
https://247wallst.com/forecasts/2025/10/31/amazon-amzn-stock-price-prediction-in-2030-bull-base-bear-forecasts/?utm_source=snapi,"Amazon (NASDAQ: AMZN) Stock Price Prediction in 2030: Bull, Bear, & Baseline Forecasts (Oct 31)",Amazon.com Inc. (NASDAQ: AMZN) has been one of the stock market's biggest success stories ever.,24/7 Wall Street,"Fri, 31 Oct 2025 08:30:58 -0400",[],AMZN
https://www.benzinga.com/markets/tech/25/10/48555974/amazon-ceo-andy-jassy-thinks-the-weekly-grocery-run-is-dead?utm_source=snapi,Amazon CEO Andy Jassy Thinks The Weekly Grocery Run Is Dead,"Andy Jassy thinks your grocery list needs a software update. The Amazon.com Inc (NASDAQ:AMZN) CEO believes the ""weekly stock up"" is on its way out — replaced by a new kind of grocery behavior that blends everyday essentials, perishables, and AI-driven convenience.",Benzinga,"Fri, 31 Oct 2025 08:29:37 -0400","['CEO', 'paywall']",AMZN
https://www.proactiveinvestors.com/companies/news/1081535?SNAPI,Nasdaq likely to take the lead as Amazon lifts Halloween spirits,"8am: Futures in high spirits US stock futures were mostly higher ahead of the open after earnings from Amazon lifted spirits after Thursday's losses due to uncertainty about the future policy of the Federal Reserve after its chair, Jerome Powell, suggested a cut in December, to follow this week's, was not a foregone conclusion. The Nasdaq was poised to take the lead, with futures suggesting a 1.2% gain.",Proactive Investors,"Fri, 31 Oct 2025 08:04:05 -0400",[],AMZN
https://www.cnbc.com/2025/10/31/5-things-to-know-before-the-stock-market-opens.html,"Amazon's earnings rally, Netflix's stock split, chocolate inflation and more in Morning Squawk","Amazon and Apple reported earnings that beat Wall Street's expectations, pushing both stocks up in premarket trading. Netflix shares rose after the streamer announced a 10-to-1 stock split.",CNBC,"Fri, 31 Oct 2025 07:56:00 -0400",['earnings'],AMZN
https://www.barrons.com/articles/nvidia-stock-price-ai-chips-amazon-575c1a1e,Nvidia Stock Gains. Amazon Had Good News for the Chip Maker.,Nvidia was rising after Amazon added to the chorus of large cloud-computing companies saying demand for AI capacity outstrips supply,Barrons,"Fri, 31 Oct 2025 07:08:00 -0400",['paywall'],AMZN
https://www.barrons.com/articles/amazon-apple-stock-mag-7-things-to-know-today-fa7f2d4c,"Amazon, Apple Were the Mag 7 Losers. Here's Why That's About to Change.","Apple is betting on a big holiday season, Netflix weighs Warner Bros. bid, Pfizer and Novo Nordisk find themselves in a bidding war, and more news to start your day.",Barrons,"Fri, 31 Oct 2025 06:50:00 -0400",['paywall'],AMZN
https://www.cnet.com/tech/amazons-big-holiday-plan-replacing-600000-human-workers-with-robots-a-new-report-says/,"Amazon's Big Holiday Plan? Replacing 600,000 Human Workers With Robots, a New Report Says",Your guide to Amazon's automated future: What the 75% goal really means for workers.,CNET,"Fri, 31 Oct 2025 05:35:38 -0400",[],AMZN
https://www.reuters.com/business/retail-consumer/amazon-shares-soar-ai-boom-fuels-stellar-growth-aws-cloud-unit-2025-10-31/,Amazon shares soar as AI boom fuels stellar growth in AWS cloud unit,Amazon shares jumped nearly 12% in premarket trade on Friday after strong growth at its cloud unit and a bullish sales outlook eased fears that the tech giant was falling behind rivals in the AI race.,Reuters,"Fri, 31 Oct 2025 05:30:45 -0400",[],AMZN
https://www.wsj.com/tech/ai/amazons-cloud-business-wont-be-an-ai-laggard-for-long-839e0ba4,Amazon's Cloud Business Won't Be an AI Laggard for Long,"The e-commerce giant's cloud-computing business has disappointed investors with its growth recently, but that appears to be changing.",WSJ,"Fri, 31 Oct 2025 05:30:00 -0400",['paywall'],AMZN
https://www.wsj.com/livecoverage/stock-market-today-dow-sp-500-nasdaq-10-31-2025,"Stock Market Today: S&P 500 Futures Rise, Bolstered by Apple, Amazon Rally",Investors cheer earnings from Apple and Amazon,WSJ,"Fri, 31 Oct 2025 04:49:17 -0400","['paywall', 'futures', 'marketclose']",AMZN
https://www.proactiveinvestors.co.uk/companies/news/1081522?SNAPI,"Amazon pops, Apple steadies: What after-hours results say about Big Tech in an AI-jittery market","Two of the market's bellwethers released their numbers after the closing bell, and the message to anyone with exposure via SIPPs, ISAs or tech-heavy pensions was clear: cash flows from cloud and services are doing the heavy lifting even as the AI euphoria invites bubble chatter. Amazon.com Inc's (NASDAQ:AMZN) shares leapt around 10% to 13% in late trading after a strong beat, led by a sharp re-acceleration at Amazon Web Services, where sales rose 20% year on year to $33 billion, the fastest pace in nearly three years.",Proactive Investors,"Fri, 31 Oct 2025 04:12:57 -0400",[],AMZN
https://www.pymnts.com/artificial-intelligence-2/2025/jassy-bets-big-on-ai-agents-as-aws-surges-22/?utm_source=snapi,Jassy Bets Big on AI Agents as AWS Surges 22%,"Amazon's latest results, announced Thursday (Oct. 30th) after the bell, gave investors and analysts a snapshot of how AI is powering and fine-tuning everything from eCommerce to enterprise customers operations. And the company is making headway in its grocery efforts as well, management said during the Thursday evening conference call.",PYMNTS,"Fri, 31 Oct 2025 04:00:22 -0400",[],AMZN
https://invezz.com/news/2025/10/31/its-culture-not-costs-or-ai-amazon-ceo-andy-jassy-justifies-14000-layoffs/?utm_source=snapi,"It's culture, not costs or AI: Amazon CEO Andy Jassy justifies 14,000 layoffs","In his first public comments on Amazon's latest round of mass layoffs, CEO Andy Jassy offered a surprising justification for cutting 14,000 jobs. The decision was not driven by financial pressures or the rise of AI, but by a deliberate effort to reshape the company's “internal culture”, Jassy said.",Invezz,"Fri, 31 Oct 2025 03:46:08 -0400","['CEO', 'Layoffs']",AMZN
https://news.sky.com/story/apple-and-amazon-defy-expectations-with-latest-results-13461052,Apple and Amazon defy expectations with latest results,Tech giants Apple and Amazon have defied industry predictions with better-than-expected financial results.,Skynews,"Fri, 31 Oct 2025 00:07:36 -0400",[],AMZN
https://www.youtube.com/watch?v=KyqizNkKdWc,Amazon closes out hyperscaler earnings with focus on cloud growth and AI spend,CNBC's MacKenzie Sigalos reports on Amazon's third-quarter earnings as investors zero in on cloud momentum and whether heavy AI infrastructure spending is starting to show returns.,CNBC Television,"Thu, 30 Oct 2025 23:54:47 -0400",['earnings'],AMZN
https://www.youtube.com/watch?v=V6Q0AC6-aVU,"Amazon guides to $210 billion in Q4 revenue, lifting investor sentiment",CNBC's MacKenzie Sigalos reports on Amazon's upbeat Q4 guidance as the company projects a $210 billion fourth quarter and investors rally behind signs of renewed growth in cloud.,CNBC Television,"Thu, 30 Oct 2025 23:37:49 -0400",['earnings'],AMZN
https://www.youtube.com/watch?v=NEnfC10rDiU,Amazon CFO expects full-year capex to hit $125B in 2025,"CNBC's MacKenzie Sigalos reports on Amazon's surging AI infrastructure spend, as the company raises its 2025 capex forecast to $125 billion and signals even higher investment ahead.",CNBC Television,"Thu, 30 Oct 2025 23:37:08 -0400","['earnings', 'CFO']",AMZN
https://www.youtube.com/watch?v=pKd3l20kxH8,Amazon's cloud business growing at pace not seen since 2022,"CNBC's MacKenzie Sigalos reports on AWS growth, as Amazon's cloud business reaccelerates to 20% year-over-year, easing investor concerns and signaling renewed momentum in AI infrastructure demand.",CNBC Television,"Thu, 30 Oct 2025 23:36:15 -0400",['earnings'],AMZN
https://www.marketwatch.com/story/amazons-stock-soars-toward-its-best-day-since-2022-the-ai-narrative-has-flipped-positive-9e7fadc5,Amazon's stock soars toward its best day since 2022: ‘The AI narrative has flipped positive',Investors were worried AWS was falling behind in AI. A new growth trajectory has restored confidence in Amazon's cloud business.,Market Watch,"Thu, 30 Oct 2025 22:38:00 -0400","['earnings', 'paylimitwall']",AMZN
https://www.zacks.com/stock/news/2782194/markets-take-a-powder-on-biggest-earnings-day-of-the-week?cid=CS-STOCKNEWSAPI-FT-ahead_of_wall_street-2782194,Markets Take a Powder on Biggest Earnings Day of the Week,"We???re still up from early Monday, except for the small-cap Russell 2000, which has taken it on the chin over the past two sessions.",Zacks Investment Research,"Thu, 30 Oct 2025 19:51:07 -0400",['earnings'],AMZN
