news_url,title,text,source_name,date,topics,tickers
https://www.youtube.com/shorts/cAQpelOOoVs,Amazon opens $11 billion AI data center in rural Indiana as rivals race to break ground.,"Amazon has opened a data center on 1,200 acres of land in Indiana that's dedicated to training and running models from Anthropic. CNBC's MacKenzie Sigalos reports from the site.",CNBC Television,"Wed, 29 Oct 2025 14:00:56 -0400",[],AMZN
https://nypost.com/2025/10/29/tech/amazon-web-services-outage-reports-spike-just-a-week-after-major-disruption-caused-chaos/,Amazon Web Services outage reports spike just a week after major disruption caused chaos,"User complaints surged on tracking site DownDetector just after noon Eastern time, with most reports concentrated in the company's US-EAST-1 region.",New York Post,"Wed, 29 Oct 2025 13:38:48 -0400",[],AMZN
https://www.geekwire.com/2025/amazon-layoffs-hit-software-engineers-hardest-in-washington/,Amazon layoffs hit software engineers hardest in Washington,Software development engineers make up the largest group of employees affected by Amazon's latest round of layoffs in its home,GeekWire,"Wed, 29 Oct 2025 13:05:31 -0400",['Layoffs'],AMZN
https://www.youtube.com/watch?v=NJI1zY368f0,Amazon's $11B data center in Indiana goes live,CNBC's MacKenzie Sigalos reports on news regarding Amazon.,CNBC Television,"Wed, 29 Oct 2025 11:57:18 -0400",[],AMZN
https://www.investors.com/news/technology/amazon-stock-q3-2025-earnings-preview-amzn-news/,Amazon Earnings Due Soon. Can AWS Answer Wall Street's AI Concerns?,Amazon stock is underperforming because of AI concerns.,Investors Business Daily,"Wed, 29 Oct 2025 11:51:49 -0400",['earnings'],AMZN
https://www.forbes.com/sites/pamdanziger/2025/10/29/amazon-and-target-job-cuts-reveal-how-ai-is-reshaping-the-retail-workforce/,Amazon And Target Job Cuts Reveal How AI Is Reshaping The Retail Workforce,"Retail job losses are running three times ahead of last year's pace through September, according to employment advisory firm Challenger, Gray and Christmas, and now Amazon and Target are becoming part of the broader trend. Each just announced plans to slash its corporate workforce up to 10%, with 31,800 jobs on the line.",Forbes,"Wed, 29 Oct 2025 10:55:08 -0400","['Layoffs', 'paylimitwall']",AMZN
https://247wallst.com/investing/2025/10/29/amazon-stock-amzn-price-prediction-and-forecast/?utm_source=snapi,Amazon Stock (NASDAQ: AMZN) Price Prediction and Forecast 2025-2030 for October 29,"Shares of Amazon.com Inc. (NASDAQ: AMZN) gained 4.81% over the past five trading sessions after gaining 1.43% the five prior, bringing the stock's year-to-date gain to 4.15%.",24/7 Wall Street,"Wed, 29 Oct 2025 10:44:37 -0400",[],AMZN
https://nypost.com/2025/10/29/business/amazon-fires-staffers-via-text-messages-during-round-of-14k-job-cuts-report/,Amazon fires staffers via early-morning text messages during round of 14K job cuts: report,"Two text messages sent out early Tuesday morning told some workers that their jobs had been eliminated, according to a report.",New York Post,"Wed, 29 Oct 2025 10:36:46 -0400",['Layoffs'],AMZN
https://www.businessinsider.com/amazon-layoffs-ai-tools-prove-efficiency-with-fewer-employees-2025-10,Amazon just made deep job cuts. Its AI tools now need to prove it can do more with less.,This post originally appeared in the Business Insider Today newsletter. You can sign up for Business Insider's daily newsletter here.,Business Insider,"Wed, 29 Oct 2025 09:55:55 -0400","['paywall', 'Layoffs']",AMZN
https://247wallst.com/investing/2025/10/29/wall-street-analyst-love-palantir-datadog-and-amazon-stocks-today/?utm_source=snapi,"Wall Street Analyst Love Palantir, Datadog and Amazon Stocks Today","Datadog (NASDAQ: DDOG): Bank of America reiterated a buy rating on DDOG ahead of the company's earnings on November 6, with a price target of $180, up from $175, due to growing confidence in the stock.",24/7 Wall Street,"Wed, 29 Oct 2025 09:03:22 -0400",[],AMZN
https://www.youtube.com/watch?v=7_y1kX4zj-U,Delevska on Mag 7: Positive Setup Into Earnings Season,Ivana Delevska joins Diane King Hall at the NYSE to preview the megacap tech stocks reporting earnings this week. She says A.I.,Schwab Network,"Wed, 29 Oct 2025 08:58:27 -0400",['earnings'],AMZN
https://www.barrons.com/articles/amazon-stock-price-anthropic-ai-7b49d063,Amazon Completes AI Supercomputer and Expands Anthropic Deal. What It Means for the Stock.,"Amazon said it has completed its Project Rainier data-center cluster, which is powered by nearly 500,000 of the company's Trainium 2 chips.",Barrons,"Wed, 29 Oct 2025 08:44:00 -0400",['paywall'],AMZN
https://www.reuters.com/business/retail-consumer/amazon-launches-ai-infrastructure-project-power-anthropics-claude-model-2025-10-29/,"Amazon launches AI infrastructure project, to power Anthropic's Claude model","Amazon.com said on Wednesday it has launched its compute cluster project called Rainier, and added that artificial intelligence firm Anthropic will use more than a million chips of the infrastructure by the end of the year.",Reuters,"Wed, 29 Oct 2025 08:18:16 -0400",[],AMZN
https://www.youtube.com/watch?v=jwgW_gHI1Vs,AWS CEO Matt Garman on Amazon's massive new AI data center for Anthropic,"Amazon's largest AI data center is now operational in New Carlisle, Indiana, with half a million AWS Trainium 2 chips entirely devoted to powering OpenAI rival Anthropic. Just over a year ago, the site was nothing but cornfields.",CNBC Television,"Wed, 29 Oct 2025 07:22:20 -0400",['CEO'],AMZN
https://www.cnbc.com/2025/10/29/amazon-opens-11-billion-ai-data-center-project-rainier-in-indiana.html,Amazon opens $11 billion AI data center in rural Indiana as rivals race to break ground,"Amazon has opened a data center on 1,200 acres of land in Indiana that's dedicated to training and running models from Anthropic. The $11 billion facility is up and operational, while most AI rivals are promising data centers of the future.",CNBC,"Wed, 29 Oct 2025 07:00:01 -0400",[],AMZN
https://www.marketwatch.com/story/why-amazons-stock-is-a-coiled-spring-ahead-of-earnings-according-to-analysts-53dca47f,"Why Amazon's stock is a ‘coiled spring' ahead of earnings, according to analysts",Amazon.com Inc.'s earnings report on Thursday could be the catalyst the stock needs to shake off its reputation as an artificial-intelligence laggard.,Market Watch,"Wed, 29 Oct 2025 06:30:00 -0400",['paylimitwall'],AMZN
https://www.businessinsider.com/amazon-layoffs-ai-job-apocalypse-white-collar-workers-2025-10,Amazon just kicked off the new era of giant AI layoffs,"On Tuesday, a collective shudder ran down the spine of America's white-collar workforce. Amazon announced it's laying off 14,000 employees in a memo that cited AI, kicking off a plan that the Wall Street Journal reports will affect as many as 30,000 corporate jobs.",Business Insider,"Wed, 29 Oct 2025 04:11:02 -0400","['paywall', 'Layoffs']",AMZN
https://www.fool.com/investing/2025/10/29/stock-market-make-break-test-fed-big-tech-earnings/,"The Stock Market Faces Make-or-Break Tests: The Fed's Interest-Rate Decision and Earnings From Alphabet, Amazon, Apple, Meta, and Microsoft","The S&P 500 has been in a bull market for more than three years, but the stock market could stumble, depending on the outcome of several important events this week. The Federal Reserve will announce its interest-rate decision on Wednesday, and five big technology companies will report earnings on Wednesday and Thursday.",The Motley Fool,"Wed, 29 Oct 2025 03:30:00 -0400",['earnings'],AMZN
https://invezz.com/news/2025/10/29/amazons-aws-to-fuel-south-koreas-ai-hub-with-new-5-billion-investment/?utm_source=snapi,Amazon's AWS to fuel South Korea's AI hub with new $5 billion investment,"Amazon Web Services (AWS) is set to channel another $5 billion into South Korea to expand its data center infrastructure, a major investment aimed at bolstering the nation's ambition to become a dominant force in the global artificial intelligence race.",Invezz,"Wed, 29 Oct 2025 03:06:39 -0400",[],AMZN
https://www.wsj.com/tech/ai/amazon-web-services-plans-additional-5-billion-ai-investment-in-south-korea-84802e84,Amazon Web Services Plans Additional $5 Billion AI Investment in South Korea,Amazon's cloud-computing arm plans to invest an additional $5 billion in South Korea over the next six years to build new artificial-intelligence data centers in the country.,WSJ,"Wed, 29 Oct 2025 00:31:00 -0400",['paywall'],AMZN
https://invezz.com/news/2025/10/29/amazon-target-ups-more-why-job-cuts-are-hitting-major-us-companies-in-2025/?utm_source=snapi,"Amazon, Target, UPS & more: why job cuts are hitting major US companies in 2025","The quiet spell in the US job market has broken. For months, it seemed like companies were holding their breath—not really hiring, but not firing either.",Invezz,"Tue, 28 Oct 2025 23:54:24 -0400",['Layoffs'],AMZN
https://www.reuters.com/business/retail-consumer/amazon-web-services-invest-least-5-billion-south-korea-by-2031-presidential-2025-10-29/,"Amazon Web Services to invest at least $5 billion in South Korea by 2031, presidential office says","Amazon Web Services will invest at least $5 billion in South Korea by 2031 to build new artificial intelligence data centres in the Asian country, South Korea's presidential office said on Wednesday.",Reuters,"Tue, 28 Oct 2025 21:58:48 -0400",[],AMZN
https://www.geekwire.com/2025/filing-amazon-cuts-more-than-2300-jobs-in-washington-state-as-part-of-broader-layoffs/,"Filing: Amazon cuts more than 2,300 jobs in Washington state as part of broader layoffs","Amazon will lay off 2,303 corporate employees in Washington state, primarily in its Seattle and Bellevue offices, according to a filing with the state Employment Security Department that provides a geographic breakdown of the company's 14,000 global job cuts.",GeekWire,"Tue, 28 Oct 2025 21:22:40 -0400",['Layoffs'],AMZN
https://www.youtube.com/watch?v=5Yw-kzkOdZo,"Tech Giants Power Market: MSFT, GOOGL, AMZN, AAPL & AMD Lead Charge","Technology stocks are on fire, with the SPX, NDX and $DJI hitting record highs. Olivier Blanchard attributes this surge to A.I.",Schwab Network,"Tue, 28 Oct 2025 20:00:06 -0400",[],AMZN
https://www.youtube.com/watch?v=r5XyY4cxaKk,Jim Cramer: 'I like that Amazon's never done trying to make you money',"‘Mad Money' host Jim Cramer breaks down why Amazon is a good stock to own for the long term, his take on the tech giant's recent corporate layoffs, and more.",CNBC Television,"Tue, 28 Oct 2025 19:33:41 -0400","['cramer', 'madmoney']",AMZN
https://www.youtube.com/watch?v=lIR2-GiAMgI,Jim Cramer explains why he's sticking with Amazon,"‘Mad Money' host Jim Cramer breaks down why Amazon is a good stock to own for the long term, his take on the tech giant's recent corporate layoffs, and more.",CNBC Television,"Tue, 28 Oct 2025 19:20:30 -0400","['cramer', 'madmoney']",AMZN
https://www.marketwatch.com/story/why-companies-like-amazon-ups-are-getting-bolder-about-layoffs-after-months-of-watching-and-waiting-a9b0981d,"Why companies like Amazon, UPS are getting bolder about layoffs after months of watching and waiting","Analysts have called it the “no-hire, no-fire” economy. But the thousands of job cuts announced by Amazon.com Inc. and United Parcel Service Inc. on Tuesday may suggest that the U.S. job market's current state of suspension has changed for the worse.",Market Watch,"Tue, 28 Oct 2025 17:51:00 -0400","['Layoffs', 'paylimitwall']",AMZN
https://www.businessinsider.com/amazon-layoffs-hit-mgm-studios-jobs-cut-gen-ai-2025-10,Amazon's TV and movie arm was hit during the company's broad layoffs. Here's what we know.,"Amazon MGM Studios was affected as part of Amazon's layoffs of 14,000 employees. Some big names impacted included a head of casting and TV execs.",Business Insider,"Tue, 28 Oct 2025 17:50:41 -0400","['paywall', 'Layoffs']",AMZN
https://www.zacks.com/commentary/2779449/buy-the-mag-7-laggards-as-earnings-approach-amzn-aapl?cid=CS-STOCKNEWSAPI-FT-investment_ideas-2779449,"Buy the Mag 7 Laggards as Earnings Approach?: AMZN, AAPL","Set to release their quarterly reports after-market hours on Thursday, October 30, Amazon and Apple stock have been the laggards of the Mag 7 this year.",Zacks Investment Research,"Tue, 28 Oct 2025 17:46:06 -0400",['earnings'],AMZN
https://www.businessinsider.com/amazon-layoffs-employees-early-morning-text-messages-2025-10,Amazon laid off some employees with early-morning text messages,"Amazon laid off 14,000 employees on Tuesday. Some employees learned about their termination through early-morning text messages.",Business Insider,"Tue, 28 Oct 2025 17:38:08 -0400","['paywall', 'Layoffs']",AMZN
https://www.youtube.com/watch?v=5sn1H_E2azQ,"Tuesday's Final Takeaways: NVDA Surge, AMZN Layoffs & Tariff Watch","Nvidia (NVDA) rallied strong to all-time highs during its GTC conference while Amazon (AMZN) moved higher despite facing a big wave of corporate layoffs. It's not just stock movers that Marley Kayden and Diane King Hall are watching, either.",Schwab Network,"Tue, 28 Oct 2025 17:00:14 -0400",['Layoffs'],AMZN
https://www.marketwatch.com/story/the-magnificent-seven-have-never-been-this-important-to-the-stock-market-and-a-big-test-lies-ahead-87db8caf,The ‘Magnificent Seven' have never been this important to the stock market — and a big test lies ahead,"The stock market is getting ever-more reliant on the “Magnificent Seven,” raising the stakes for a jam-packed week of technology earnings that could decide whether Wall Street's momentum has more room to run.",Market Watch,"Tue, 28 Oct 2025 16:46:00 -0400",['paylimitwall'],AMZN
https://www.investopedia.com/here-s-why-amazon-says-it-s-cutting-14-000-workers-while-it-s-performing-well-11838356,"Here's Why Amazon Says It's Cutting 14,000 Workers While It's 'Performing Well'",More big job cuts are coming at Amazon.,Investopedia,"Tue, 28 Oct 2025 16:45:41 -0400",[],AMZN
https://www.forbes.com/sites/katehardcastle/2025/10/28/what-amazons-biggest-ever-layoffs-tell-us-about-uk-retail-and-consumer-mood/,What Amazon's Biggest-Ever Layoffs Tell Us About UK Retail And Consumer Mood,"As Amazon announces plans to cut up to 30,000 corporate roles globally, almost a tenth of its corporate workforce, it delivers a stark reminder that even scale offers no immunity in today's economy.",Forbes,"Tue, 28 Oct 2025 16:05:06 -0400","['Layoffs', 'paylimitwall']",AMZN
https://www.fool.com/investing/2025/10/28/amazon-announces-a-4-workforce-reduction-cutting-1/,"Amazon Announces a 4% Workforce Reduction, Cutting 14,000 Jobs. Here's What Investors Need to Know.",Amazon stock is underperforming the Nasdaq Composite this year. The company is under pressure in its e-commerce and cloud computing divisions.,The Motley Fool,"Tue, 28 Oct 2025 16:02:15 -0400",['Layoffs'],AMZN
https://www.benzinga.com/markets/large-cap/25/10/48477499/amazon-ups-slash-desk-jobs-ai-is-coming-for-your-manager?utm_source=snapi,"Amazon, UPS Slash Desk Jobs: AI Is Coming For Your Manager","Major corporations including Amazon.com, Inc. (NASDAQ:AMZN) and United Parcel Service, Inc. (NYSE:UPS) have recently announced significant layoffs, highlighting an accelerated shift toward AI-driven automation that is transforming corporate structures.",Benzinga,"Tue, 28 Oct 2025 15:47:21 -0400","['paywall', 'Layoffs']",AMZN
https://www.investopedia.com/how-much-traders-expect-amazon-stock-to-move-after-earnings-q3-2025-11838456,Here's How Much Traders Expect Amazon Stock To Move After Earnings,"Amazon (AMZN) is slated to report third-quarter earnings after the closing bell on Thursday, and some traders are betting the results can give the stock, the laggard of the Magnificent Seven so far this year, a big boost.",Investopedia,"Tue, 28 Oct 2025 15:35:42 -0400",['earnings'],AMZN
https://www.cnet.com/tech/services-and-software/amazon-cuts-14000-jobs-amid-ai-push/,"Amazon Cuts 14,000 Jobs Amid AI Push","The company reportedly plans on laying off up to 30,000 workers.",CNET,"Tue, 28 Oct 2025 15:18:37 -0400",['Layoffs'],AMZN
https://deadline.com/2025/10/amazon-mgm-studios-executives-layoffs-1236600383/,More Amazon MGM Studios Executives Impacted By Layoffs,"More names are starting to emerge of Amazon MGM Studios executives affected by the sweeping companywide layoffs today. They include Nathan Kitada, Senior Creative Executive, Tentpole & Universe Development. He has been at the studio for more than three years, working on Criminal, starring Charlie Hunnam, and other genre and MGM IP development.",Deadline,"Tue, 28 Oct 2025 15:15:44 -0400",['Layoffs'],AMZN
https://www.youtube.com/watch?v=YU02j175-7A,Big Tech earnings this week: What investors should expect,"With five of the Big Tech giants reporting this week, Jessica Inskip weighs in on what the numbers could mean for AI demand and the market rally. Transcript: Caroline Woods: In terms of tech earnings, we have five of the big 7 on deck this week.",The Street,"Tue, 28 Oct 2025 15:00:47 -0400",['earnings'],AMZN
https://www.businessinsider.com/amazon-layoffs-hit-retail-managers-hardest-aws-could-be-next-2025-10,Internal Amazon data shows retail managers hardest hit by US job cuts. Employees worry AWS could be next.,"Amazon said it's cutting 14,000 corporate jobs on Tuesday. Internal data shows early to mid-level managers in the retail unit were most severely affected.",Business Insider,"Tue, 28 Oct 2025 14:28:02 -0400","['paywall', 'Layoffs']",AMZN
https://www.youtube.com/watch?v=NIo1kK-nRB0,Amazon spends billions on AI arms race as it guts corporate ranks,"CNBC's MacKenzie Sigalos reports on how Amazon is spending tens of billions on data centers, chips, and AI infrastructure — even as it cuts thousands of white-collar jobs and warns of more layoffs through 2026.",CNBC Television,"Tue, 28 Oct 2025 14:19:37 -0400",[],AMZN
https://www.benzinga.com/analyst-stock-ratings/reiteration/25/10/48473849/the-big-3-tech-playbook-why-apple-amazon-and-microsoft-keep-winning?utm_source=snapi,"The 'Big 3' Tech Playbook: Why Apple, Amazon And Microsoft Keep Winning","Amazon.com Inc. (NASDAQ:AMZN) is expected to post steady third-quarter gains powered by strong cloud, advertising, and retail performance.",Benzinga,"Tue, 28 Oct 2025 14:19:36 -0400",['paywall'],AMZN
https://www.zacks.com/stock/news/2779339/amazon-set-to-report-q3-earnings-should-investors-buy-the-stock?cid=CS-STOCKNEWSAPI-FT-analyst_blog|most_popular_stocks-2779339,Amazon Set to Report Q3 Earnings: Should Investors Buy the Stock?,"AMZN's AWS growth, AI innovations, and e-commerce momentum position steady Q3 2025. Diversified revenue streams support buying ahead of earnings.",Zacks Investment Research,"Tue, 28 Oct 2025 13:56:10 -0400",['earnings'],AMZN
https://deadline.com/2025/10/amazon-job-cuts-hit-video-games-division-1236600254/,Amazon Job Cuts Hit Video Games Division As Strategy Leans Into What “Amazon Does Best”,"Video game development and publishing are taking a hit in a wave of layoffs at Amazon today, including the company's San Diego and Irvine studios as the division's head said it's taking “a critical look at the evolving dynamics of games industry.",Deadline,"Tue, 28 Oct 2025 13:51:29 -0400",['Layoffs'],AMZN
https://www.businessinsider.com/amazon-layoffs-what-we-know-teams-roles-affected-job-cuts-2025-10,"Amazon layoffs: What we know so far about the teams and roles affected, from internal messages","Amazon plans to cut 14,000 corporate jobs to become leaner in the AI era, the company announced. Audible CEO Bob Carrigan addressed the cuts to its audiobook division in an email to employees.",Business Insider,"Tue, 28 Oct 2025 13:13:09 -0400","['paywall', 'Layoffs']",AMZN
https://www.youtube.com/watch?v=8CKKVsh6E_k,"Amazon targets middle managers in mass layoffs, memo suggests more cuts coming as AI thins Big Tech","CNBC's MacKenzie Sigalos reports on Amazon cutting 14,000 corporate jobs — with more expected through 2026 — as it flattens management layers and shifts resources to data centers, chips, and AI infrastructure.",CNBC Television,"Tue, 28 Oct 2025 13:12:05 -0400",['Layoffs'],AMZN
https://www.businessinsider.com/read-the-email-amazon-is-sending-to-laid-off-employees-2025-10,Read the email Amazon is sending to laid-off employees,"Amazon plans to cut 14,000 corporate jobs, the company announced Tuesday. Amazon started notifying affected employees, according to internal messages.",Business Insider,"Tue, 28 Oct 2025 11:11:10 -0400",['paywall'],AMZN
https://www.businessinsider.com/amazon-cuts-jobs-at-audible-read-the-ceos-to-employees-2025-10,Amazon cuts jobs at Audible. Read the memo its CEO sent outlining an upcoming reorganization of the audiobook unit.,"Amazon is laying off Audible staff as part of wider plans to cut 14,000 corporate jobs. The layoffs aim to boost ""focus and speed"" in its key growth areas, Audible's CEO said in a memo.",Business Insider,"Tue, 28 Oct 2025 11:00:44 -0400","['CEO', 'paywall', 'Layoffs']",AMZN
https://www.zacks.com/stock/news/2779001/why-amazon-amzn-is-a-top-momentum-stock-for-the-long-term?cid=CS-STOCKNEWSAPI-FT-tale_of_the_tape|zacks_education_momentum_score-2779001,Why Amazon (AMZN) is a Top Momentum Stock for the Long-Term,"Whether you're a value, growth, or momentum investor, finding strong stocks becomes easier with the Zacks Style Scores, a top feature of the Zacks Premium research service.",Zacks Investment Research,"Tue, 28 Oct 2025 10:51:12 -0400",[],AMZN
https://www.barrons.com/articles/fed-ai-jobs-amazon-e6614824,The Fed Is Looking for Signals From Job Market. Amazon May Have Sent a Message.,Big jobs cuts at the online retailer offer a glimpse into the future.,Barrons,"Tue, 28 Oct 2025 10:51:00 -0400",['paywall'],AMZN
https://www.globenewswire.com/news-release/2025/10/28/3175630/0/en/Former-Amazon-Care-Executive-Dr-Sunita-Mishra-Joins-Heald-s-Advisory-Board-to-Accelerate-Expansion-Across-Employers-and-Provider-Networks.html,Former Amazon Care Executive Dr. Sunita Mishra Joins Heald's Advisory Board to Accelerate Expansion Across Employers and Provider Networks,"ALPHARETTA, Ga., Oct. 28, 2025 (GLOBE NEWSWIRE) -- Heald, the human-led, tech-enabled platform redefining Diabetes care, proudly announces that Dr. Sunita Mishra, former Chief  Medical Officer of Amazon Health services and CMO for  Amazon Care, has joined as an Advisory Board Member. In this role, Dr. Mishra will advise on Heald's expansion into the employer, provider, and health system markets, bringing her deep expertise in scaling hybrid care models that connect digital technology with real human care. Dr. Mishra brings over two decades of experience at the intersection of clinical practice, consumer innovation, and large-scale healthcare delivery. At Amazon Care, she was instrumental in building and scaling  the company's hybrid primary care model for employers, integrating virtual and in-person care to improve access, convenience, and measurable outcomes. At Amazon Health Services, she focused on using artificial intelligence (AI) and cloud technologies to make healthcare more predictive, personalized, and efficient, a vision that aligns closely with Heald's mission of data-driven, human-led care. Before that, she served as Chief Executive of Express Care and Vice President of Consumer Innovation at Providence Health & Services, where she led initiatives to make care more patient-centered and digitally accessible.",GlobeNewsWire,"Tue, 28 Oct 2025 10:30:00 -0400",['PressRelease'],AMZN
https://www.youtube.com/watch?v=s_6R0DxftKg,"Amazon Will Cut 14,000 Jobs as AI Takes on Bigger Role","Amazon.com Inc. plans to eliminate roughly 14,000 corporate jobs just months after Chief Executive Officer Andy Jassy warned that AI will shrink the company's workforce.  Reuters reported earlier that as many as 30,000 people would lose their jobs.",Bloomberg Markets and Finance,"Tue, 28 Oct 2025 10:15:59 -0400",['Layoffs'],AMZN
https://247wallst.com/investing/2025/10/28/wall-street-is-pounding-the-table-over-aapl-amzn-qcom-gfi-msft/?utm_source=snapi,"Wall Street is Pounding the Table Over AAPL, AMZN, QCOM, GFI, MSFT",The image featured for this article is © ene / Shutterstock.com,24/7 Wall Street,"Tue, 28 Oct 2025 10:03:50 -0400",[],AMZN
https://www.youtube.com/watch?v=pRwVtM0d4y0,"Trump announces US-Japan trade deal, Amazon to lay off thousands","Morning Brief: Market Sunrise anchor Ramzan Karmali breaks down the latest market news for October 28, 2025. President Trump met with Japan's new Prime Minister Sanae Takaichi while on the US leader's trip through Asia.",Yahoo Finance,"Tue, 28 Oct 2025 10:01:03 -0400",['Layoffs'],AMZN
https://techxplore.com/news/2025-10-amazon-lay-corporate-employees.html,"Amazon may lay off 30,000 corporate employees","Amazon plans to lay off as many as 30,000 corporate employees this week, Reuters first reported on Oct. 27, citing anonymous sources.",TechXplore,"Tue, 28 Oct 2025 10:00:06 -0400",['Layoffs'],AMZN
https://www.youtube.com/shorts/k_sg79Hz_SI,"Amazon laying off about 14,000 corporate workers as it invests more in AI.","Amazon said Tuesday that it will lay off about 14,000 corporate employees, marking the latest cuts in the company's multiyear effort to rein in costs. In a blog post, the company wrote that the layoffs are being carried out to help make the company leaner and less bureaucratic, while it looks to invest in “our biggest bets” including generative artificial intelligence.",CNBC Television,"Tue, 28 Oct 2025 09:59:13 -0400",['Layoffs'],AMZN
https://www.youtube.com/watch?v=utuYpBL-4cE,"Final Trades: Alphabet, Amazon and Lam Research",The Investment Committee give you their top stocks to watch for the second half.,CNBC Television,"Tue, 28 Oct 2025 09:55:04 -0400",[],AMZN
