news_url,title,text,source_name,date,topics,tickers
https://www.zacks.com/commentary/2784944/is-amazon-stock-primed-to-keep-soaring-or-is-a-pullback-ahead?cid=CS-STOCKNEWSAPI-FT-investment_ideas-2784944,Is Amazon Stock Primed to Keep Soaring or is a Pullback Ahead?,"Fears that stocks are becoming overvalued led to a broader market selloff on Tuesday, and investors may be eying Amazon stock as a buy-the-dip target.",Zacks Investment Research,"Tue, 04 Nov 2025 18:56:15 -0500",[],AMZN
https://www.pymnts.com/artificial-intelligence-2/2025/amazon-and-perplexity-clash-over-deployment-of-third-party-ai-shopping-agents/?utm_source=snapi,Amazon and Perplexity Clash Over Deployment of Third-Party AI Shopping Agents,Amazon and artificial intelligence (AI) startup Perplexity are in a dispute over the deployment of third-party AI agents for shopping. Perplexity said in a Tuesday (Nov.,PYMNTS,"Tue, 04 Nov 2025 18:51:38 -0500",[],AMZN
https://techcrunch.com/2025/11/04/amazon-sends-legal-threats-to-perplexity-over-agentic-browsing/,Amazon sends legal threats to Perplexity over agentic browsing,"Amazon has told Perplexity to get its agentic browser out of its online store, the companies both confirmed publicly on Tuesday. After warning Perplexity multiple times that Comet, its AI-powered shopping assistant, was violating Amazon's terms of service by not identifying itself as an agent, the ecommerce giant sent the AI search engine startup a sternly worded cease-and-desist letter, Perplexity wrote in a blog post entitled “Bullying is not innovation.",TechCrunch,"Tue, 04 Nov 2025 18:05:04 -0500",[],AMZN
https://www.proactiveinvestors.com/companies/news/1081789?SNAPI,Perplexity faces legal challenge from Amazon over AI shopping assistant,"Amazon.com Inc (NASDAQ:AMZN) has issued a cease-and-desist letter to Perplexity AI, alleging that the startup's browser-based assistant, Comet, violated its terms of service by making purchases on Amazon without authorization. According to Amazon, Comet acted on behalf of users to place orders without identifying itself, which the company claims amounted to computer fraud and breached its retail policies, which prohibit data mining, automated bots, or similar software tools from accessing or transacting on its platform.",Proactive Investors,"Tue, 04 Nov 2025 15:34:59 -0500",[],AMZN
https://www.fool.com/investing/2025/11/04/openai-ceo-sam-altman-delivered-fantastic-news-to/,OpenAI CEO Sam Altman Just Delivered Fantastic News to Amazon Investors,"Over the last several months, OpenAI migrated away from a heavy reliance on Microsoft Azure. The ChatGPT maker previously signed large-scale deals with Google Cloud and Oracle's cloud infrastructure.",The Motley Fool,"Tue, 04 Nov 2025 15:29:31 -0500",['CEO'],AMZN
https://www.fool.com/investing/2025/11/04/should-you-buy-amazon-after-its-deal-with-openai/,Should You Buy Amazon After Its Deal With OpenAI?,OpenAI just signed a multibillion-dollar deal with Amazon's cloud business for access to AI chips. Amazon Web Services is the world's biggest cloud provider and has been investing massively in AI.,The Motley Fool,"Tue, 04 Nov 2025 15:15:00 -0500",[],AMZN
https://www.youtube.com/watch?v=6HM-q_-OlVI,Amazon sends Perplexity cease-and-desist over AI browser agents making purchases,CNBC's MacKenzie Sigalos reports on news regarding Perplexity.,CNBC Television,"Tue, 04 Nov 2025 15:07:46 -0500",[],AMZN
https://www.reuters.com/business/retail-consumer/perplexity-receives-legal-threat-amazon-over-agentic-ai-shopping-tool-2025-11-04/,Perplexity receives legal threat from Amazon over agentic AI shopping tool,Perplexity AI said on Tuesday it has received a legal threat from Amazon.com demanding that the startup block the AI agent on its Comet browser from shopping on the ecommerce giant's platform on a user's behalf.,Reuters,"Tue, 04 Nov 2025 14:16:04 -0500",[],AMZN
https://www.cnbc.com/2025/11/04/perplexity-ai-amazon-bullying-comet-browser.html,Perplexity AI accuses Amazon of bullying with legal threat over Comet browser,"Perplexity AI accused Amazon of ""bullying"" after it received a letter from the e-commerce giant. Amazon wants Perplexity to prevent its users from using its AI browser called Comet to make purchases on their behalf, the startup said.",CNBC,"Tue, 04 Nov 2025 14:13:58 -0500",[],AMZN
https://www.cnbc.com/2025/11/04/amazon-backed-evtol-beta-opens-on-new-york-stock-exchange-after-ipo.html,Amazon-backed eVTOL company Beta Technologies debuts at $34 on NYSE,"Beta Technologies, which makes electric aircrafts, opened at $34 in its New York Stock Exchange debut on Tuesday. The company raised over $1 billion in its IPO, selling shares at $34 each, above the expected range.",CNBC,"Tue, 04 Nov 2025 14:12:44 -0500",[],AMZN
https://www.zacks.com/stock/news/2784845/earnings-estimates-moving-higher-for-amazon-amzn-time-to-buy?cid=CS-STOCKNEWSAPI-FT-tale_of_the_tape|yseop_template_8-2784845,Earnings Estimates Moving Higher for Amazon (AMZN): Time to Buy?,"Amazon (AMZN) shares have started gaining and might continue moving higher in the near term, as indicated by solid earnings estimate revisions.",Zacks Investment Research,"Tue, 04 Nov 2025 13:21:14 -0500",['earnings'],AMZN
https://www.zacks.com/stock/news/2784484/4-cloud-computing-stocks-to-bet-on-amid-widespread-adoption?cid=CS-STOCKNEWSAPI-FT-cloud_computing-2784484,4 Cloud Computing Stocks to Bet on Amid Widespread Adoption,"MSFT, GOOGL, AMZN and IBM are indispensable cloud computing stocks for any investment portfolio.",Zacks Investment Research,"Tue, 04 Nov 2025 10:26:07 -0500",[],AMZN
https://www.marketwatch.com/story/this-ge-amazon-backed-electric-plane-maker-sees-strong-demand-for-its-ipo-d0fbb674,"This GE, Amazon-backed electric-plane maker sees strong demand for its IPO",Vermont-based Beta Technologies prices its IPO above its estimated range and adds shares to generate proceeds of $1 billion as it builds sales of its battery-powered aircraft with backing from GE Aerospace.,Market Watch,"Tue, 04 Nov 2025 10:23:00 -0500",['paylimitwall'],AMZN
https://www.zacks.com/stock/news/2784429/amazon-just-landed-a-38-billion-openai-deal-your-signal-to-watch-3-etfs?cid=CS-STOCKNEWSAPI-FT-etf_news_and_commentary-2784429,Amazon Just Landed a $38 Billion OpenAI Deal: Your Signal to Watch 3 ETFs,"AMZN's $38B cloud deal with OpenAI sends AMZN shares up 4%, spotlighting ETFs like ONLN with heavy Amazon exposure for AI-driven growth.",Zacks Investment Research,"Tue, 04 Nov 2025 10:11:39 -0500",[],AMZN
https://www.zacks.com/stock/news/2784403/investors-heavily-search-amazon-com-inc-amzn-here-is-what-you-need-to-know?cid=CS-STOCKNEWSAPI-FT-tale_of_the_tape|most_searched_stocks-2784403,"Investors Heavily Search Amazon.com, Inc. (AMZN): Here is What You Need to Know","Amazon (AMZN) has been one of the stocks most watched by Zacks.com users lately. So, it is worth exploring what lies ahead for the stock.",Zacks Investment Research,"Tue, 04 Nov 2025 10:01:19 -0500",[],AMZN
https://www.businesswire.com/news/home/20251103388237/en/Infios-and-Amazon-Web-Services-Inc.-AWS-Join-Forces-to-Transform-Supply-Chain-Execution-with-Agentic-AI/,"Infios and Amazon Web Services, Inc. (AWS) Join Forces to Transform Supply Chain Execution with Agentic AI","MINNEAPOLIS--(BUSINESS WIRE)--Infios, a global leader in intelligent supply chain execution, today announced a collaboration with AWS to integrate generative-AI agents into Infios Order Management (Infios OM). The partnership with the AWS Generative AI Innovation Center reinforces Infios's leadership in defining the next era of supply chain. Infios OM serves as the brain of the supply chain. It addresses evolving customer speed and convenience needs, viral channel expansion and demand shifts wh.",Business Wire,"Tue, 04 Nov 2025 10:00:00 -0500",['PressRelease'],AMZN
https://www.fool.com/investing/2025/11/04/62-of-us-adults-own-stock-here-are-6-i-think-every/,62% of U.S. Adults Own Stock. Here Are 6 That I Think Everyone Should Have in Their Portfolios.,"Berkshire Hathaway is well-diversified, was built to last, and will soon have a new leader. Costco has a winning business model for its employees, customers, and shareholders.",The Motley Fool,"Tue, 04 Nov 2025 09:30:00 -0500",[],AMZN
https://seekingalpha.com/article/4837197-amazon-could-still-be-the-most-undervalued-magnificent-seven-company,Amazon Could Still Be The Most Undervalued Magnificent Seven Company,"Amazon delivered a standout Q3 2025, with AWS growth reaccelerating to 20% YoY and strong advancements in AI and robotics. AMZN's operational efficiency is improving, with cash from operations up 78% YoY and significant investments in AI, robotics, and fulfillment driving future margin expansion. If AMZN achieves 20% operating margins by 2029, it could generate $200 billion in operating income and potentially reach a $5–$7.5 trillion market cap.",Seeking Alpha,"Tue, 04 Nov 2025 08:45:00 -0500",['paylimitwall'],AMZN
https://www.cnbc.com/2025/11/04/white-collar-layoffs-ai-cost-cutting-tariffs.html,"Behind the wave of white-collar layoffs: Old-school cost cutting, tariffs and, yes, AI","Corporate giants Amazon, UPS and Target each announced layoffs in recent weeks totaling more than 60,000 jobs cut this year. In the absence of the Bureau of Labor Statistics' monthly jobs report, the layoff announcements have raised questions about the strength of the labor market and if it's the start of an AI-driven, white-collar recession.",CNBC,"Tue, 04 Nov 2025 08:16:02 -0500",['Layoffs'],AMZN
https://www.marketbeat.com/stock-ideas/amazon-vs-apple-which-mag-7-is-the-better-buy/?utm_source=snapi,Amazon vs. Apple: Which Mag 7 Is the Better Buy?,"It's been a lackluster year for Amazon NASDAQ: AMZN and Apple NASDAQ: AAPL. While both outperformed the S&P 500 over the past 12 months, their returns fell short of investor expectations in a bull market supercharged by artificial intelligence enthusiasm.",MarketBeat,"Tue, 04 Nov 2025 08:10:09 -0500",[],AMZN
https://www.fool.com/investing/2025/11/04/should-investors-buy-amazon-stock-right-now/,Should Investors Buy Amazon Stock Right Now?,Amazon's (AMZN +3.99%) stock price is up over 10% following fantastic quarterly results.,The Motley Fool,"Tue, 04 Nov 2025 08:00:00 -0500",['podcast'],AMZN
https://www.fool.com/investing/2025/11/04/2-top-growth-stocks-to-buy-hand-over-fist-in-nov/,2 Top Growth Stocks to Buy Hand Over Fist in November,"Tech companies are beginning to incorporate AI and robotics into their business models. At Amazon, new automation technologies have unlocked the potential for further growth.",The Motley Fool,"Tue, 04 Nov 2025 06:15:00 -0500",['StocksToWatch'],AMZN
https://www.fool.com/investing/2025/11/04/if-youd-bought-1-share-of-amazon-at-its-ipo-heres/,"If You'd Bought 1 Share of Amazon at Its IPO, Here's How Many Shares You Would Own Now","Amazon went public in mid-1997 for $18 per share. However, the stock has completed four splits since that time.",The Motley Fool,"Tue, 04 Nov 2025 06:11:00 -0500",[],AMZN
https://www.reuters.com/business/retail-consumer/amazons-38-bln-openai-deal-shows-it-is-no-longer-an-ai-laggard-2025-11-04/,Amazon's $38 bln OpenAI deal shows it is no longer an AI laggard,"Amazon's $38 billion cloud deal with OpenAI marks a major endorsement for the e-commerce giant's cloud business after recent setbacks, including ceding market share to rivals and an outage that disrupted large parts of the internet.",Reuters,"Tue, 04 Nov 2025 06:05:36 -0500",[],AMZN
https://seekingalpha.com/article/4837276-heartland-opportunistic-value-equity-strategy-q3-2025-portfolio-activity,Heartland Opportunistic Value Equity Strategy Q3 2025 Portfolio Activity,"During the quarter, we initiated a position in the online retailer and cloud computing giant Amazon. We purchased additional shares of Alphabet in 2022 and again this April, when, in our opinion, shares were meaningfully undervalued. Our worst-performing holding in the quarter was Centene.",Seeking Alpha,"Tue, 04 Nov 2025 05:00:00 -0500",['paylimitwall'],AMZN
https://www.fool.com/investing/2025/11/04/the-smartest-stocks-to-buy-with-1000-right-now/,"The Smartest Stocks to Buy With $1,000 Right Now",The AI megatrend is just getting started. Amazon is poised to improve its margins from two key business units.,The Motley Fool,"Tue, 04 Nov 2025 05:00:00 -0500",['StocksToWatch'],AMZN
https://www.fool.com/investing/2025/11/04/amazon-soars-aws-growth--too-late-buy-stock/,Amazon Soars as AWS Growth Accelerates. Is It Too Late to Buy the Stock?,"Amazon turned in strong third-quarter results, led by growth at AWS. Meanwhile, its e-commerce operations continue to see strong operating leverage.",The Motley Fool,"Tue, 04 Nov 2025 04:50:00 -0500",[],AMZN
https://www.proactiveinvestors.co.uk/companies/news/1081728?SNAPI,OpenAI taps Amazon's muscle in $38bn pact as AI power race accelerates,"Build the factories and the boom will follow: that is OpenAI's bet as it inks a $38 billion agreement to run its systems on Amazon Web Services, part of a mammoth plan to secure more than $1 trillion of computing capacity. The deal gives OpenAI immediate access to AWS datacentres and the Nvidia processors inside them, the specialist chips that train and run models such as ChatGPT.",Proactive Investors,"Tue, 04 Nov 2025 03:21:52 -0500",[],AMZN
https://www.fool.com/investing/2025/11/04/prediction-this-unstoppable-stock-will-join-nvidia/,Prediction: This Unstoppable Stock Will Join Nvidia and Apple in the $4 Trillion Club Before 2029,"Amazon is unique in that it leads two industries and is a strong contender in a third. Investors continue to underestimate the company's extensive reach, even as it positions itself for future success.",The Motley Fool,"Tue, 04 Nov 2025 03:02:00 -0500",[],AMZN
https://invezz.com/news/2025/11/04/amazons-power-struggle-in-oregon-reveals-the-dark-side-of-americas-ai-boom/?utm_source=snapi,Amazon's power struggle in Oregon reveals the dark side of America's AI boom,"Amazon.com Inc. has accused PacifiCorp, a utility owned by Berkshire Hathaway Inc., of failing to deliver enough electricity to support four new data centres in Oregon.",Invezz,"Tue, 04 Nov 2025 02:04:27 -0500",[],AMZN
https://www.zacks.com/stock/news/2784088/does-the-market-have-bad-breadth?cid=CS-STOCKNEWSAPI-FT-ahead_of_wall_street-2784088,Does the Market Have Bad Breadth?,"Monday, November 3, 2025 Market indexes started the trading week bifurcated this morning, and bifurcated they stayed through the course of the session. The Nasdaq, once again the leading index in 2025, over the last six months and most prominently over the last week or so of trading, led the way again today: +108 points, +0.46%.",Zacks Investment Research,"Mon, 03 Nov 2025 23:57:10 -0500",[],AMZN
https://seekingalpha.com/article/4837177-amazon-stock-q3-surprising-results-from-retail-indicate-strong-upside-potential-double-upgrade,Amazon Q3: Surprising Results From Retail Indicate Strong Upside Potential (Double-Upgrade),Amazon previously rated as Hold due to valuation and growth concerns. Recent developments suggest improved fundamentals and potential for accelerated revenue growth. The retail segments' contribution to operational efficiency as of Q3 has broken my Hold thesis from April.,Seeking Alpha,"Mon, 03 Nov 2025 22:50:22 -0500","['earnings', 'paylimitwall']",AMZN
https://www.youtube.com/watch?v=WOIlpNUojAw,OpenAI bets on Nvidia and Amazon in new cloud deal,"CNBC's MacKenzie Sigalos reports on OpenAI's first-ever compute deal with Amazon Web Services, choosing Nvidia chips over in-house options as it ramps up infrastructure beyond Microsoft Azure and Google Cloud.",CNBC Television,"Mon, 03 Nov 2025 22:29:20 -0500",[],AMZN
https://www.youtube.com/watch?v=8P4OzN_IhVw,Amazon hits new record high after partnering with OpenAI,CNBC's MacKenzie Sigalos reports on Amazon's record-setting rally after signing a $38 billion cloud deal with OpenAI.,CNBC Television,"Mon, 03 Nov 2025 22:14:53 -0500",[],AMZN
https://www.benzinga.com/markets/tech/25/11/48610228/amazon-strikes-38b-openai-deal-wedbush-hikes-target-to-street-high?utm_source=snapi,"Amazon Strikes $38B OpenAI Deal, Wedbush Hikes Target To Street-High","Amazon.com, Inc. (NASDAQ:AMZN) shares climbed Monday after the company announced a $38 billion multi-year partnership with OpenAI for AWS to provide computing infrastructure to support OpenAI's artificial intelligence workloads.",Benzinga,"Mon, 03 Nov 2025 19:28:56 -0500",['paywall'],AMZN
https://www.forbes.com/sites/martinacastellanos/2025/11/04/amazon-targets-perplexitys-ai-agent-startup-fires-back-says-bullying-is-not-innovation/,"Amazon Targets Perplexity's AI Agent—Startup Fires Back, Says ‘Bullying Is Not Innovation'","Amazon has sent a cease-and-desist letter accusing Perplexity AI of using its Comet browser agent to make purchases on Amazon without authorization, prompting Perplexity to fire back with a public statement alleging bullying and intimidation from the e-commerce juggernaut.",Forbes,"Mon, 03 Nov 2025 19:25:06 -0500",['paylimitwall'],AMZN
https://www.youtube.com/watch?v=VL8otGGexw4,"Final Trade: PSX, GM, AMZN, LMND",The final trades of the day with CNBC's Melissa Lee and the Fast Money traders.,CNBC Television,"Mon, 03 Nov 2025 18:27:03 -0500",[],AMZN
https://www.youtube.com/watch?v=iAmDxScB_xE,Amazon stock jumps after announcing $38 billion partnership with OpenAI,"Amazon announced a $38 billion deal with OpenAI, giving OpenAI access both to Amazon's cloud infrastructure and Nvidia's (NVDA) artificial intelligence technology. Yahoo Finance Technology Editor Dan Howley joins Market Domination with Yahoo Finance Senior Reporter Allie Canal to go over the details.",Yahoo Finance,"Mon, 03 Nov 2025 17:44:44 -0500",[],AMZN
https://www.youtube.com/watch?v=r3k3ULy_9po,Big Tech Stocks Jump on Amazon AI Deal | Closing Bell,"Comprehensive cross-platform coverage of the U.S. market close on Bloomberg Television, Bloomberg Radio, and YouTube with Romaine Bostick, Scarlet Fu, Carol Massar and Tim Stenovec.",Bloomberg Markets and Finance,"Mon, 03 Nov 2025 17:41:15 -0500",['marketclose'],AMZN
https://www.youtube.com/shorts/2HEhxxII9e8,"OpenAI signs $38 billion deal with Amazon, partnering with cloud leader for the first time","OpenAI has signed a $38 billion deal with Amazon Web Services, and will immediately start accessing Nvidia's graphics processing units. CNBC's MacKenzie Sigalos explains how it's one of OpenAI's biggest moves away from Microsoft, which was the company's exclusive cloud provider until earlier this year.",CNBC Television,"Mon, 03 Nov 2025 17:39:56 -0500",[],AMZN
https://www.fool.com/investing/2025/11/03/why-did-amazon-stock-jump-5-today/,Why Did Amazon Stock Jump 5% Today?,OpenAI will purchase $38 billion in cloud computing services from AWS. The deal is the first between the ChatGPT creator and the largest cloud computing provider in the world.,The Motley Fool,"Mon, 03 Nov 2025 17:18:00 -0500",[],AMZN
https://www.investopedia.com/s-and-p-500-gains-and-losses-today-amazon-stock-jumps-after-openai-deal-kimberly-clark-acquires-kenvue-11842271,S&P 500 Gains & Losses Today: Amazon Stock Jumps After OpenAI Deal; Kimberly-Clark Acquires Kenvue,"A linkup with an artificial intelligence player helped power shares of a top cloud-computing services company higher Monday, while an acquisition in the consumer goods space sent the two stocks on divergent paths.",Investopedia,"Mon, 03 Nov 2025 17:15:40 -0500",['manda'],AMZN
https://www.fxempire.com/forecasts/article/nasdaq-100-amazon-spikes-palantir-jumps-after-hours-tech-stocks-lift-us-indices-today-1559037,"Nasdaq 100: Amazon spikes, Palantir jumps after-hours — tech stocks lift US indices today","Amazon's $38B AI deal and Palantir's after-hours forecast lift tech stocks. Nasdaq leads, but Fed uncertainty and narrow breadth limit gains in broader US indices.",FXEmpire,"Mon, 03 Nov 2025 16:54:16 -0500",[],AMZN
https://www.youtube.com/watch?v=2MH7Og-8Pcc,"Skepticism on AMZN & OpenAI Deal: ""Two Stooges"" Against NVDA","Datavault (DVLT) CEO Nathaniel Bradley is concerned that the Amazon (AMZN) and OpenAI partnership is ""late to the game"" and holds many questions around privacy. He's also skeptical that the deal will be longstanding, explaining that Amazon can remove OpenAI from AWS once it has all the data it believes it needs.",Schwab Network,"Mon, 03 Nov 2025 16:30:00 -0500",[],AMZN
https://www.barrons.com/articles/ai-stock-nvidia-apple-tesla-22313aaf,The AI Trade Is Still Strong. Investors Have to Go Along for the Ride.,Investors that want to beat the S&P 500 likely have to stay invested in big tech while looking to make outsize bets elsewhere.,Barrons,"Mon, 03 Nov 2025 15:31:00 -0500",['paywall'],AMZN
https://www.benzinga.com/Opinion/25/11/48602581/amazons-38-billion-openai-deal-proves-nvidia-monopoly-is-already-breaking?utm_source=snapi,Amazon's $38B OpenAI Deal Proves NVIDIA's Monopoly Is Already Breaking,The fact that OpenAI needed $660 billion across five cloud providers to avoid vendor lock-in tells you everything about NVIDIA's pricing power problem,Benzinga,"Mon, 03 Nov 2025 14:39:08 -0500",['paywall'],AMZN
https://www.youtube.com/watch?v=GfDQkgt44DQ,AWS to build out new AI infrastructure for OpenAI in $38B deal,CNBC's MacKenzie Sigalos reports on news regarding Amazon.,CNBC Television,"Mon, 03 Nov 2025 14:37:28 -0500",[],AMZN
https://www.benzinga.com/etfs/sector-etfs/25/11/48602528/move-over-nvidia-these-etfs-see-amazon-as-the-next-ai-infrastructure-star?utm_source=snapi,Move Over Nvidia: These ETFs See Amazon As The Next AI Infrastructure Star,"The latest stock rally in Amazon.com Inc (NASDAQ:AMZN) is doing more than rewarding shareholders, it is redrawing the ETF map for AI exposure.",Benzinga,"Mon, 03 Nov 2025 14:37:17 -0500",['paywall'],AMZN
https://nypost.com/2025/11/03/business/openai-strikes-7-year-38b-cloud-computing-deal-with-amazon/,"OpenAI strikes 7-year, $38B cloud computing deal with Amazon Web Services","OpenAI has come to terms on a massive 7-year, $38 billion deal with Amazon Web Services to secure cloud computing capabilities needed to power its suite of advanced AI tools such as ChatGPT and Sora.",New York Post,"Mon, 03 Nov 2025 14:32:07 -0500",[],AMZN
https://www.fool.com/investing/2025/11/03/after-jumping-double-digits-is-amazon-a-buy/,"After Jumping Double Digits, Is Amazon Stock a Buy?",Amazon beat estimates on the top and bottom lines in its third-quarter earnings report. Adjusted operating income grew in all three of its business segments.,The Motley Fool,"Mon, 03 Nov 2025 13:37:00 -0500",[],AMZN
https://seekingalpha.com/article/4837000-amazon-growth-across-all-markets-despite-waning-consumer-sentiment-upgrade,Amazon: Growth Across All Markets Despite Waning Consumer Sentiment (Upgrade),"Amazon.com, Inc. delivered a strong Q3 '25 earnings beat, driven by robust store sales and continued AWS momentum, despite margin compression from non-operating expenses. Everyday Essentials supports strong sales outlook for Amazon store sales despite waning consumer sentiment and challenging macroeconomic outlook. AWS backlog growth supports AMZN's long-term outlook, with significant investments in compute capacity. Automation projects like Blue Jay and Project Eluna may support stronger margins in the coming years.",Seeking Alpha,"Mon, 03 Nov 2025 13:21:27 -0500",['paylimitwall'],AMZN
https://www.pymnts.com/artificial-intelligence-2/2025/openai-strikes-38-billion-cloud-deal-with-amazon-to-boost-ai-development/?utm_source=snapi,OpenAI Strikes $38 Billion Cloud Deal with Amazon to Boost AI Development,"AWS and OpenAI have announced a $38 billion agreement that enables OpenAI to run its AI workloads on AWS infrastructure, starting immediately.",PYMNTS,"Mon, 03 Nov 2025 13:11:33 -0500",[],AMZN
https://www.theguardian.com/technology/2025/nov/03/openai-cloud-computing-deal-amazon-aws-datacentres-nvidia-chips,OpenAI signs $38bn cloud computing deal with Amazon,"Agreement to use AWS datacentres, and Nvidia chips inside them, part of $1.4tn spending spree on AI infrastructure",The Guardian,"Mon, 03 Nov 2025 13:09:38 -0500",[],AMZN
https://www.youtube.com/watch?v=fmIN2rD01ws,OpenAI signs $38B deal with Amazon: Here's what to know,"OpenAI has signed a $38 billion deal with Amazon Web Services, and will immediately start accessing Nvidia's graphics processing units. CNBC's MacKenzie Sigalos joins 'Money Movers' with the latest details.",CNBC Television,"Mon, 03 Nov 2025 13:00:12 -0500",[],AMZN
https://www.investopedia.com/top-stock-movers-now-amazon-kenvue-kimberly-clark-beyond-meat-and-more-11842103,"Top Stock Movers Now: Amazon, Kenvue, Kimberly-Clark, Beyond Meat, and More","Major U.S. equities indexes were mixed Monday afternoon, as tech stocks gained but most other sectors declined. The S&P 500 and Nasdaq rose, while the Dow fell.",Investopedia,"Mon, 03 Nov 2025 12:55:36 -0500",['manda'],AMZN
https://www.investopedia.com/amazon-stock-climbs-to-fresh-high-on-usd38b-cloud-computing-deal-with-openai-11842005,Amazon's Stock Climbs to Fresh High on $38B Cloud Computing Deal With OpenAI,Amazon shares rose to a record high Monday after the tech giant said it struck a $38 billion deal with OpenAI.,Investopedia,"Mon, 03 Nov 2025 12:45:39 -0500",[],AMZN
https://www.reuters.com/business/media-telecom/verizon-aws-expand-tie-up-with-new-fiber-network-power-ai-applications-2025-11-03/,"Verizon, AWS expand tie up with new fiber network to power AI applications","Verizon announced a deal with Amazon Web Services on Monday to build high-capacity fiber routes connecting AWS data centers, aiming to strengthen infrastructure for the next generation of artificial intelligence applications.",Reuters,"Mon, 03 Nov 2025 12:01:24 -0500",[],AMZN
