news_url,title,text,source_name,date,topics,tickers
https://www.reuters.com/business/autos-transportation/teslas-china-sales-fall-3-year-low-amid-tepid-demand-2025-11-10/,Tesla's China sales fall to 3-year low amid tepid demand,"Tesla's sales in China dropped to 26,006 vehicles in October, their lowest in three years, as the U.S. electric vehicle maker struggles with tepid demand in the hyper-competitive market.",Reuters,"Mon, 10 Nov 2025 06:09:31 -0500",[],TSLA
https://www.businessinsider.com/tesla-cybertruck-lead-leaving-siddhant-awasthi-2025-11,Tesla's Cybertruck lead is leaving the company after 8 years,"Tesla's Cybertruck lead is departing the company. Siddhant Awasthi thanked Elon Musk in a farewell post, referencing the billionaire's $1 trillion pay package.",Business Insider,"Mon, 10 Nov 2025 05:47:56 -0500",['paywall'],TSLA
https://247wallst.com/forecasts/2025/11/10/tesla-tsla-bull-base-bear-price-prediction-and-forecast/?utm_source=snapi,"Tesla (NASDAQ: TSLA) Bull, Base and Bear Price Prediction and Forecast",Shares of Tesla Inc. (NASDAQ:TSLA) lost 1.93% over the past five trading sessions after gaining 3.70% the five prior.,24/7 Wall Street,"Mon, 10 Nov 2025 04:38:08 -0500",[],TSLA
https://www.zacks.com/stock/news/2788182/the-zacks-analyst-blog-tesla-general-motors-and-ford?cid=CS-STOCKNEWSAPI-FT-press_releases-2788182,"The Zacks Analyst Blog Tesla, General Motors and Ford","Tesla shareholders back Elon Musk's record $1 trillion pay plan, betting on his bold AI, robotics and autonomous vision despite EV headwinds.",Zacks Investment Research,"Mon, 10 Nov 2025 02:56:08 -0500",[],TSLA
https://www.reuters.com/business/autos-transportation/teslas-cybertruck-chief-siddhant-awasthi-departs-after-eight-years-2025-11-10/,Tesla's Cybertruck chief Siddhant Awasthi departs after eight years,"Tesla's head of the Cybertruck program, Siddhant Awasthi, said late on Sunday that he is leaving the U.S. electric vehicle maker after more than eight years with the company.",Reuters,"Mon, 10 Nov 2025 01:07:00 -0500",[],TSLA
https://seekingalpha.com/article/4841137-5-stocks-rose-quarter-key-catalysts,5 Stocks That Rose During The Quarter Due To Key Catalysts,Tesla shares rose during the quarter due to three key catalysts. SpaceX is generating significant value with the rapid expansion of its Starlink broadband service. We maintain conviction in On's ability to gain market share in the attractive global sportswear segment.,Seeking Alpha,"Sun, 09 Nov 2025 23:30:00 -0500",['paylimitwall'],TSLA
https://www.fool.com/investing/2025/11/09/1-bold-prediction-for-tesla-in-2026/,1 Bold Prediction for Tesla in 2026,"Tesla's CEO expects to launch ""millions"" of Tesla robotaxis next year. Investors should be cautious about such predictions.",The Motley Fool,"Sun, 09 Nov 2025 06:16:00 -0500",[],TSLA
https://www.businessinsider.com/business-experts-shareholders-weigh-in-on-elon-musk-pay-package-2025-11,Shareholders and compensation consultants weigh in on Elon Musk's $1 trillion pay package after Tesla meeting,"Tesla shareholders approved Musk's $1 trillion pay package contingent on performance. Some large shareholders, including the world's largest wealth fund, had voted against the plan.",Business Insider,"Sun, 09 Nov 2025 04:21:01 -0500","['CEO', 'paywall']",TSLA
https://www.fool.com/investing/2025/11/08/prediction-industry-companies-will-be-my-best-inve/,Prediction: EV Stocks Will Be Your Best Investment in 2026. Here's Why.,Tesla remains the king of EV stocks. Two other companies may soon emerge as major competitors.,The Motley Fool,"Sat, 08 Nov 2025 18:14:00 -0500",[],TSLA
https://www.youtube.com/shorts/QgS8FTWD6Eg,"Musk is ""maniacally dedicated to Tesla"": ARK Strategist","Musk is ""maniacally dedicated to Tesla"": ARK Strategist.",Yahoo Finance,"Sat, 08 Nov 2025 16:30:06 -0500",['CEO'],TSLA
https://www.marketwatch.com/story/musk-has-his-1-trillion-pay-package-heres-what-could-keep-him-from-getting-the-money-3c9a7cf8,Musk has his $1 trillion pay package. Here's what could keep him from getting the money.,"There are two “limiting factors” on Tesla's future, the CEO said, that could keep him from reaching the objectives that would get him paid.",Market Watch,"Sat, 08 Nov 2025 09:30:00 -0500","['CEO', 'paylimitwall']",TSLA
https://invezz.com/news/2025/11/08/cathie-woods-ark-invest-boosts-bitmine-stake-trims-tesla-holdings/?utm_source=snapi,"Cathie Wood's ARK Invest boosts BitMine stake, trims Tesla holdings","Cathie Wood's ARK Invest has expanded its investment in BitMine, the Ether treasury company founded by Tom Lee, while paring back its long-standing exposure to Tesla. The moves, disclosed in ARK's daily trading update on Friday, highlight the firm's shifting focus toward digital asset infrastructure and diversification away from some of its traditional high-conviction positions.",Invezz,"Sat, 08 Nov 2025 04:55:37 -0500",[],TSLA
https://www.wsj.com/finance/stocks/gm-tesla-palantir-expedia-american-airlines-a49b0d2c,"The Score: GM, Tesla, Palantir, American Airlines and More Stocks That Defined the Week",Here are some of the major companies whose stocks moved on the week's news.,WSJ,"Fri, 07 Nov 2025 17:22:00 -0500",['paywall'],TSLA
https://www.investopedia.com/elon-musk-got-his-usd1-trillion-pay-package-now-tesla-s-moonshot-goals-are-in-focus-11845843,Elon Musk Got His $1 Trillion Pay Package. Now Tesla's Moonshot Goals Are In Focus.,Tesla shareholders showed up for Elon Musk. Now it's up to the CEO to make good on his promises and make them—and him—richer.,Investopedia,"Fri, 07 Nov 2025 16:10:37 -0500",['CEO'],TSLA
https://www.youtube.com/watch?v=W2PfwT07oyw,"Tesla Approves Musk Pay, Board to Review xAI Investment","Alexandra Merz, a Tesla shareholder known on social media as TeslaBoomerMama, discusses the approval of Elon Musk's $1 trillion pay package, and what comes next for efforts to get Tesla to invest in xAI. She joins Caroline Hyde and Ed Ludlow on “Bloomberg Tech.",Bloomberg Technology,"Fri, 07 Nov 2025 15:34:11 -0500",['CEO'],TSLA
https://www.youtube.com/watch?v=R8lEdLi_Mv0,"Tesla's push to becoming a robotics company is a gamble, says WSJ's Tim Higgins","WSJ's Tim Higgins joins 'Closing Bell' to discuss Elon Musk's recent pay package, the possibilities of the company's humanoid robots and much more.",CNBC Television,"Fri, 07 Nov 2025 15:22:23 -0500",[],TSLA
https://www.forbes.com/sites/tylerroush/2025/11/07/elon-musk-loses-10-billion-after-tesla-approves-trillion-dollar-pay-deal-heres-why/,Elon Musk Loses $10 Billion After Tesla Approves Trillion-Dollar Pay Deal. Here's Why.,"Musk remains the world's wealthiest person with a net worth estimated at $481.4 billion, following a drop of $10 billion (2%) on Tesla's stock decline. He became the first person to be worth $500 billion and, before that, $400 billion earlier this year, as Tesla's stock surge has propelled him further ahead of No.",Forbes,"Fri, 07 Nov 2025 15:05:03 -0500","['CEO', 'paylimitwall']",TSLA
https://www.fastcompany.com/91437525/tsla-stock-price-elon-musk-got-his-1-trillion-pay-package-heres-how-tesla-investors-are-reacting,TSLA stock price: Elon Musk got his $1 trillion pay package. Here's how Tesla investors are reacting,"Yesterday, Tesla, Inc. (Nasdaq: TSLA) shareholders overwhelmingly approved the controversial and historic pay package deal for the electric vehicle maker's CEO, Elon Musk. That package is worth up to nearly $1 trillion in compensation for Musk—provided the company reaches certain milestones.",Fast Company,"Fri, 07 Nov 2025 14:47:52 -0500","['CEO', 'paylimitwall']",TSLA
https://www.investopedia.com/top-stock-movers-now-tesla-expedia-take-two-block-and-more-11845872,"Top Stock Movers Now: Tesla, Expedia, Take-Two, Block, and More","Major U.S. equities indexes pulled back Friday afternoon, led by the tech sector amid lingering worries about an AI bubble and after a string of weaker-than-expected earnings reports. The Dow, S&P 500, and Nasdaq all lost ground, with the Nasdaq on track to post its worst week since April, when President Donald Trump rattled markets with his ""Liberation Day"" tariffs.",Investopedia,"Fri, 07 Nov 2025 14:05:41 -0500",[],TSLA
https://www.youtube.com/watch?v=R_pGtYUgg5U,Elon Musk Pay Package: Can He Deliver for Tesla?,"Elon Musk responded in kind to Tesla Inc. investors approving his $1 trillion compensation package, making a series of extravagant predictions about what the company will be capable of in the years to come. Tesla's humanoid robot will progress from simple tasks, like handing out bags of candy, to performing surgery with “beyond human” levels of precision, the chief executive officer said Thursday.",Bloomberg Markets and Finance,"Fri, 07 Nov 2025 13:24:40 -0500",['CEO'],TSLA
https://www.barrons.com/articles/leveraged-etfs-tesla-nvidia-stock-1720b2cc,Investors Want Big Bets on Tesla and Nvidia Stock. Leveraged ETFs Are Falling Short.,"Some of these risky funds have been missing their goals, Morningstar says.",Barrons,"Fri, 07 Nov 2025 13:14:00 -0500",['paywall'],TSLA
https://www.investopedia.com/elon-musk-dropped-the-name-of-a-possible-chip-partner-for-tesla-last-night-intel-11845684,Elon Musk Dropped the Name of a Possible Chip Partner for Tesla Last Night,"After a string of recent high-profile deals for Intel, could one with Tesla be next?",Investopedia,"Fri, 07 Nov 2025 13:00:43 -0500",['CEO'],TSLA
https://www.zacks.com/stock/news/2787924/tesla-shareholders-1t-vote-of-confidence-can-musk-deliver?cid=CS-STOCKNEWSAPI-FT-analyst_blog|quick_take-2787924,Tesla Shareholders' $1T Vote of Confidence: Can Musk Deliver?,"Tesla shareholders back Musk's $1T performance-based pay plan, betting big on his vision to turn Tesla into an AI and robotics powerhouse.",Zacks Investment Research,"Fri, 07 Nov 2025 11:51:10 -0500",['CEO'],TSLA
https://www.youtube.com/watch?v=g7GK3WgtJSo,"Beyond $1T Pay Package: INTC, EVs & SpaceX Take Attention at TSLA Shareholder Event","While shareholders approving Tesla (TSLA) CEO Elon Musk's $1 trillion pay package is certainly nothing to scoff at, other bullet points at the shareholder event took Marley Kayden's attention. She explains how Musk talked about Intel's (INTC) chipmaking business and a potential SpaceX IPO as notes investors should jot down.",Schwab Network,"Fri, 07 Nov 2025 11:30:18 -0500",[],TSLA
https://www.marketwatch.com/story/elon-musks-trillion-dollar-pay-package-is-another-canary-in-the-coal-mine-ac8085d2,Elon Musk's trillion-dollar pay package is another canary in the coal mine,Tesla's incentive-laden CEO retention scheme won investors' go-ahead this week.,Market Watch,"Fri, 07 Nov 2025 11:28:00 -0500","['CEO', 'paylimitwall']",TSLA
https://www.benzinga.com/markets/tech/25/11/48724807/tsmc-samsung-and-maybe-intel-why-teslas-chip-strategy-is-trying-to-cover-every-foundry?utm_source=snapi,"TSMC, Samsung… And Maybe Intel? Why Tesla's Chip Strategy Is Trying To Cover Every Foundry",Elon Musk has a new problem — and it's not demand for Tesla Inc‘s (NASDAQ:TSLA) cars. It's the global shortage of silicon to power his next wave of AI ambitions.,Benzinga,"Fri, 07 Nov 2025 11:26:30 -0500",['paywall'],TSLA
https://www.youtube.com/watch?v=VOylMvahBtQ,Tesla shareholders approve Musk's $1 trillion pay package. Here's what he's focusing on,"Also, ARK Invest chief futurist, Brett Winton, joins Morning Brief host Julie Hyman to discuss Tesla (TSLA) CEO Elon Musk's $1 trillion pay package getting approved and what it signals about the company's future, especially when it comes to robotics and self-driving technology.",Yahoo Finance,"Fri, 07 Nov 2025 10:47:11 -0500",['CEO'],TSLA
https://invezz.com/news/2025/11/07/tesla-stock-slip-after-musks-1t-pay-package-approval/?utm_source=snapi,Tesla stock slip after Musk's $1T pay package approval,"Tesla's stock dipped on Friday morning, even after shareholders overwhelmingly approved CEO Elon Musk's record-breaking $1 trillion compensation package. Shares fell 5.04% to $423.40 although they have recovered to $429.44 at the time of writing, still down 3.69%.",Invezz,"Fri, 07 Nov 2025 10:46:23 -0500",['CEO'],TSLA
https://www.investors.com/news/stock-market-undercuts-key-levels-palantir-earnings-tesla-elon-musk-pay-deal/,"Stock Market Tumbles Below Key Levels Amid Palantir Earnings, Elon Musk's Tesla Pay Deal: Weekly Review","The major indexes fell solidly, undercutting key levels. Palantir tumbled despite strong earnings.",Investors Business Daily,"Fri, 07 Nov 2025 10:21:18 -0500","['earnings', 'CEO', 'tanalysis']",TSLA
https://www.theguardian.com/technology/2025/nov/07/tesla-why-us-investors-are-happy-to-pay-elon-musk-1-trillion,‘Musk is Tesla and Tesla is Musk' – why investors are happy to pay him $1tn,Making Elon Musk the world's first trillionaire appears to fit a US investment culture of backing high-flying innovators,The Guardian,"Fri, 07 Nov 2025 10:15:38 -0500",['CEO'],TSLA
https://www.youtube.com/watch?v=Fvq2AbaYILY,"Tesla Needs to Keep Elon Musk as CEO, Ives Says",The future of Tesla is all about AI says Dan Ives of Wedbush Securities. And he says Elon Musk has to be kept on as CEO for Tesla to meet its goals.,Bloomberg Markets and Finance,"Fri, 07 Nov 2025 10:14:32 -0500",['CEO'],TSLA
https://www.youtube.com/watch?v=WOAdxqd19WI,"Elon Musk gets $1T pay deal approved by Tesla shareholders, Nvidia, Palantir, and AMD stocks fall","Morning Brief: Market Sunrise anchor Ramzan Karmali breaks down the latest international finance news for November 7, 2025. Tesla shareholders approved CEO Elon Musk's incentive-based pay, which could be valued at $1 trillion.",Yahoo Finance,"Fri, 07 Nov 2025 10:02:57 -0500",['CEO'],TSLA
https://www.youtube.com/watch?v=IMPChl_yvrA,"Walter Isaacson: Musk needs Tesla's stock not just for the money, but also to control the company","Walter Isaacson, ‘Elon Musk' author and Perella Weinberg advisory partner, joins 'Squawk Box' to discuss the approval of Tesla CEO Elon Musk's historic pay package, future of Tesla, fate of xAI, and more.",CNBC Television,"Fri, 07 Nov 2025 09:25:05 -0500",['CEO'],TSLA
https://www.fxempire.com/forecasts/article/tsla-f-and-gm-forecast-us-automakers-look-soft-in-premarket-trading-1559886,"TSLA, F and GM Forecast – US Automakers Look Soft in Premarket Trading","US automakers are easing slightly in pre-market trade, but overall trends remain intact. Tesla consolidates above key support, Ford faces production headlines, and GM shows short-term overextension yet retains a strong longer-term bullish outlook.",FXEmpire,"Fri, 07 Nov 2025 09:14:05 -0500",[],TSLA
https://www.benzinga.com/markets/tech/25/11/48718414/musks-1-trillion-moment-the-bet-that-could-reprice-tesla-stock-or-break-it?utm_source=snapi,Musk's $1 Trillion Moment: The Bet That Could Reprice Tesla Stock Or Break It,Elon Musk just pulled off one of the biggest corporate wins in recent memory — a shareholder approval for a compensation plan that could hand him as much as $1 trillion in Tesla Inc (NASDAQ:TSLA) stock. But this isn't a reward for what he's already done.,Benzinga,"Fri, 07 Nov 2025 09:05:54 -0500","['CEO', 'paywall']",TSLA
https://www.reuters.com/sustainability/boards-policy-regulation/wall-st-reacts-musks-1-trillion-pay-plan-approval-by-tesla-investors-2025-11-07/,Wall St reacts to Musk's $1 trillion pay plan approval by Tesla investors,Tesla CEO Elon Musk has won shareholder approval for the largest corporate pay package in history.,Reuters,"Fri, 07 Nov 2025 08:45:53 -0500",['CEO'],TSLA
https://www.youtube.com/watch?v=FTxnompHOAw,"KG: ""Premium Seller's Market"" and Thoughts on TSLA's $1T Pay Package","Tesla (TSLA) CEO Elon Musk's near $1 trillion pay package received overwhelming approval from shareholders but Kevin Green highlights ""some little nuggets"" in the company's A.I plans including a potential chip buy from Intel (INTC). Then, KG addresses the ongoing storyline surrounding Nvidia (NVDA) CEO Jensen Huang's commentary of China's A.I.",Schwab Network,"Fri, 07 Nov 2025 08:37:29 -0500",[],TSLA
https://seekingalpha.com/article/4840024-tesla-stock-turning-point-buy-before-the-breakout-upgrade,Tesla's Turning Point: Buy Before The Breakout,"Tesla, Inc. is upgraded to a 'buy' rating as record free cash flow generation signals a potential long-term turning point for shareholders. Q3 2025 revenue growth reversed prior declines, and superior profitability metrics strengthen TSLA's balance sheet, despite areas of weakness in EPS and net income. TSLA maintains industry-leading profit margins and robust cash reserves, supporting continued investment in A.I. and energy storage segments.",Seeking Alpha,"Fri, 07 Nov 2025 08:00:01 -0500",['paylimitwall'],TSLA
https://www.barrons.com/articles/tesla-stock-musk-pay-buffett-berkshire-cfe4c0aa,"Tesla Is The Berkshire of Tech, Is Musk the New Buffett? Stock Stalls After Mega Pay Award.","Thursday, at its annual shareholder meeting, Tesla disclosed that investors voted to award Musk some 425 million incentive-laden shares.",Barrons,"Fri, 07 Nov 2025 07:39:00 -0500","['CEO', 'paywall']",TSLA
https://www.youtube.com/watch?v=446FvjiTrpc,"We now have clarity on Tesla's direction and leadership commitment, says Joe Tigay","Joe Tigay, Rational Equity Armor Fund portfolio manager and Catalyst Hedged Equity Fund portfolio manager, joins 'Squawk Box' to discuss the approval of Tesla CEO Elon Musk's historic  pay package, future of Tesla, and more.",CNBC Television,"Fri, 07 Nov 2025 07:36:45 -0500",[],TSLA
https://seekingalpha.com/article/4840158-wall-street-breakfast-podcast-joby-makes-rush-hour-fly-by,Wall Street Breakfast Podcast: Joby Makes Rush Hour Fly By,"Joby Aviation (JOBY) will launch 12-minute helicopter flights via Blade, connecting Manhattan and Westchester, drastically reducing commuter times. Nvidia (NVDA) is reportedly barred from selling its scaled-down AI chip to China, impacting its strategy for the Chinese market.",Seeking Alpha,"Fri, 07 Nov 2025 06:40:40 -0500","['podcast', 'paylimitwall']",TSLA
https://invezz.com/news/2025/11/07/after-1-trillion-pay-vote-what-teslas-musk-centric-governance-means-for-ai-ambitions/?utm_source=snapi,After $1 trillion pay vote: what Tesla's Musk-centric governance means for AI ambitions,"Tesla shareholders have handed Elon Musk a historic vote of confidence, and a path to a possible $1 trillion payday, as the company doubles down on AI, robotaxis, and chip ambitions.​ When applause rippled through Tesla's Austin shareholder meeting on November 6, investors had just approved the most audacious pay package in corporate history.",Invezz,"Fri, 07 Nov 2025 06:07:19 -0500",['CEO'],TSLA
