news_url,title,text,source_name,date,topics,tickers
https://seekingalpha.com/article/4843411-tslw-leveraged-tesla-strategy-for-high-income-investors,TSLW: Leveraged Tesla Strategy For High-Income Investors,"The Roundhill TSLA WeeklyPay ETF offers 1.2x weekly total return exposure to Tesla stock, targeting both income and growth for investors. TSLW employs weekly swaps on TSLA shares, differentiating itself from daily-reset leveraged ETFs, though it may still provide amplified returns and risks. Distributions are paid weekly and may vary, with a significant return of capital component that carries specific tax implications for investors.",Seeking Alpha,"Thu, 13 Nov 2025 16:24:17 -0500",['paylimitwall'],TSLA
https://www.pymnts.com/apple/2025/apples-carplay-could-soon-become-part-of-tesla-vehicles/?utm_source=snapi,Apple's CarPlay Could Soon Become Part of Tesla Vehicles,"Tesla is reportedly developing support for Apple CarPlay in its vehicles. That's according to a report Thursday (Nov. 13) from Bloomberg News, which noted that this is one of the most-requested features from Tesla's customers.",PYMNTS,"Thu, 13 Nov 2025 16:14:29 -0500",[],TSLA
https://www.cnbc.com/2025/11/13/tesla-recall-powerwall-2-overheating-fire-battery.html,"Tesla recalls 10,500 Powerwall 2 battery systems due to overheating, fire risk","Tesla is recalling around 10,500 of its Powerwall 2 home, backup battery systems due to risk of overheating, burns and fires. The U.S. Consumer Product Safety Commission and Tesla said, in a recall notice, that the issue was due to a ""third-party battery cell defect.",CNBC,"Thu, 13 Nov 2025 14:58:22 -0500",[],TSLA
https://www.marketwatch.com/story/teslas-sharpest-stock-drop-in-months-puts-it-back-in-the-red-for-the-year-bf70dd90,Tesla's sharpest stock drop in months puts it back in the red for the year,The Elon Musk-led company recently said it would recall some residential energy products.,Market Watch,"Thu, 13 Nov 2025 14:54:00 -0500",['paylimitwall'],TSLA
https://nypost.com/2025/11/13/business/elon-musks-tesla-working-to-add-apple-carplay-in-bid-to-boost-sales-report/,Tesla working to add Apple CarPlay in bid to boost EV sales: report,"CarPlay allows users to control iPhone features such as navigation, music and messaging through a vehicle's built-in display.",New York Post,"Thu, 13 Nov 2025 13:10:08 -0500",[],TSLA
https://www.youtube.com/watch?v=rEhqea6sgM0,Tesla Developing Support for Apple CarPlay,"Tesla is developing support for Apple's CarPlay system in its vehicles, according to people with knowledge of the matter. Mark Gurman reports on ""Bloomberg Tech.",Bloomberg Markets and Finance,"Thu, 13 Nov 2025 13:09:05 -0500",[],TSLA
https://www.cnbc.com/2025/11/13/elon-musk-trillion-dollar-pay-tesla-china-robots.html,Op-ed: Chinese robots are coming for Elon Musk's trillion-dollar Tesla payday,"Elon Musk's bid to become the world's first trillionaire increasingly rests on a single proposition: that Tesla can evolve from an electric vehicle company into a robotics powerhouse. In 2023, China installed over 290,000 industrial robots, more than the rest of the world combined, with robot density reaching 470 robots per 10,000 workers, surpassing Japan and Germany for the first time.",CNBC,"Thu, 13 Nov 2025 12:05:45 -0500",['CEO'],TSLA
https://techcrunch.com/2025/11/13/tesla-might-finally-bring-carplay-to-its-evs/,Tesla might finally bring CarPlay to its EVs,"While automakers like General Motors have started to sour on Apple CarPlay, Tesla is reportedly working on integrating the system into its vehicles' software stack.",TechCrunch,"Thu, 13 Nov 2025 12:05:25 -0500",[],TSLA
https://invezz.com/news/2025/11/13/why-tesla-stock-plunged-6-and-why-is-it-still-a-retail-favorite/?utm_source=snapi,Why Tesla stock plunged 6% and why is it still a retail favorite?,"Tesla stock extended its recent slide on Thursday, falling sharply alongside broader market losses. Shares of the electric vehicle maker dropped 6.2% to $403.87 in midday trading, down $26.73, making it the worst-performing stock in the Nasdaq 100, according to Dow Jones Market Data.",Invezz,"Thu, 13 Nov 2025 12:01:15 -0500",[],TSLA
https://www.fxempire.com/forecasts/article/sp500-nvidia-alphabet-tesla-sink-as-tech-sector-faces-broad-rebalancing-1561011,"S&P500: Nvidia, Alphabet, Tesla Sink as Tech Sector Faces Broad Rebalancing","US stocks fell as Nvidia, Alphabet, and Tesla led tech losses. Traders brace for missing data and Fed uncertainty.",FXEmpire,"Thu, 13 Nov 2025 11:57:12 -0500",[],TSLA
https://www.zacks.com/stock/news/2790694/can-tesla-s-new-model-y-rev-up-china-sales-after-a-3-year-low?cid=CS-STOCKNEWSAPI-FT-analyst_blog|quick_take-2790694,Can Tesla's New Model Y+ Rev Up China Sales After a 3-Year Low?,Tesla's new Model Y+ boasts 821 km of range and aims to reignite China sales after hitting a three-year low in October.,Zacks Investment Research,"Thu, 13 Nov 2025 11:51:06 -0500",['product'],TSLA
https://www.youtube.com/watch?v=jAUj4nc9M3k,Tesla CEO Elon Musk says demand for Optimus robots 'will be insatiable'.,"CNBC's David Faber sits down at Tesla HQ with CEO Elon Musk for a wide ranging conversation on self-driving, semiconductors, AI, China, and more.",CNBC Television,"Thu, 13 Nov 2025 11:50:11 -0500",['CEO'],TSLA
https://www.reuters.com/business/autos-transportation/tesla-working-integrate-apple-carplay-its-evs-bloomberg-news-reports-2025-11-13/,"Tesla working to integrate Apple CarPlay in its EVs, Bloomberg News reports","Tesla is developing support for Apple's CarPlay system in its electric vehicles, Bloomberg News reported on Thursday, citing people familiar with the matter.",Reuters,"Thu, 13 Nov 2025 11:37:43 -0500",[],TSLA
https://techcrunch.com/2025/11/13/tesla-powerwall-2-recall-expands-to-us-after-reports-of-fires/,Tesla Powerwall 2 recall expands to US after reports of fires,"Tesla is recalling more than 10,000 Powerwall 2 home batteries sold in the U.S. after nearly two dozen confirmed incidents of the units overheating, emitting smoke, or catching fire.",TechCrunch,"Thu, 13 Nov 2025 11:26:12 -0500",[],TSLA
https://www.reuters.com/business/autos-transportation/tesla-recalls-10500-powerwall-2-batteries-us-over-fire-risk-2025-11-13/,"Tesla recalls 10,500 Powerwall 2 batteries in US over fire risk","Tesla said on Thursday it is recalling about 10,500 units of its Powerwall 2 battery power systems in the U.S. for fire and burn hazards after receiving 22 reports of overheating.",Reuters,"Thu, 13 Nov 2025 10:53:10 -0500",[],TSLA
https://www.fxempire.com/forecasts/article/tsla-pltr-and-smci-forecast-stocks-look-slightly-weak-early-on-thursday-1560990,"TSLA, PLTR and SMCI Forecast – Stocks Look Slightly Weak Early on Thursday","Stocks appear soft in early Thursday trading, with Tesla, Palantir, and Super Micro Computer all showing signs of pressure. Key support levels sit below current prices, and broader market weakness suggests patience is needed before taking positions.",FXEmpire,"Thu, 13 Nov 2025 09:42:47 -0500",[],TSLA
https://www.zacks.com/stock/news/2790363/can-musk-s-optimus-dream-power-tesla-s-next-growth-phase?cid=CS-STOCKNEWSAPI-FT-analyst_blog|quick_take-2790363,Can Musk's Optimus Dream Power Tesla's Next Growth Phase?,"TSLA bets big on its humanoid robot Optimus, planning mass production by 2027 to fuel its next growth chapter beyond EVs.",Zacks Investment Research,"Thu, 13 Nov 2025 08:36:13 -0500",['CEO'],TSLA
https://www.benzinga.com/markets/tech/25/11/48831900/teslas-robotaxi-revolution-is-still-downloading-waymos-already-in-the-fast-lane?utm_source=snapi,Tesla's Robotaxi Revolution Is Still Downloading — Waymo's Already In The Fast Lane,"If you're stuck behind a polite, speed-limit-loving car on a California freeway, there's a good chance it's Waymo — the robotaxi that's now officially conquering highways across San Francisco, Los Angeles and Phoenix. And while the Tesla Inc (NASDAQ: TSLA) CEO Elon Musk keeps promising a self-driving future that spreads ""faster than any technology ever,"" Waymo is quietly doing the unglamorous thing: actually launching it.",Benzinga,"Thu, 13 Nov 2025 08:27:42 -0500",['paywall'],TSLA
https://www.barrons.com/articles/tesla-stock-investors-shares-80f3fd50,Tesla Stock Is Down as Retail Investors Continue to Pile Into Shares,Tesla remains a popular stock with smaller investors.,Barrons,"Thu, 13 Nov 2025 08:21:00 -0500",['paywall'],TSLA
https://247wallst.com/forecasts/2025/11/13/tesla-tsla-price-prediction-and-forecast/?utm_source=snapi,Tesla (NASDAQ: TSLA) Stock Price Prediction and Forecast 2025-2030 (Nov 13),"Tesla Inc.'s (NASDAQ: TSLA) share price is 3.5% lower than a week ago, when it was trading near an all-time high, after shareholders approved CEO Elon Musk's record-breaking $1 trillion pay package and some key executives left the company.",24/7 Wall Street,"Thu, 13 Nov 2025 08:20:09 -0500",[],TSLA
https://www.investors.com/news/tesla-stock-biggest-supporter-cathie-wood-stake-four-straight-sessions/,Tesla Stock's Biggest Supporter Cuts Stake For Four Straight Sessions,Tesla stock is down more than 5% in November and Cathie Wood has sold TSLA in four consecutive sessions.,Investors Business Daily,"Thu, 13 Nov 2025 08:13:21 -0500",[],TSLA
https://seekingalpha.com/article/4843047-2-years-of-rise-of-magnificent-seven-tech-stocks,2 Years Of The Rise Of The 'Magnificent Seven' Tech Stocks,"The seven companies that make up the S&P 500's ""Magnificent Seven"" stocks have been on the rise for some time. Two years ago, they combined to account for 30% of the total valuation of the S&P 500 (SPX).",Seeking Alpha,"Thu, 13 Nov 2025 07:36:00 -0500",['paylimitwall'],TSLA
https://www.youtube.com/watch?v=MdXpXB45w8c,"Munoz: Economy Supports Rally, META Undervalued & TSLA Still a Buy","Alonso Munoz says the fundamentals to the U.S. economy remain strong and support a ""Christmas rally"" into the end of the year. He also sees the FOMC cutting interest rates again in December that would add fuel to the expected rally.",Schwab Network,"Wed, 12 Nov 2025 15:15:03 -0500",[],TSLA
https://invezz.com/news/2025/11/12/tesla-stock-continues-slide-why-the-elon-musk-company-is-down-2-today/?utm_source=snapi,Tesla stock continues slide: why the Elon Musk company is down 2% today,"Tesla's stock fell early Wednesday as data showed a sharp drop in global vehicle sales during October, highlighting continued weakness across key markets even as investors remain fixated on the company's artificial intelligence ambitions. Shares were down more than 2% at $429.",Invezz,"Wed, 12 Nov 2025 11:19:55 -0500",['CEO'],TSLA
https://finbold.com/wall-street-analyst-updates-tesla-stock-price-after-musks-1-trillion-package-approval/?utm_source=snapi,Wall Street analyst updates Tesla stock price after Musk's $1 trillion package approval,Tesla's (NASDAQ: TSLA) stock outlook has been updated following the approval of CEO Elon Musk's massive $1 trillion pay package.,Finbold,"Wed, 12 Nov 2025 07:49:00 -0500",['CEO'],TSLA
https://www.barrons.com/articles/tesla-stock-october-ev-sales-b7582880,Tesla Stock Rises. October Electric Vehicle Sales Were Tougher Than Expected.,Tesla sales have been weak in October. Investors don't seem to mind.,Barrons,"Wed, 12 Nov 2025 07:43:00 -0500",['paywall'],TSLA
https://seekingalpha.com/article/4842331-baron-technology-fund-q3-2025-top-contributors-detractors,Baron Technology Fund Q3 2025 Top Contributors And Detractors,We remain confident in AI's potential to transform the global economy and in NVIDIA's pivotal role as the leading enabler of that transformation. We retain our long-term conviction in Broadcom's position within the AI ecosystem. Shares of PAR fell during the quarter as the company lowered its annual recurring revenue growth outlook for the year to 15% (from prior 20% expectations) due to weak macro conditions for its restaurant customers.,Seeking Alpha,"Wed, 12 Nov 2025 05:00:00 -0500",['paylimitwall'],TSLA
https://www.fool.com/investing/2025/11/11/could-buying-tesla-today-set-you-up-for-life/,Could Buying Tesla Today Set You Up for Life?,"Robotaxis and unsupervised full self-driving (FSD) could add value and new income streams. Cash flow from these businesses could fund the Optimus robot project, which CEO Elon Musk believes could represent up to 80% of Tesla's future value.",The Motley Fool,"Tue, 11 Nov 2025 20:12:00 -0500",[],TSLA
https://www.benzinga.com/markets/tech/25/11/48789884/tesla-vs-xpeng-musks-optimus-meets-xiaopengs-iron-in-the-ai-race?utm_source=snapi,Tesla Vs. XPeng: Musk's Optimus Meets Xiaopeng's Iron In The AI Race,"Elon Musk wasn't the only electric car CEO showing off humanoid robots and flying cars last week. At XPeng Inc (NYSE:XPEV) AI Day last week, CEO He Xiaopeng unveiled Iron, a humanoid robot prototype that instantly drew comparisons to Tesla Inc's (NASDAQ:TSLA) Optimus.",Benzinga,"Tue, 11 Nov 2025 15:04:18 -0500","['CEO', 'paywall']",TSLA
https://seekingalpha.com/article/4842026-tesla-still-a-strong-buy-on-pullbacks,Tesla: Still A Strong Buy (On Pullbacks),"Tesla, Inc. remains a Strong Buy for the intermediate and long term, supported by robust sales, margin resilience, and global expansion. TSLA delivered a record quarter with a significant sales beat, 18% gross margin, and growing non-automotive revenue streams like energy, FSD potential, and future AI prospects. Despite potential near-term volatility and a possible 15-20% pullback, TSLA's premium valuation is justified by its tech-driven growth prospects.",Seeking Alpha,"Tue, 11 Nov 2025 14:52:18 -0500",['paylimitwall'],TSLA
https://www.marketwatch.com/story/as-tesla-doubles-down-on-ai-this-analyst-says-its-stock-has-gotten-harder-to-recommend-09d09344,"As Tesla doubles down on AI, this analyst says its stock has gotten harder to recommend",Tesla's stock valuation is increasingly linked to AI initiatives around humanoid robots and robotaxis that aren't bringing in revenue — for now.,Market Watch,"Tue, 11 Nov 2025 12:33:00 -0500",['paylimitwall'],TSLA
https://nypost.com/2025/11/11/business/tesla-turns-to-rentals-as-us-sales-slump-after-ev-tax-credit-expires/,Tesla turns to $60-a-day rentals as US sales slump after EV tax credit expires,Tesla is launching a short-term rental program out of its stores as inventories swell across the country.,New York Post,"Tue, 11 Nov 2025 12:27:58 -0500",[],TSLA
https://www.investopedia.com/tesla-stock-is-slipping-today-as-investors-eye-chinese-sales-numbers-11847299,Tesla Stock Is Slipping Today as Investors Eye Chinese Sales Numbers,"Talking about Tesla's auto sales just a few days after a $1 trillion vote might seem odd—but while they might not be the most interesting thing about the company these days, they still matter.",Investopedia,"Tue, 11 Nov 2025 11:25:41 -0500",[],TSLA
https://invezz.com/news/2025/11/11/tesla-stock-slides-over-2-whats-hurting-the-ev-stock-today/?utm_source=snapi,Tesla stock slides over 2%: what's hurting the EV stock today,"Tesla stock was jittery in early trade on Thursday, declining more than 2% as fresh analyst commentary and new global sales data pointed to broad-based weakness in October deliveries.",Invezz,"Tue, 11 Nov 2025 11:14:42 -0500",[],TSLA
https://www.zacks.com/stock/news/2789356/ev-face-off-tesla-s-scale-vs-quantumscape-s-battery-vision?cid=CS-STOCKNEWSAPI-FT-analyst_blog|most_popular_stocks-2789356,EV Face-Off: Tesla's Scale vs. QuantumScape's Battery Vision,"While TSLA's scale offers stability, QS' technology could be the spark that powers the industry's next leap forward.",Zacks Investment Research,"Tue, 11 Nov 2025 11:01:14 -0500",[],TSLA
https://247wallst.com/investing/2025/11/11/tesla-china-sales-hit-3-year-low/?utm_source=snapi,Tesla China Sales Hit 3-Year Low,"Tesla Inc. (NASDAQ: TSLA) sales in China dropped to 26,006 in October, the lowest total in three years.",24/7 Wall Street,"Tue, 11 Nov 2025 09:15:31 -0500",[],TSLA
https://247wallst.com/investing/2025/11/11/wall-street-price-prediction-teslas-share-price-forecast-for-2025/?utm_source=snapi,Wall Street Price Prediction: Tesla's Share Price Forecast for 2025,"After soaring in 2023 and 2024, shares of Tesla  (NASDAQ:TSLA) were battered throughout Q1 but performed marginally better in Q2.",24/7 Wall Street,"Tue, 11 Nov 2025 08:00:03 -0500",[],TSLA
https://www.businessinsider.com/ford-ceo-taking-apart-tesla-chinese-evs-jim-farley-2025-11,Ford CEO says taking apart Tesla and Chinese EVs was 'shocking' and pushed him to shake up the automaker,"Taking apart Tesla and Chinese EVs was a wake-up call for Ford's CEO. Jim Farley told the ""Office Hours: Business Edition"" podcast that it spurred him to overhaul the automaker.",Business Insider,"Tue, 11 Nov 2025 07:01:01 -0500","['CEO', 'paywall']",TSLA
https://www.fastcompany.com/91438533/tesla-new-plan-to-get-cars-out-of-showrooms-takes-on-hertz,Tesla's new plan to get cars out of showrooms takes on Hertz,Tesla is getting into the rental car market.,Fast Company,"Tue, 11 Nov 2025 06:11:04 -0500",['paylimitwall'],TSLA
https://www.barrons.com/articles/tesla-stock-price-today-musk-19161cfe,Here's What Tesla Stock Looks Like In 10 Years If Musk Succeeds,"If the CEO hits his performance goals and the company's earnings explode over the coming 10 years, what will the stock's price-to-earnings ratio be?",Barrons,"Tue, 11 Nov 2025 05:16:00 -0500","['CEO', 'paywall']",TSLA
https://seekingalpha.com/article/4841507-tesla-or-bust-gm-stock-a-better-ride,Tesla Or Bust? GM Stock A Better Ride,"Tesla shareholders approved Elon Musk's trillion-dollar pay package linked to ambitious milestones—including an $8.5 trillion market cap, 20 million vehicles delivered, and 1 million robots deployed. Bulls see the move as promising; even if the targets are difficult, they are confident Musk can ensure Tesla remains a leading company in the AI revolution. TSLA's huge long-term upside earnings growth potential comes at a high price, and a poor Valuation Grade has kept the stock at a Hold quant rating.",Seeking Alpha,"Tue, 11 Nov 2025 05:00:00 -0500",['paylimitwall'],TSLA
https://www.cnbc.com/2025/11/10/tesla-investor-support-for-musk-pay-plan-declined-from-2018-package.html,Tesla investor support for Elon Musk's massive pay plan was lower in 2025 than in 2018,"Tesla CE Elon Musk received less support for his trillion-dollar pay package than he did for an earlier pay plan in 2018. Setting aside holdings owned by Tesla board members and executives, about 66% of shares tabulated in the vote were in favor of the package, according to a filing on Friday.",CNBC,"Mon, 10 Nov 2025 20:42:52 -0500",['CEO'],TSLA
https://www.youtube.com/watch?v=HfS1gCQAhL4,"Tigay: ""Many More Years of A.I. Trade to Come,"" What's Next for Tesla (TSLA)","“We have many more years of this AI trade to come,” Joe Tigay argues, despite fears of a bubble. He looks at Tesla (TSLA), saying that “without Elon” there is no Tesla, and he wouldn't want to invest in the company if he wasn't leading it.",Schwab Network,"Mon, 10 Nov 2025 20:00:19 -0500",[],TSLA
https://www.forbes.com/sites/alanohnsman/2025/11/10/teslas-engineering-exodus-comes-amid-shift-from-core-ev-mission/,Tesla's Engineering Exodus Comes Amid Shift From Core EV Mission,"Tesla shareholders just overwhelmingly backed CEO Elon Musk's unprecedented pay package that could be worth $1 trillion over a decade, but engineers running the company's main vehicle programs, for its top-selling Model Y, Model 3 and the controversial Cybertruck, aren't sticking around to see how things turn out.",Forbes,"Mon, 10 Nov 2025 17:35:03 -0500",['paylimitwall'],TSLA
https://www.zacks.com/commentary/2788850/making-sense-of-the-market-s-tech-worries?cid=CS-STOCKNEWSAPI-FT-earnings_preview-2788850,Making Sense of the Market's Tech Worries,"The recent pullback in leading artificial intelligence stocks has rekindled concerns about the group's stock price momentum and market leadership. The absence of economic data due to the government shutdown, at a time of economic vulnerabilities, is adding to market angst.",Zacks Investment Research,"Mon, 10 Nov 2025 15:29:21 -0500",[],TSLA
https://www.youtube.com/watch?v=heA-4CMjQVA,Used Auto & EV Space Accelerates Amid Pricing Pressures to Industry,"""2025 has been a pretty interesting year for the auto industry,"" says Kevin Roberts with @cargurus. He has a particular interest in the used car market, noticing a rise in vehicle sales under $30,000 and/or with cars seven years or older.",Schwab Network,"Mon, 10 Nov 2025 14:51:35 -0500",[],TSLA
https://www.reuters.com/sustainability/boards-policy-regulation/tesla-chair-thanks-investors-approving-musks-878-billion-pay-package-2025-11-10/,Tesla chair thanks investors for approving Musk's $878 billion pay package,Tesla board chair Robyn Denholm thanked the electric-vehicle maker's shareholders on Monday for approving CEO Elon Musk's $878 billion pay package.,Reuters,"Mon, 10 Nov 2025 13:48:39 -0500",['CEO'],TSLA
https://www.marketwatch.com/story/tesla-is-still-losing-ground-in-the-worlds-biggest-ev-market-68c940dd,Tesla is still losing ground in the world's biggest EV market,The company's struggles in China are part of the reason Tesla is likely to report another annual sales decline.,Market Watch,"Mon, 10 Nov 2025 13:22:00 -0500",['paylimitwall'],TSLA
https://www.reuters.com/business/autos-transportation/teslas-model-y-program-manager-announces-exit-alongside-cybertruck-lead-2025-11-10/,Tesla's Model Y program manager announces exit alongside Cybertruck lead,"Tesla's best-selling Model Y's program manager, Emmanuel Lamacchia, announced his departure on Sunday after nearly eight years, marking another high-profile exit from Elon Musk's electric vehicle company.",Reuters,"Mon, 10 Nov 2025 12:49:29 -0500",['product'],TSLA
https://www.proactiveinvestors.com/companies/news/1082184?SNAPI,Tesla shares jump as Cybertruck chief exits company,"Tesla Inc (NASDAQ:TSLA) shares added almost 4% after it was announced that the head of its divisive Cybertruck unit, Siddhant Awasthi, is departing the company after eight years. Awasthi began his career at Tesla as an intern in 2017 and eventually led the Cybertruck program from engineering through mass production.",Proactive Investors,"Mon, 10 Nov 2025 12:38:00 -0500",[],TSLA
https://www.investors.com/news/tesla-stockmodel-y-cybertruck-chiefs-exit-china-sales-three-year-low/,"Tesla Loses Model Y, Cybertruck Chiefs As China Sales Hit Three-Year Low. The Stock Is Still Rising.",The Model Y and Cybertruck program heads are the latest high-level exits. China sales were the lowest in years.,Investors Business Daily,"Mon, 10 Nov 2025 12:34:22 -0500",['product'],TSLA
https://nypost.com/2025/11/10/business/teslas-cybertruck-chief-quits-after-more-than-eight-years-in-latest-high-profile-exit/,Tesla's Cybertruck chief quits after more than eight years in latest high-profile exit,"Siddhant Awasthi, head of the Cybertruck program, announced his departure from Elon Musk's automaker late Sunday.",New York Post,"Mon, 10 Nov 2025 11:21:50 -0500",[],TSLA
https://invezz.com/news/2025/11/10/tesla-palantir-stock-price-declines-dubbed-buying-opportunity-find-out-more/?utm_source=snapi,"Tesla, Palantir stock price declines dubbed ‘buying opportunity': find out more","Following a turbulent week for US tech stocks, some investors are eyeing the recent pullbacks as a chance to buy high-growth names at a discount. Eddie Ghabour, managing partner at Key Advisors Wealth Management, believes the selloff has created attractive entry points in select artificial intelligence (AI) companies.",Invezz,"Mon, 10 Nov 2025 10:08:15 -0500",[],TSLA
https://www.zacks.com/stock/news/2788374/tesla-inc-tsla-is-a-trending-stock-facts-to-know-before-betting-on-it?cid=CS-STOCKNEWSAPI-FT-tale_of_the_tape|most_searched_stocks-2788374,"Tesla, Inc. (TSLA) Is a Trending Stock: Facts to Know Before Betting on It","Recently, Zacks.com users have been paying close attention to Tesla (TSLA). This makes it worthwhile to examine what the stock has in store.",Zacks Investment Research,"Mon, 10 Nov 2025 10:00:53 -0500",[],TSLA
https://www.forbes.com/sites/martinacastellanos/2025/11/10/head-of-teslas-controversial-cybertruck-unit-exits-stock-jumps/,Head Of Tesla's Controversial Cybertruck Unit Exits—Stock Jumps,"Tesla shares up 2.1% pre-market trading Monday after Cybertruck chief Siddhant Awasthi announced his departure, coming just days after shareholders approved Elon Musk's record $1 trillion compensation package.",Forbes,"Mon, 10 Nov 2025 09:45:08 -0500",['paylimitwall'],TSLA
https://www.forbes.com/sites/petercohan/2025/11/10/why-tesla-and-rivian-ceo-pay-deals-may-sink-tsla-and-rivn/,Why Tesla And Rivian CEO Pay Deals May Sink $TSLA And $RIVN,The CEOs of Tesla and Rivian last week received big pay packages last week – which only pay off if the companies' stock market values soar.,Forbes,"Mon, 10 Nov 2025 09:25:21 -0500","['CEO', 'paylimitwall']",TSLA
https://invezz.com/news/2025/11/10/teslas-cybertruck-program-chief-siddhant-awasthi-steps-down/?utm_source=snapi,Tesla's Cybertruck program chief Siddhant Awasthi steps down,"Tesla Inc. has lost another senior leader as Siddhant Awasthi, the head of the company's Cybertruck program, announced his departure after three years in the role. The move adds to a growing list of high-level exits at the electric-vehicle maker as it contends with uneven demand, intensifying competition, and the wind-down of key US incentives.",Invezz,"Mon, 10 Nov 2025 08:01:34 -0500",[],TSLA
https://www.barrons.com/articles/tesla-stock-price-cybertruck-leader-exits-aad3c32c,Tesla Stock Rises as Cybertruck Leader Exits. What It Means for the EV Maker.,"Siddhant Awasthi, Tesla's head of the Cybertruck program, recently announced on LinkedIn he was leaving the company after eight years.",Barrons,"Mon, 10 Nov 2025 07:24:00 -0500",['paywall'],TSLA
