news_url,title,text,source_name,date,topics,tickers
https://www.zacks.com/stock/news/2789356/ev-face-off-tesla-s-scale-vs-quantumscape-s-battery-vision?cid=CS-STOCKNEWSAPI-FT-analyst_blog|most_popular_stocks-2789356,EV Face-Off: Tesla's Scale vs. QuantumScape's Battery Vision,"While TSLA's scale offers stability, QS' technology could be the spark that powers the industry's next leap forward.",Zacks Investment Research,"Tue, 11 Nov 2025 11:01:14 -0500",[],TSLA
https://247wallst.com/investing/2025/11/11/tesla-china-sales-hit-3-year-low/?utm_source=snapi,Tesla China Sales Hit 3-Year Low,"Tesla Inc. (NASDAQ: TSLA) sales in China dropped to 26,006 in October, the lowest total in three years.",24/7 Wall Street,"Tue, 11 Nov 2025 09:15:31 -0500",[],TSLA
https://247wallst.com/investing/2025/11/11/wall-street-price-prediction-teslas-share-price-forecast-for-2025/?utm_source=snapi,Wall Street Price Prediction: Tesla's Share Price Forecast for 2025,"After soaring in 2023 and 2024, shares of Tesla  (NASDAQ:TSLA) were battered throughout Q1 but performed marginally better in Q2.",24/7 Wall Street,"Tue, 11 Nov 2025 08:00:03 -0500",[],TSLA
https://www.businessinsider.com/ford-ceo-taking-apart-tesla-chinese-evs-jim-farley-2025-11,Ford CEO says taking apart Tesla and Chinese EVs was 'shocking' and pushed him to shake up the automaker,"Taking apart Tesla and Chinese EVs was a wake-up call for Ford's CEO. Jim Farley told the ""Office Hours: Business Edition"" podcast that it spurred him to overhaul the automaker.",Business Insider,"Tue, 11 Nov 2025 07:01:01 -0500","['CEO', 'paywall']",TSLA
https://www.fastcompany.com/91438533/tesla-new-plan-to-get-cars-out-of-showrooms-takes-on-hertz,Tesla's new plan to get cars out of showrooms takes on Hertz,Tesla is getting into the rental car market.,Fast Company,"Tue, 11 Nov 2025 06:11:04 -0500",['paylimitwall'],TSLA
https://www.barrons.com/articles/tesla-stock-price-today-musk-19161cfe,Here's What Tesla Stock Looks Like In 10 Years If Musk Succeeds,"If the CEO hits his performance goals and the company's earnings explode over the coming 10 years, what will the stock's price-to-earnings ratio be?",Barrons,"Tue, 11 Nov 2025 05:16:00 -0500","['CEO', 'paywall']",TSLA
https://seekingalpha.com/article/4841507-tesla-or-bust-gm-stock-a-better-ride,Tesla Or Bust? GM Stock A Better Ride,"Tesla shareholders approved Elon Musk's trillion-dollar pay package linked to ambitious milestones—including an $8.5 trillion market cap, 20 million vehicles delivered, and 1 million robots deployed. Bulls see the move as promising; even if the targets are difficult, they are confident Musk can ensure Tesla remains a leading company in the AI revolution. TSLA's huge long-term upside earnings growth potential comes at a high price, and a poor Valuation Grade has kept the stock at a Hold quant rating.",Seeking Alpha,"Tue, 11 Nov 2025 05:00:00 -0500",['paylimitwall'],TSLA
https://www.cnbc.com/2025/11/10/tesla-investor-support-for-musk-pay-plan-declined-from-2018-package.html,Tesla investor support for Elon Musk's massive pay plan was lower in 2025 than in 2018,"Tesla CE Elon Musk received less support for his trillion-dollar pay package than he did for an earlier pay plan in 2018. Setting aside holdings owned by Tesla board members and executives, about 66% of shares tabulated in the vote were in favor of the package, according to a filing on Friday.",CNBC,"Mon, 10 Nov 2025 20:42:52 -0500",['CEO'],TSLA
https://www.youtube.com/watch?v=HfS1gCQAhL4,"Tigay: ""Many More Years of A.I. Trade to Come,"" What's Next for Tesla (TSLA)","“We have many more years of this AI trade to come,” Joe Tigay argues, despite fears of a bubble. He looks at Tesla (TSLA), saying that “without Elon” there is no Tesla, and he wouldn't want to invest in the company if he wasn't leading it.",Schwab Network,"Mon, 10 Nov 2025 20:00:19 -0500",[],TSLA
https://www.forbes.com/sites/alanohnsman/2025/11/10/teslas-engineering-exodus-comes-amid-shift-from-core-ev-mission/,Tesla's Engineering Exodus Comes Amid Shift From Core EV Mission,"Tesla shareholders just overwhelmingly backed CEO Elon Musk's unprecedented pay package that could be worth $1 trillion over a decade, but engineers running the company's main vehicle programs, for its top-selling Model Y, Model 3 and the controversial Cybertruck, aren't sticking around to see how things turn out.",Forbes,"Mon, 10 Nov 2025 17:35:03 -0500",['paylimitwall'],TSLA
https://www.zacks.com/commentary/2788850/making-sense-of-the-market-s-tech-worries?cid=CS-STOCKNEWSAPI-FT-earnings_preview-2788850,Making Sense of the Market's Tech Worries,"The recent pullback in leading artificial intelligence stocks has rekindled concerns about the group's stock price momentum and market leadership. The absence of economic data due to the government shutdown, at a time of economic vulnerabilities, is adding to market angst.",Zacks Investment Research,"Mon, 10 Nov 2025 15:29:21 -0500",[],TSLA
https://www.youtube.com/watch?v=heA-4CMjQVA,Used Auto & EV Space Accelerates Amid Pricing Pressures to Industry,"""2025 has been a pretty interesting year for the auto industry,"" says Kevin Roberts with @cargurus. He has a particular interest in the used car market, noticing a rise in vehicle sales under $30,000 and/or with cars seven years or older.",Schwab Network,"Mon, 10 Nov 2025 14:51:35 -0500",[],TSLA
https://www.reuters.com/sustainability/boards-policy-regulation/tesla-chair-thanks-investors-approving-musks-878-billion-pay-package-2025-11-10/,Tesla chair thanks investors for approving Musk's $878 billion pay package,Tesla board chair Robyn Denholm thanked the electric-vehicle maker's shareholders on Monday for approving CEO Elon Musk's $878 billion pay package.,Reuters,"Mon, 10 Nov 2025 13:48:39 -0500",['CEO'],TSLA
https://www.marketwatch.com/story/tesla-is-still-losing-ground-in-the-worlds-biggest-ev-market-68c940dd,Tesla is still losing ground in the world's biggest EV market,The company's struggles in China are part of the reason Tesla is likely to report another annual sales decline.,Market Watch,"Mon, 10 Nov 2025 13:22:00 -0500",['paylimitwall'],TSLA
https://www.reuters.com/business/autos-transportation/teslas-model-y-program-manager-announces-exit-alongside-cybertruck-lead-2025-11-10/,Tesla's Model Y program manager announces exit alongside Cybertruck lead,"Tesla's best-selling Model Y's program manager, Emmanuel Lamacchia, announced his departure on Sunday after nearly eight years, marking another high-profile exit from Elon Musk's electric vehicle company.",Reuters,"Mon, 10 Nov 2025 12:49:29 -0500",['product'],TSLA
https://www.proactiveinvestors.com/companies/news/1082184?SNAPI,Tesla shares jump as Cybertruck chief exits company,"Tesla Inc (NASDAQ:TSLA) shares added almost 4% after it was announced that the head of its divisive Cybertruck unit, Siddhant Awasthi, is departing the company after eight years. Awasthi began his career at Tesla as an intern in 2017 and eventually led the Cybertruck program from engineering through mass production.",Proactive Investors,"Mon, 10 Nov 2025 12:38:00 -0500",[],TSLA
https://www.investors.com/news/tesla-stockmodel-y-cybertruck-chiefs-exit-china-sales-three-year-low/,"Tesla Loses Model Y, Cybertruck Chiefs As China Sales Hit Three-Year Low. The Stock Is Still Rising.",The Model Y and Cybertruck program heads are the latest high-level exits. China sales were the lowest in years.,Investors Business Daily,"Mon, 10 Nov 2025 12:34:22 -0500",['product'],TSLA
https://nypost.com/2025/11/10/business/teslas-cybertruck-chief-quits-after-more-than-eight-years-in-latest-high-profile-exit/,Tesla's Cybertruck chief quits after more than eight years in latest high-profile exit,"Siddhant Awasthi, head of the Cybertruck program, announced his departure from Elon Musk's automaker late Sunday.",New York Post,"Mon, 10 Nov 2025 11:21:50 -0500",[],TSLA
https://invezz.com/news/2025/11/10/tesla-palantir-stock-price-declines-dubbed-buying-opportunity-find-out-more/?utm_source=snapi,"Tesla, Palantir stock price declines dubbed ‘buying opportunity': find out more","Following a turbulent week for US tech stocks, some investors are eyeing the recent pullbacks as a chance to buy high-growth names at a discount. Eddie Ghabour, managing partner at Key Advisors Wealth Management, believes the selloff has created attractive entry points in select artificial intelligence (AI) companies.",Invezz,"Mon, 10 Nov 2025 10:08:15 -0500",[],TSLA
https://www.zacks.com/stock/news/2788374/tesla-inc-tsla-is-a-trending-stock-facts-to-know-before-betting-on-it?cid=CS-STOCKNEWSAPI-FT-tale_of_the_tape|most_searched_stocks-2788374,"Tesla, Inc. (TSLA) Is a Trending Stock: Facts to Know Before Betting on It","Recently, Zacks.com users have been paying close attention to Tesla (TSLA). This makes it worthwhile to examine what the stock has in store.",Zacks Investment Research,"Mon, 10 Nov 2025 10:00:53 -0500",[],TSLA
https://www.forbes.com/sites/martinacastellanos/2025/11/10/head-of-teslas-controversial-cybertruck-unit-exits-stock-jumps/,Head Of Tesla's Controversial Cybertruck Unit Exits—Stock Jumps,"Tesla shares up 2.1% pre-market trading Monday after Cybertruck chief Siddhant Awasthi announced his departure, coming just days after shareholders approved Elon Musk's record $1 trillion compensation package.",Forbes,"Mon, 10 Nov 2025 09:45:08 -0500",['paylimitwall'],TSLA
https://www.forbes.com/sites/petercohan/2025/11/10/why-tesla-and-rivian-ceo-pay-deals-may-sink-tsla-and-rivn/,Why Tesla And Rivian CEO Pay Deals May Sink $TSLA And $RIVN,The CEOs of Tesla and Rivian last week received big pay packages last week – which only pay off if the companies' stock market values soar.,Forbes,"Mon, 10 Nov 2025 09:25:21 -0500","['CEO', 'paylimitwall']",TSLA
https://invezz.com/news/2025/11/10/teslas-cybertruck-program-chief-siddhant-awasthi-steps-down/?utm_source=snapi,Tesla's Cybertruck program chief Siddhant Awasthi steps down,"Tesla Inc. has lost another senior leader as Siddhant Awasthi, the head of the company's Cybertruck program, announced his departure after three years in the role. The move adds to a growing list of high-level exits at the electric-vehicle maker as it contends with uneven demand, intensifying competition, and the wind-down of key US incentives.",Invezz,"Mon, 10 Nov 2025 08:01:34 -0500",[],TSLA
https://www.barrons.com/articles/tesla-stock-price-cybertruck-leader-exits-aad3c32c,Tesla Stock Rises as Cybertruck Leader Exits. What It Means for the EV Maker.,"Siddhant Awasthi, Tesla's head of the Cybertruck program, recently announced on LinkedIn he was leaving the company after eight years.",Barrons,"Mon, 10 Nov 2025 07:24:00 -0500",['paywall'],TSLA
https://www.reuters.com/business/autos-transportation/teslas-china-sales-fall-3-year-low-amid-tepid-demand-2025-11-10/,Tesla's China sales fall to 3-year low amid tepid demand,"Tesla's sales in China dropped to 26,006 vehicles in October, their lowest in three years, as the U.S. electric vehicle maker struggles with tepid demand in the hyper-competitive market.",Reuters,"Mon, 10 Nov 2025 06:09:31 -0500",[],TSLA
https://www.businessinsider.com/tesla-cybertruck-lead-leaving-siddhant-awasthi-2025-11,Tesla's Cybertruck lead is leaving the company after 8 years,"Tesla's Cybertruck lead is departing the company. Siddhant Awasthi thanked Elon Musk in a farewell post, referencing the billionaire's $1 trillion pay package.",Business Insider,"Mon, 10 Nov 2025 05:47:56 -0500",['paywall'],TSLA
https://247wallst.com/forecasts/2025/11/10/tesla-tsla-bull-base-bear-price-prediction-and-forecast/?utm_source=snapi,"Tesla (NASDAQ: TSLA) Bull, Base and Bear Price Prediction and Forecast",Shares of Tesla Inc. (NASDAQ:TSLA) lost 1.93% over the past five trading sessions after gaining 3.70% the five prior.,24/7 Wall Street,"Mon, 10 Nov 2025 04:38:08 -0500",[],TSLA
https://www.zacks.com/stock/news/2788182/the-zacks-analyst-blog-tesla-general-motors-and-ford?cid=CS-STOCKNEWSAPI-FT-press_releases-2788182,"The Zacks Analyst Blog Tesla, General Motors and Ford","Tesla shareholders back Elon Musk's record $1 trillion pay plan, betting on his bold AI, robotics and autonomous vision despite EV headwinds.",Zacks Investment Research,"Mon, 10 Nov 2025 02:56:08 -0500",[],TSLA
https://www.reuters.com/business/autos-transportation/teslas-cybertruck-chief-siddhant-awasthi-departs-after-eight-years-2025-11-10/,Tesla's Cybertruck chief Siddhant Awasthi departs after eight years,"Tesla's head of the Cybertruck program, Siddhant Awasthi, said late on Sunday that he is leaving the U.S. electric vehicle maker after more than eight years with the company.",Reuters,"Mon, 10 Nov 2025 01:07:00 -0500",[],TSLA
https://seekingalpha.com/article/4841137-5-stocks-rose-quarter-key-catalysts,5 Stocks That Rose During The Quarter Due To Key Catalysts,Tesla shares rose during the quarter due to three key catalysts. SpaceX is generating significant value with the rapid expansion of its Starlink broadband service. We maintain conviction in On's ability to gain market share in the attractive global sportswear segment.,Seeking Alpha,"Sun, 09 Nov 2025 23:30:00 -0500",['paylimitwall'],TSLA
https://www.fool.com/investing/2025/11/09/1-bold-prediction-for-tesla-in-2026/,1 Bold Prediction for Tesla in 2026,"Tesla's CEO expects to launch ""millions"" of Tesla robotaxis next year. Investors should be cautious about such predictions.",The Motley Fool,"Sun, 09 Nov 2025 06:16:00 -0500",[],TSLA
https://www.businessinsider.com/business-experts-shareholders-weigh-in-on-elon-musk-pay-package-2025-11,Shareholders and compensation consultants weigh in on Elon Musk's $1 trillion pay package after Tesla meeting,"Tesla shareholders approved Musk's $1 trillion pay package contingent on performance. Some large shareholders, including the world's largest wealth fund, had voted against the plan.",Business Insider,"Sun, 09 Nov 2025 04:21:01 -0500","['CEO', 'paywall']",TSLA
https://www.fool.com/investing/2025/11/08/prediction-industry-companies-will-be-my-best-inve/,Prediction: EV Stocks Will Be Your Best Investment in 2026. Here's Why.,Tesla remains the king of EV stocks. Two other companies may soon emerge as major competitors.,The Motley Fool,"Sat, 08 Nov 2025 18:14:00 -0500",[],TSLA
https://www.youtube.com/shorts/QgS8FTWD6Eg,"Musk is ""maniacally dedicated to Tesla"": ARK Strategist","Musk is ""maniacally dedicated to Tesla"": ARK Strategist.",Yahoo Finance,"Sat, 08 Nov 2025 16:30:06 -0500",['CEO'],TSLA
https://www.marketwatch.com/story/musk-has-his-1-trillion-pay-package-heres-what-could-keep-him-from-getting-the-money-3c9a7cf8,Musk has his $1 trillion pay package. Here's what could keep him from getting the money.,"There are two “limiting factors” on Tesla's future, the CEO said, that could keep him from reaching the objectives that would get him paid.",Market Watch,"Sat, 08 Nov 2025 09:30:00 -0500","['CEO', 'paylimitwall']",TSLA
https://invezz.com/news/2025/11/08/cathie-woods-ark-invest-boosts-bitmine-stake-trims-tesla-holdings/?utm_source=snapi,"Cathie Wood's ARK Invest boosts BitMine stake, trims Tesla holdings","Cathie Wood's ARK Invest has expanded its investment in BitMine, the Ether treasury company founded by Tom Lee, while paring back its long-standing exposure to Tesla. The moves, disclosed in ARK's daily trading update on Friday, highlight the firm's shifting focus toward digital asset infrastructure and diversification away from some of its traditional high-conviction positions.",Invezz,"Sat, 08 Nov 2025 04:55:37 -0500",[],TSLA
https://www.wsj.com/finance/stocks/gm-tesla-palantir-expedia-american-airlines-a49b0d2c,"The Score: GM, Tesla, Palantir, American Airlines and More Stocks That Defined the Week",Here are some of the major companies whose stocks moved on the week's news.,WSJ,"Fri, 07 Nov 2025 17:22:00 -0500",['paywall'],TSLA
https://www.investopedia.com/elon-musk-got-his-usd1-trillion-pay-package-now-tesla-s-moonshot-goals-are-in-focus-11845843,Elon Musk Got His $1 Trillion Pay Package. Now Tesla's Moonshot Goals Are In Focus.,Tesla shareholders showed up for Elon Musk. Now it's up to the CEO to make good on his promises and make them—and him—richer.,Investopedia,"Fri, 07 Nov 2025 16:10:37 -0500",['CEO'],TSLA
https://www.youtube.com/watch?v=W2PfwT07oyw,"Tesla Approves Musk Pay, Board to Review xAI Investment","Alexandra Merz, a Tesla shareholder known on social media as TeslaBoomerMama, discusses the approval of Elon Musk's $1 trillion pay package, and what comes next for efforts to get Tesla to invest in xAI. She joins Caroline Hyde and Ed Ludlow on “Bloomberg Tech.",Bloomberg Technology,"Fri, 07 Nov 2025 15:34:11 -0500",['CEO'],TSLA
https://www.youtube.com/watch?v=R8lEdLi_Mv0,"Tesla's push to becoming a robotics company is a gamble, says WSJ's Tim Higgins","WSJ's Tim Higgins joins 'Closing Bell' to discuss Elon Musk's recent pay package, the possibilities of the company's humanoid robots and much more.",CNBC Television,"Fri, 07 Nov 2025 15:22:23 -0500",[],TSLA
https://www.forbes.com/sites/tylerroush/2025/11/07/elon-musk-loses-10-billion-after-tesla-approves-trillion-dollar-pay-deal-heres-why/,Elon Musk Loses $10 Billion After Tesla Approves Trillion-Dollar Pay Deal. Here's Why.,"Musk remains the world's wealthiest person with a net worth estimated at $481.4 billion, following a drop of $10 billion (2%) on Tesla's stock decline. He became the first person to be worth $500 billion and, before that, $400 billion earlier this year, as Tesla's stock surge has propelled him further ahead of No.",Forbes,"Fri, 07 Nov 2025 15:05:03 -0500","['CEO', 'paylimitwall']",TSLA
https://www.fastcompany.com/91437525/tsla-stock-price-elon-musk-got-his-1-trillion-pay-package-heres-how-tesla-investors-are-reacting,TSLA stock price: Elon Musk got his $1 trillion pay package. Here's how Tesla investors are reacting,"Yesterday, Tesla, Inc. (Nasdaq: TSLA) shareholders overwhelmingly approved the controversial and historic pay package deal for the electric vehicle maker's CEO, Elon Musk. That package is worth up to nearly $1 trillion in compensation for Musk—provided the company reaches certain milestones.",Fast Company,"Fri, 07 Nov 2025 14:47:52 -0500","['CEO', 'paylimitwall']",TSLA
https://www.investopedia.com/top-stock-movers-now-tesla-expedia-take-two-block-and-more-11845872,"Top Stock Movers Now: Tesla, Expedia, Take-Two, Block, and More","Major U.S. equities indexes pulled back Friday afternoon, led by the tech sector amid lingering worries about an AI bubble and after a string of weaker-than-expected earnings reports. The Dow, S&P 500, and Nasdaq all lost ground, with the Nasdaq on track to post its worst week since April, when President Donald Trump rattled markets with his ""Liberation Day"" tariffs.",Investopedia,"Fri, 07 Nov 2025 14:05:41 -0500",[],TSLA
