news_url,title,text,source_name,date,topics,tickers
https://www.fool.com/investing/2025/11/16/elon-musks-1-trillion-pay-package-overview/,Elon Musk's $1 Trillion Pay Package: Here's What Investors Need to Know,Musk has 10 years to earn up to $1 trillion. His compensation package hinges on a number of ambitious financial and operational goals.,The Motley Fool,"Sun, 16 Nov 2025 09:47:00 -0500",['CEO'],TSLA
https://www.fool.com/investing/2025/11/16/meet-the-newest-supercharged-growth-stock-to-join/,"Meet the Newest Supercharged Growth Stock to Join Nvidia, Apple, Microsoft, Amazon, Alphabet, Meta, and Taiwan Semiconductor Manufacturing in the $1 Trillion Club. It's Still a Buy Right Now, According to Certain Wall Street Analysts.",Most stocks that have reached a $1 trillion market cap are being driven up by the artificial intelligence trade. One stock that recently joined has been highly volatile over the past year.,The Motley Fool,"Sun, 16 Nov 2025 04:50:00 -0500",[],TSLA
https://www.fool.com/investing/2025/11/16/the-good-the-bad-and-the-ugly-from-earnings-season/,"The Good, the Bad, and the Ugly From Earnings Season","Tariff costs are trending lower, and the U.S. administration is extending relief. Tesla is in a major transition moving towards AI, robotics, and self-driving vehicles.",The Motley Fool,"Sun, 16 Nov 2025 03:23:00 -0500",['earnings'],TSLA
https://www.fool.com/investing/2025/11/15/more-bad-news-for-tesla-rolls-in/,More Bad News for Tesla Rolls In,The head of its Cybertruck program announced he will be leaving the company. This is the latest in a string of executive talent departures seen at Tesla.,The Motley Fool,"Sat, 15 Nov 2025 08:00:00 -0500",[],TSLA
https://www.reuters.com/business/autos-transportation/tesla-requires-suppliers-avoid-china-made-parts-us-cars-wsj-reports-2025-11-15/,"Tesla requires suppliers to avoid China-made parts for US cars, WSJ reports","Tesla is now requiring its suppliers to exclude China-made components in the manufacturing of its cars in the U.S., the Wall Street Journal reported on Friday.",Reuters,"Sat, 15 Nov 2025 03:26:32 -0500",[],TSLA
https://www.wsj.com/business/autos/tesla-china-parts-supply-chain-639efc84,Tesla Requires Suppliers to Avoid Made-in-China Parts for U.S. Cars,This year's U.S. tariffs on Chinese imports pushed the EV maker to accelerate its strategy of cutting China-made components out of its U.S. production.,WSJ,"Sat, 15 Nov 2025 03:09:00 -0500",['paywall'],TSLA
https://www.fool.com/investing/2025/11/14/9-robotics-stocks-to-buy-before-the-automation-wav/,9 Robotics Stocks to Buy Before the Automation Wave Peaks,"Aging populations and wage inflation are making automation economically compelling across warehouses, factories, hospitals, and service industries. The robotics market encompasses a range of industries and niches, from mature surgical systems to warehouse automation and even humanoid platforms designed for household chores.",The Motley Fool,"Fri, 14 Nov 2025 19:00:00 -0500",['StocksToWatch'],TSLA
https://www.marketwatch.com/story/soross-fund-goes-for-this-legacy-automaker-and-sells-off-tesla-and-rivian-stakes-bd53a05b,Soros's fund goes for this legacy automaker — and sells off Tesla and Rivian stakes,"Billionaire investor George Soros's investment fund sold stakes in electric-vehicle makers Tesla and Rivian in the quarter ended Sept. 30 — instead preferring to open a fresh position in legacy automaker Ford, according to a securities filing released late Friday.",Market Watch,"Fri, 14 Nov 2025 17:57:00 -0500",['paylimitwall'],TSLA
https://www.zacks.com/commentary/2791496/ron-baron-why-his-8-billion-tesla-windfall-could-balloon-further?cid=CS-STOCKNEWSAPI-FT-investment_ideas-2791496,Ron Baron: Why His $8 Billion Tesla Windfall Could Balloon Further,"Ron Baron has amassed a massive $8 billion in personal gains from Tesla shares. In a recent interview, Baron reiterated his ultra-bullish stance on Tesla.",Zacks Investment Research,"Fri, 14 Nov 2025 17:36:04 -0500",[],TSLA
https://techcrunch.com/2025/11/14/tesla-releases-detailed-safety-report-after-waymo-co-ceo-called-for-more-data/,Tesla releases detailed safety report after Waymo co-CEO called for more data,"Tesla has published the most detailed look at the performance and relative safety of its advanced driver assistance software, just a few weeks after Waymo's co-CEO Tekedra Mawakana at TechCrunch Disrupt called on companies to release more data.",TechCrunch,"Fri, 14 Nov 2025 16:57:21 -0500",['CEO'],TSLA
https://www.youtube.com/watch?v=cgl3owEGAaU,"The Big 3: TSLA, NVDA, PLTR",Tim Bohen (@Stockstotrade) doubles down on his A.I. thesis and discredits Michael Burry's shorts against Nvidia (NVDA) and Palantir (PLTR).,Schwab Network,"Fri, 14 Nov 2025 13:00:48 -0500",[],TSLA
https://www.benzinga.com/trading-ideas/technicals/25/11/48873422/stock-of-the-day-where-will-the-tesla-sell-off-end?utm_source=snapi,Stock Of The Day: Where Will The Tesla Sell-Off End?,"Tesla, Inc.  (NASDAQ: TSLA) shares are higher on Friday. Some analysts attribute the recent drop to weak EV demand.",Benzinga,"Fri, 14 Nov 2025 12:48:34 -0500",['paywall'],TSLA
https://www.youtube.com/shorts/WBHqKS3w-nc,Ron Baron: I don't expect to sell Tesla of SpaceX in my lifetime,"Ron Baron, Baron Capital chairman and CEO, said Friday that he doesn't plan to sell Tesla or SpaceX in his lifetime. Baron asserted that Elon Musk is different from entrepreneurs of the past, likening him to Leonardo da Vinci for his artistic approach to business.",CNBC Television,"Fri, 14 Nov 2025 11:48:45 -0500",[],TSLA
https://www.benzinga.com/trading-ideas/long-ideas/25/11/48870055/ron-baron-says-tesla-could-5x-and-spacex-10x-says-musk-is-like-da-vinci?utm_source=snapi,Ron Baron Says Tesla Could 5X And SpaceX 10X — Says Musk Is 'Like Da Vinci',"Billionaire investor Ron Baron has had high conviction in Elon Musk for years. The investor, who owns stakes in Tesla Inc (NASDAQ: TSLA), SpaceX and xAI, may have even more conviction in Musk for the future.",Benzinga,"Fri, 14 Nov 2025 11:22:01 -0500","['CEO', 'paywall']",TSLA
https://www.forbes.com/sites/siladityaray/2025/11/14/tesla-intel-and-more-lead-tech-selloff-as-stocks-decline-bitcoin-slips-to-six-month-low/,"Tesla, Intel And More Lead Tech Selloff As Stocks Decline—Bitcoin Slips To Six-Month Low","The cryptocurrency market was also hit by a selloff, with the price of bitcoin dropping below $96,000 for the first time in six months before paring back earlier losses. The world's most valuable cryptocurrency is down more than 6.3% over the past 24 hours, falling to around $96,466 after earlier falling to as low as $94,592, the lowest level for the leading cryptocurrency since May.",Forbes,"Fri, 14 Nov 2025 10:40:16 -0500",['paylimitwall'],TSLA
https://seekingalpha.com/article/4843843-why-tesla-pullback-could-be-a-bullish-setup-into-2026,Why Tesla's Pullback Could Be A Bullish Setup Into 2026,"Tesla, Inc. is rated a buy, with the recent 20% pullback seen as a compelling buying opportunity in this Mag-7 name. TSLA's long-term growth is driven by AI, robotics, Robotaxi, and Optimus, with strong vehicle sales and expanding energy storage operations supporting fundamentals. Technical analysis shows key support for TSLA stock near $360, with bullish calendar trends and a rising 200-day moving average reinforcing the positive outlook.",Seeking Alpha,"Fri, 14 Nov 2025 10:15:52 -0500",['paylimitwall'],TSLA
https://www.zacks.com/stock/news/2791162/tesla-s-2026-capex-plan-betting-big-on-ai-autonomy-and-robots?cid=CS-STOCKNEWSAPI-FT-analyst_blog|quick_take-2791162,"Tesla's 2026 Capex Plan: Betting Big on AI, Autonomy and Robots","TSLA gears up for a major 2026 capex surge as it doubles down on AI, autonomy and robotics to fuel its next growth phase.",Zacks Investment Research,"Fri, 14 Nov 2025 10:01:53 -0500",[],TSLA
https://seekingalpha.com/article/4843864-baron-fifth-avenue-growth-fund-q3-2025-performance-update,Baron Fifth Avenue Growth Fund Q3 2025 Performance Update,"Baron Fifth Avenue Growth Fund gained 5.7% during the third quarter, lagging the 10.5% gain for the Russell 1000 Growth Index and the 8.1% gain for the S&P 500 Index, the Fund's benchmarks. NVIDIA reported mid-term visibility of tens of GWs in AI buildouts, with each GW representing an estimated $35 billion total addressable market. Growth was broad-based across Shopify's core e-commerce merchant base and supported by successful expansion into offline, international, and business-to-business channels, which grew 29%, 42%, and 101%, respectively.",Seeking Alpha,"Fri, 14 Nov 2025 10:00:00 -0500",['paylimitwall'],TSLA
https://www.zacks.com/stock/news/2791089/tesla-s-shares-tumble-a-tactical-entry-point-for-etf-investors?cid=CS-STOCKNEWSAPI-FT-etf_news_and_commentary-2791089,Tesla's Shares Tumble: A Tactical Entry Point for ETF Investors?,"TSLA's sharp drop puts ETFs like XLY and DRIV in focus as investors weigh risks, valuation pressure and long-term innovation bets.",Zacks Investment Research,"Fri, 14 Nov 2025 09:06:10 -0500",[],TSLA
https://www.fastcompany.com/91442171/hot-tech-stocks-are-tumbling-why-tesla-palantir-nvidia-and-others-are-leading-a-market-selloff-today,"Hot tech stocks are tumbling: Why Tesla, Palantir, Nvidia, and others are leading a market selloff today","The stock market survived the longest government shutdown in U.S. history with minimal impact. But it tumbled on Thursday, November 13, amid a sell-off of tech stocks as worries about overinflated values and interest rate cuts grew.",Fast Company,"Fri, 14 Nov 2025 08:51:15 -0500",['paylimitwall'],TSLA
https://www.cnbc.com/2025/11/14/investor-ron-baron-says-the-tech-selloff-is-an-opportunity-and-hes-never-selling-personal-tesla-stake.html,Investor Ron Baron says the tech selloff is an opportunity and he's never selling personal Tesla stake,"Baron said he's already made about $8 billion from Tesla over the years, and he believes he could make five times that over the next decade",CNBC,"Fri, 14 Nov 2025 08:46:04 -0500",[],TSLA
https://www.investors.com/news/elon-musk-losing-money-1-billion-tesla-stock-purchase/,Elon Musk Is Now Losing Money On His Big $1 Billion Tesla Stock Purchase,Tesla stock is set to open Friday below the 400 level.,Investors Business Daily,"Fri, 14 Nov 2025 08:40:15 -0500",['CEO'],TSLA
https://www.youtube.com/watch?v=ngUr1qIwuuE,Ron Baron: I don't expect to sell my personal Tesla or SpaceX shares in my lifetime,"Ron Baron, Baron Capital chairman and CEO, joins 'Squawk Box' to discuss the latest market trends, future of Tesla, CEO Elon Musk's pay package, his thoughts on Elon Musk, what to expect from the 32nd annual Baron Investment Conference, and more.",CNBC Television,"Fri, 14 Nov 2025 08:26:02 -0500",[],TSLA
https://www.marketbeat.com/originals/tesla-has-been-trapped-in-a-10-range-for-monthswhats-going-on/?utm_source=snapi,Tesla Has Been Trapped in a 10% Range for Months—What's Going On?,"Shares of Tesla Inc. NASDAQ: TSLA were trading around $430 on the afternoon of Nov. 12, in what was shaping up to be yet another quiet session. The stock has been uncharacteristically range-bound between $420 and $470 for almost two months, with every attempt to break out, in either direction, swiftly rejected.",MarketBeat,"Fri, 14 Nov 2025 07:09:52 -0500",[],TSLA
https://www.pymnts.com/apple/2025/apples-carplay-could-soon-become-part-of-tesla-vehicles/?utm_source=snapi,Apple's CarPlay Could Soon Become Part of Tesla Vehicles,"Tesla is reportedly developing support for Apple CarPlay in its vehicles. That's according to a report Thursday (Nov. 13) from Bloomberg News, which noted that this is one of the most-requested features from Tesla's customers.",PYMNTS,"Thu, 13 Nov 2025 16:14:29 -0500",[],TSLA
https://www.cnbc.com/2025/11/13/tesla-recall-powerwall-2-overheating-fire-battery.html,"Tesla recalls 10,500 Powerwall 2 battery systems due to overheating, fire risk","Tesla is recalling around 10,500 of its Powerwall 2 home, backup battery systems due to risk of overheating, burns and fires. The U.S. Consumer Product Safety Commission and Tesla said, in a recall notice, that the issue was due to a ""third-party battery cell defect.",CNBC,"Thu, 13 Nov 2025 14:58:22 -0500",[],TSLA
https://www.marketwatch.com/story/teslas-sharpest-stock-drop-in-months-puts-it-back-in-the-red-for-the-year-bf70dd90,Tesla's sharpest stock drop in months puts it back in the red for the year,The Elon Musk-led company recently said it would recall some residential energy products.,Market Watch,"Thu, 13 Nov 2025 14:54:00 -0500",['paylimitwall'],TSLA
https://nypost.com/2025/11/13/business/elon-musks-tesla-working-to-add-apple-carplay-in-bid-to-boost-sales-report/,Tesla working to add Apple CarPlay in bid to boost EV sales: report,"CarPlay allows users to control iPhone features such as navigation, music and messaging through a vehicle's built-in display.",New York Post,"Thu, 13 Nov 2025 13:10:08 -0500",[],TSLA
https://www.youtube.com/watch?v=rEhqea6sgM0,Tesla Developing Support for Apple CarPlay,"Tesla is developing support for Apple's CarPlay system in its vehicles, according to people with knowledge of the matter. Mark Gurman reports on ""Bloomberg Tech.",Bloomberg Markets and Finance,"Thu, 13 Nov 2025 13:09:05 -0500",[],TSLA
https://www.cnbc.com/2025/11/13/elon-musk-trillion-dollar-pay-tesla-china-robots.html,Op-ed: Chinese robots are coming for Elon Musk's trillion-dollar Tesla payday,"Elon Musk's bid to become the world's first trillionaire increasingly rests on a single proposition: that Tesla can evolve from an electric vehicle company into a robotics powerhouse. In 2023, China installed over 290,000 industrial robots, more than the rest of the world combined, with robot density reaching 470 robots per 10,000 workers, surpassing Japan and Germany for the first time.",CNBC,"Thu, 13 Nov 2025 12:05:45 -0500",['CEO'],TSLA
https://techcrunch.com/2025/11/13/tesla-might-finally-bring-carplay-to-its-evs/,Tesla might finally bring CarPlay to its EVs,"While automakers like General Motors have started to sour on Apple CarPlay, Tesla is reportedly working on integrating the system into its vehicles' software stack.",TechCrunch,"Thu, 13 Nov 2025 12:05:25 -0500",[],TSLA
https://invezz.com/news/2025/11/13/why-tesla-stock-plunged-6-and-why-is-it-still-a-retail-favorite/?utm_source=snapi,Why Tesla stock plunged 6% and why is it still a retail favorite?,"Tesla stock extended its recent slide on Thursday, falling sharply alongside broader market losses. Shares of the electric vehicle maker dropped 6.2% to $403.87 in midday trading, down $26.73, making it the worst-performing stock in the Nasdaq 100, according to Dow Jones Market Data.",Invezz,"Thu, 13 Nov 2025 12:01:15 -0500",[],TSLA
https://www.fxempire.com/forecasts/article/sp500-nvidia-alphabet-tesla-sink-as-tech-sector-faces-broad-rebalancing-1561011,"S&P500: Nvidia, Alphabet, Tesla Sink as Tech Sector Faces Broad Rebalancing","US stocks fell as Nvidia, Alphabet, and Tesla led tech losses. Traders brace for missing data and Fed uncertainty.",FXEmpire,"Thu, 13 Nov 2025 11:57:12 -0500",[],TSLA
https://www.zacks.com/stock/news/2790694/can-tesla-s-new-model-y-rev-up-china-sales-after-a-3-year-low?cid=CS-STOCKNEWSAPI-FT-analyst_blog|quick_take-2790694,Can Tesla's New Model Y+ Rev Up China Sales After a 3-Year Low?,Tesla's new Model Y+ boasts 821 km of range and aims to reignite China sales after hitting a three-year low in October.,Zacks Investment Research,"Thu, 13 Nov 2025 11:51:06 -0500",['product'],TSLA
https://www.youtube.com/watch?v=jAUj4nc9M3k,Tesla CEO Elon Musk says demand for Optimus robots 'will be insatiable'.,"CNBC's David Faber sits down at Tesla HQ with CEO Elon Musk for a wide ranging conversation on self-driving, semiconductors, AI, China, and more.",CNBC Television,"Thu, 13 Nov 2025 11:50:11 -0500",['CEO'],TSLA
https://www.reuters.com/business/autos-transportation/tesla-working-integrate-apple-carplay-its-evs-bloomberg-news-reports-2025-11-13/,"Tesla working to integrate Apple CarPlay in its EVs, Bloomberg News reports","Tesla is developing support for Apple's CarPlay system in its electric vehicles, Bloomberg News reported on Thursday, citing people familiar with the matter.",Reuters,"Thu, 13 Nov 2025 11:37:43 -0500",[],TSLA
https://techcrunch.com/2025/11/13/tesla-powerwall-2-recall-expands-to-us-after-reports-of-fires/,Tesla Powerwall 2 recall expands to US after reports of fires,"Tesla is recalling more than 10,000 Powerwall 2 home batteries sold in the U.S. after nearly two dozen confirmed incidents of the units overheating, emitting smoke, or catching fire.",TechCrunch,"Thu, 13 Nov 2025 11:26:12 -0500",[],TSLA
https://www.reuters.com/business/autos-transportation/tesla-recalls-10500-powerwall-2-batteries-us-over-fire-risk-2025-11-13/,"Tesla recalls 10,500 Powerwall 2 batteries in US over fire risk","Tesla said on Thursday it is recalling about 10,500 units of its Powerwall 2 battery power systems in the U.S. for fire and burn hazards after receiving 22 reports of overheating.",Reuters,"Thu, 13 Nov 2025 10:53:10 -0500",[],TSLA
https://www.fxempire.com/forecasts/article/tsla-pltr-and-smci-forecast-stocks-look-slightly-weak-early-on-thursday-1560990,"TSLA, PLTR and SMCI Forecast – Stocks Look Slightly Weak Early on Thursday","Stocks appear soft in early Thursday trading, with Tesla, Palantir, and Super Micro Computer all showing signs of pressure. Key support levels sit below current prices, and broader market weakness suggests patience is needed before taking positions.",FXEmpire,"Thu, 13 Nov 2025 09:42:47 -0500",[],TSLA
https://www.zacks.com/stock/news/2790363/can-musk-s-optimus-dream-power-tesla-s-next-growth-phase?cid=CS-STOCKNEWSAPI-FT-analyst_blog|quick_take-2790363,Can Musk's Optimus Dream Power Tesla's Next Growth Phase?,"TSLA bets big on its humanoid robot Optimus, planning mass production by 2027 to fuel its next growth chapter beyond EVs.",Zacks Investment Research,"Thu, 13 Nov 2025 08:36:13 -0500",['CEO'],TSLA
https://www.benzinga.com/markets/tech/25/11/48831900/teslas-robotaxi-revolution-is-still-downloading-waymos-already-in-the-fast-lane?utm_source=snapi,Tesla's Robotaxi Revolution Is Still Downloading — Waymo's Already In The Fast Lane,"If you're stuck behind a polite, speed-limit-loving car on a California freeway, there's a good chance it's Waymo — the robotaxi that's now officially conquering highways across San Francisco, Los Angeles and Phoenix. And while the Tesla Inc (NASDAQ: TSLA) CEO Elon Musk keeps promising a self-driving future that spreads ""faster than any technology ever,"" Waymo is quietly doing the unglamorous thing: actually launching it.",Benzinga,"Thu, 13 Nov 2025 08:27:42 -0500",['paywall'],TSLA
https://www.barrons.com/articles/tesla-stock-investors-shares-80f3fd50,Tesla Stock Is Down as Retail Investors Continue to Pile Into Shares,Tesla remains a popular stock with smaller investors.,Barrons,"Thu, 13 Nov 2025 08:21:00 -0500",['paywall'],TSLA
https://247wallst.com/forecasts/2025/11/13/tesla-tsla-price-prediction-and-forecast/?utm_source=snapi,Tesla (NASDAQ: TSLA) Stock Price Prediction and Forecast 2025-2030 (Nov 13),"Tesla Inc.'s (NASDAQ: TSLA) share price is 3.5% lower than a week ago, when it was trading near an all-time high, after shareholders approved CEO Elon Musk's record-breaking $1 trillion pay package and some key executives left the company.",24/7 Wall Street,"Thu, 13 Nov 2025 08:20:09 -0500",[],TSLA
https://www.investors.com/news/tesla-stock-biggest-supporter-cathie-wood-stake-four-straight-sessions/,Tesla Stock's Biggest Supporter Cuts Stake For Four Straight Sessions,Tesla stock is down more than 5% in November and Cathie Wood has sold TSLA in four consecutive sessions.,Investors Business Daily,"Thu, 13 Nov 2025 08:13:21 -0500",[],TSLA
https://seekingalpha.com/article/4843047-2-years-of-rise-of-magnificent-seven-tech-stocks,2 Years Of The Rise Of The 'Magnificent Seven' Tech Stocks,"The seven companies that make up the S&P 500's ""Magnificent Seven"" stocks have been on the rise for some time. Two years ago, they combined to account for 30% of the total valuation of the S&P 500 (SPX).",Seeking Alpha,"Thu, 13 Nov 2025 07:36:00 -0500",['paylimitwall'],TSLA
https://www.youtube.com/watch?v=MdXpXB45w8c,"Munoz: Economy Supports Rally, META Undervalued & TSLA Still a Buy","Alonso Munoz says the fundamentals to the U.S. economy remain strong and support a ""Christmas rally"" into the end of the year. He also sees the FOMC cutting interest rates again in December that would add fuel to the expected rally.",Schwab Network,"Wed, 12 Nov 2025 15:15:03 -0500",[],TSLA
https://invezz.com/news/2025/11/12/tesla-stock-continues-slide-why-the-elon-musk-company-is-down-2-today/?utm_source=snapi,Tesla stock continues slide: why the Elon Musk company is down 2% today,"Tesla's stock fell early Wednesday as data showed a sharp drop in global vehicle sales during October, highlighting continued weakness across key markets even as investors remain fixated on the company's artificial intelligence ambitions. Shares were down more than 2% at $429.",Invezz,"Wed, 12 Nov 2025 11:19:55 -0500",['CEO'],TSLA
https://finbold.com/wall-street-analyst-updates-tesla-stock-price-after-musks-1-trillion-package-approval/?utm_source=snapi,Wall Street analyst updates Tesla stock price after Musk's $1 trillion package approval,Tesla's (NASDAQ: TSLA) stock outlook has been updated following the approval of CEO Elon Musk's massive $1 trillion pay package.,Finbold,"Wed, 12 Nov 2025 07:49:00 -0500",['CEO'],TSLA
https://www.barrons.com/articles/tesla-stock-october-ev-sales-b7582880,Tesla Stock Rises. October Electric Vehicle Sales Were Tougher Than Expected.,Tesla sales have been weak in October. Investors don't seem to mind.,Barrons,"Wed, 12 Nov 2025 07:43:00 -0500",['paywall'],TSLA
https://seekingalpha.com/article/4842331-baron-technology-fund-q3-2025-top-contributors-detractors,Baron Technology Fund Q3 2025 Top Contributors And Detractors,We remain confident in AI's potential to transform the global economy and in NVIDIA's pivotal role as the leading enabler of that transformation. We retain our long-term conviction in Broadcom's position within the AI ecosystem. Shares of PAR fell during the quarter as the company lowered its annual recurring revenue growth outlook for the year to 15% (from prior 20% expectations) due to weak macro conditions for its restaurant customers.,Seeking Alpha,"Wed, 12 Nov 2025 05:00:00 -0500",['paylimitwall'],TSLA
https://www.fool.com/investing/2025/11/11/could-buying-tesla-today-set-you-up-for-life/,Could Buying Tesla Today Set You Up for Life?,"Robotaxis and unsupervised full self-driving (FSD) could add value and new income streams. Cash flow from these businesses could fund the Optimus robot project, which CEO Elon Musk believes could represent up to 80% of Tesla's future value.",The Motley Fool,"Tue, 11 Nov 2025 20:12:00 -0500",[],TSLA
https://www.benzinga.com/markets/tech/25/11/48789884/tesla-vs-xpeng-musks-optimus-meets-xiaopengs-iron-in-the-ai-race?utm_source=snapi,Tesla Vs. XPeng: Musk's Optimus Meets Xiaopeng's Iron In The AI Race,"Elon Musk wasn't the only electric car CEO showing off humanoid robots and flying cars last week. At XPeng Inc (NYSE:XPEV) AI Day last week, CEO He Xiaopeng unveiled Iron, a humanoid robot prototype that instantly drew comparisons to Tesla Inc's (NASDAQ:TSLA) Optimus.",Benzinga,"Tue, 11 Nov 2025 15:04:18 -0500","['CEO', 'paywall']",TSLA
https://seekingalpha.com/article/4842026-tesla-still-a-strong-buy-on-pullbacks,Tesla: Still A Strong Buy (On Pullbacks),"Tesla, Inc. remains a Strong Buy for the intermediate and long term, supported by robust sales, margin resilience, and global expansion. TSLA delivered a record quarter with a significant sales beat, 18% gross margin, and growing non-automotive revenue streams like energy, FSD potential, and future AI prospects. Despite potential near-term volatility and a possible 15-20% pullback, TSLA's premium valuation is justified by its tech-driven growth prospects.",Seeking Alpha,"Tue, 11 Nov 2025 14:52:18 -0500",['paylimitwall'],TSLA
https://www.marketwatch.com/story/as-tesla-doubles-down-on-ai-this-analyst-says-its-stock-has-gotten-harder-to-recommend-09d09344,"As Tesla doubles down on AI, this analyst says its stock has gotten harder to recommend",Tesla's stock valuation is increasingly linked to AI initiatives around humanoid robots and robotaxis that aren't bringing in revenue — for now.,Market Watch,"Tue, 11 Nov 2025 12:33:00 -0500",['paylimitwall'],TSLA
https://nypost.com/2025/11/11/business/tesla-turns-to-rentals-as-us-sales-slump-after-ev-tax-credit-expires/,Tesla turns to $60-a-day rentals as US sales slump after EV tax credit expires,Tesla is launching a short-term rental program out of its stores as inventories swell across the country.,New York Post,"Tue, 11 Nov 2025 12:27:58 -0500",[],TSLA
https://www.investopedia.com/tesla-stock-is-slipping-today-as-investors-eye-chinese-sales-numbers-11847299,Tesla Stock Is Slipping Today as Investors Eye Chinese Sales Numbers,"Talking about Tesla's auto sales just a few days after a $1 trillion vote might seem odd—but while they might not be the most interesting thing about the company these days, they still matter.",Investopedia,"Tue, 11 Nov 2025 11:25:41 -0500",[],TSLA
https://invezz.com/news/2025/11/11/tesla-stock-slides-over-2-whats-hurting-the-ev-stock-today/?utm_source=snapi,Tesla stock slides over 2%: what's hurting the EV stock today,"Tesla stock was jittery in early trade on Thursday, declining more than 2% as fresh analyst commentary and new global sales data pointed to broad-based weakness in October deliveries.",Invezz,"Tue, 11 Nov 2025 11:14:42 -0500",[],TSLA
