news_url,title,text,source_name,date,topics,tickers
https://www.zacks.com/stock/news/2789635/these-mega-tech-giants-generate-robust-cash?cid=CS-STOCKNEWSAPI-FT-stocks_in_the_news-2789635,These Mega Tech Giants Generate Robust Cash,"Strong cash flows reflect financial stability, allowing companies to pay down debt, pursue growth opportunities, and shell out dividend payments.",Zacks Investment Research,"Tue, 11 Nov 2025 21:21:06 -0500",[],AAPL
https://www.youtube.com/watch?v=QWidoOPhbJo,"Apple's minimal AI spend may lead to big gaps in competition, says Big Technology's Alex Kantrowitz","CNBC's Alex Kovach and Big Technology's Alex Kantrowitz join 'Closing Bell' to discuss Apple's AI strategy, challenges with minimal spend and much more.",CNBC Television,"Tue, 11 Nov 2025 16:17:58 -0500",[],AAPL
https://www.youtube.com/watch?v=PNr6-BU_8og,"The Big 3: GOOGL, AAPL, TSM","Jessica Inskip (@jessicainskip) focuses on Big Tech for today's Big 3. She explains how Alphabet's (GOOGL) TPU growth and Google search play into a long-term bull thesis, Apple's (AAPL) ever-changing ecosystem and product diversification, and TSMC's (TSM) cash war chest and role in the center of the A.I.",Schwab Network,"Tue, 11 Nov 2025 12:30:07 -0500",[],AAPL
https://nypost.com/2025/11/11/business/apple-pulls-plug-on-iphone-air-2-after-weak-sales-of-debut-model-report/,Apple reportedly pulls plug on iPhone Air 2 after weak sales of debut model,Follow-up model -- internally known as “V62” -- had been slated to debut in fall 2026 alongside the iPhone 18 Pro and Apple's first foldable iPhone.,New York Post,"Tue, 11 Nov 2025 12:21:52 -0500",['product'],AAPL
https://www.businesswire.com/news/home/20251111327460/en/Prana-Labs-Secures-150K-to-Advance-Vayu-Its-AI-Guided-Breathwork-and-Mindful-Technology-Platform/,"Prana Labs Secures $150K to Advance Vayu, Its AI-Guided Breathwork and Mindful Technology Platform","VANCOUVER, British Columbia--(BUSINESS WIRE)---- $AAPL #breathwork--Prana Labs Inc., a Vancouver-based wellness technology company and creator of the AI-powered breathwork platform Vayu, has secured $150,000 in growth funding through national innovation partners. The investment fuels Prana Labs' mission to make mindful technology more accessible, measurable, and human-centered. Founded by Deepali Raiththa and Dhruv Adhia, Prana Labs blends neuroscience, haptic design, and AI personalization to create embodied wellne.",Business Wire,"Tue, 11 Nov 2025 12:00:00 -0500",['PressRelease'],AAPL
https://www.forbes.com/sites/greatspeculations/2025/11/11/what-will-drive-apple-stocks-next-big-move/,What Will Drive Apple Stock's Next Big Move?,"Apple stock (NASDAQ:AAPL) has a robust history of quick up moves, with rallies of over 30% in less than two months during several years including 2010, 2019, and 2024. Particularly, there were two instances where the gains surpassed 50% within approximately two months, notably in 2012 and 2020.",Forbes,"Tue, 11 Nov 2025 09:50:09 -0500",['paylimitwall'],AAPL
https://www.fxempire.com/forecasts/article/amzn-aapl-and-goog-forecast-major-us-stocks-quiet-in-premarket-1560434,"AMZN, AAPL and GOOG Forecast – Major US Stocks Quiet in Premarket","Tech stocks were subdued in pre-market trading on Tuesday. The analyst sees short-term consolidation across Amazon, Apple, and Google but maintains a bullish long-term outlook, viewing any pullbacks as potential buying opportunities.",FXEmpire,"Tue, 11 Nov 2025 08:45:18 -0500",[],AAPL
https://www.fool.com/investing/2025/11/11/247-of-warren-buffetts-315-billion-portfolio-at-b/,24.7% of Warren Buffett's $315 Billion Portfolio at Berkshire Hathaway Is Invested in These 2 Unstoppable Stocks,"Apple and Visa make up over a fifth of Buffett's portfolio, although the former has a far larger presence. Apple is proving the doubters wrong and showing that its most important segment can still be a winner.",The Motley Fool,"Tue, 11 Nov 2025 07:00:00 -0500",['wbuffett'],AAPL
https://www.fool.com/investing/2025/11/11/buy-apple-microsoft-nvidia-vanguard-tech-etf/,Apple and Microsoft Join Nvidia in the $4 Trillion Club. Here's How You Can Buy All 3 Growth Stocks for as Little as $1.,"Vanguard's dollar-based approach allows investors to buy ETFs for a specific dollar amount rather than having to purchase whole shares. The Vanguard Information Technology ETF has crushed the Nasdaq Composite and S&P 500 over the last three-, five-, and 10-year periods.",The Motley Fool,"Tue, 11 Nov 2025 05:20:00 -0500",[],AAPL
https://www.fool.com/investing/2025/11/10/5-warren-buffett-stocks-to-hold-forever/,5 Warren Buffett Stocks to Hold Forever,Berkshire Hathaway has massive investments in Apple and American Express. Amazon Web Services is growing quickly.,The Motley Fool,"Mon, 10 Nov 2025 21:02:00 -0500",['wbuffett'],AAPL
https://www.pymnts.com/apple/2025/apple-weighing-future-of-fitness-app/?utm_source=snapi,Apple Weighing Future of Fitness+ App,"Apple reportedly wants to determine whether Apple Fitness+ is still a good fit for Apple. As Bloomberg News' Mark Gurman wrote in his weekly column on the tech giant, the future of the app-based fitness platform is now under review, with Apple health head Sumbul Desai taking over management of that division.",PYMNTS,"Mon, 10 Nov 2025 16:59:27 -0500",[],AAPL
https://www.proactiveinvestors.com/companies/news/1082193?SNAPI,"Apple's iPhone 17 demand in China may have peaked, Jefferies says","Apple Inc (NASDAQ:AAPL, ETR:APC)'s latest iPhone surge in China may be losing steam after an initial wave of strong demand for the iPhone 17 series, according to Jefferies analysts, who said sales are likely to taper as discounts and subsidies run out. Jefferies estimates that iPhone volumes in China grew about 40% year-over-year in October and 38% during the first 30 days of the Double 11 shopping period, driven by robust demand for the iPhone 17 Pro and Pro Max models.",Proactive Investors,"Mon, 10 Nov 2025 15:00:29 -0500",['product'],AAPL
https://www.reuters.com/world/asia-pacific/apple-delays-next-version-iphone-air-information-reports-2025-11-10/,"Apple delays next version of iPhone Air, the Information reports","Apple will delay the next version of the iPhone Air amid weak sales and it will not be released in the fall of 2026, the Information reported on Monday, citing sources familiar with the matter.",Reuters,"Mon, 10 Nov 2025 14:22:48 -0500",['product'],AAPL
https://247wallst.com/investing/2025/11/10/3-top-warren-buffett-picks-that-will-stand-the-test-of-time/?utm_source=snapi,3 Top Warren Buffett Picks that Will Stand the Test of Time,Warren Buffett is undoubtedly going to go down in the history books as one of the best investors of all time.,24/7 Wall Street,"Mon, 10 Nov 2025 12:38:40 -0500",['wbuffett'],AAPL
https://247wallst.com/investing/2025/11/10/3-reasons-apple-stock-is-a-great-buy-at-new-highs/?utm_source=snapi,3 Reasons Apple Stock is a Great Buy at New Highs,"Apple (NASDAQ:AAPL) stock has been a surprisingly good performer in the last few months, thanks in part to some decent quarterly earnings results and optimism about iPhone 17 going into the holidays and beyond.",24/7 Wall Street,"Mon, 10 Nov 2025 11:21:23 -0500",[],AAPL
https://www.reuters.com/sustainability/boards-policy-regulation/critics-call-proposed-changes-landmark-eu-privacy-law-death-by-thousand-cuts-2025-11-10/,Critics call proposed changes to landmark EU privacy law 'death by a thousand cuts',"Privacy activists say proposed changes to Europe's landmark privacy law, including making it easier for Big Tech to harvest Europeans' personal data for AI training, would flout EU case law and gut the legislation.",Reuters,"Mon, 10 Nov 2025 10:04:20 -0500",[],AAPL
https://seekingalpha.com/article/4841228-american-century-growth-fund-q3-2025-portfolio-review,American Century Growth Fund Q3 2025 Portfolio Review,"Intuit posted a quarter that met expectations, but its revenue forecast was below consensus, sending the stock lower. We initiated a position in Oracle during the period but were underweight on average, which detracted from performance compared with the benchmark. Despite Progressive's solid businesses, the insurance sector faced pressure, and we opted to redeploy capital into areas with stronger secular growth potential.",Seeking Alpha,"Mon, 10 Nov 2025 08:18:00 -0500",['paylimitwall'],AAPL
https://247wallst.com/investing/2025/11/10/here-are-mondays-top-wall-street-analyst-research-calls-advanced-micro-devices-alphabet-apple-eli-lilly-carmax-hubspot-and-more/?utm_source=snapi,"Here Are Monday's Top Wall Street Analyst Research Calls: Advanced Micro Devices, Alphabet, Apple, Eli Lilly, CarMax, HubSpot, and More","The futures are trading higher as the new week begins, with most investors and traders relieved that last week has come to a close.",24/7 Wall Street,"Mon, 10 Nov 2025 08:11:02 -0500",['manda'],AAPL
https://247wallst.com/investing/2025/11/10/as-warren-buffett-waves-goodbye-5-dividend-stocks-that-never-leave-berkshire-hathaway/?utm_source=snapi,"As Warren Buffett Waves Goodbye, 5 Dividend Stocks That Never Leave Berkshire Hathaway","If any investor has stood the test of time, it is Warren Buffett, and with good reason.",24/7 Wall Street,"Mon, 10 Nov 2025 07:43:06 -0500","['dividend', 'wbuffett']",AAPL
https://www.fool.com/investing/2025/11/10/did-warren-buffett-sell-more-shares-of-apple/,Did Warren Buffett Sell More Shares of Apple?,"Berkshire initiated a position in Apple in 2016. The investment has done very well, but Berkshire has sold about two-thirds of its position in recent years.",The Motley Fool,"Mon, 10 Nov 2025 03:55:00 -0500",['wbuffett'],AAPL
https://www.fool.com/investing/2025/11/09/warren-buffetts-portfolio-for-2026/,23% of Warren Buffett's $257 Billion Portfolio for 2026 Is Invested in These 2 Unstoppable Stocks,"Warren Buffett generally doesn't invest in tech stocks, but he couldn't resist the following two. These players have something Buffett likes: fantastic moats, or competitive advantages.",The Motley Fool,"Sun, 09 Nov 2025 19:30:00 -0500",['wbuffett'],AAPL
https://techcrunch.com/2025/11/09/apple-reportedly-plans-ambitious-satellite-powered-iphone-features/,Apple reportedly plans ambitious satellite-powered iPhone features,"While Apple's iPhone already supports texting, calling emergency services, and contacting roadside assistance via satellite connectivity, the company has many more satellite-powered features in the works, according to Bloomberg's Mark Gurman.",TechCrunch,"Sun, 09 Nov 2025 12:42:00 -0500",['product'],AAPL
https://247wallst.com/investing/2025/11/09/can-apple-shares-surge-past-300-this-year/?utm_source=snapi,Can Apple Shares Surge Past $300 This Year?,"Shares of Apple (NASDAQ:AAPL) have been making up for lost time in the year's second half, now up more than 26% in the last three months, putting the iPhone maker up just shy of 11% year to date.",24/7 Wall Street,"Sun, 09 Nov 2025 09:08:34 -0500",[],AAPL
https://www.fool.com/investing/2025/11/08/apple-is-berkshire-hathaways-largest-holding-by-va/,Apple Is Berkshire Hathaway's Largest Holding by Value. But Is the California-Based Company Still a Strong Play for Long-Term Growth?,"Apple has delivered superior returns over the long run, but it has faced some challenges recently. The company is diligently working on overcoming these issues.",The Motley Fool,"Sat, 08 Nov 2025 13:41:00 -0500",[],AAPL
https://247wallst.com/investing/2025/11/08/why-apple-stock-might-be-spared-if-an-ai-bubble-bursts/?utm_source=snapi,Why Apple Stock Might Be Spared If an AI Bubble Bursts,"With stocks wobbling in the past week over potential AI valuation worries, investors might have noticed that much of the Magnificent Seven has been increasingly choppy while Apple (NASDAQ:AAPL) has acted like a steady rock, holding its ground at around $270 per share.",24/7 Wall Street,"Sat, 08 Nov 2025 09:11:47 -0500",[],AAPL
https://247wallst.com/investing/2025/11/08/as-warren-buffett-waves-goodbye-5-dividend-stocks-that-never-leave-berkshire-hathaway/?utm_source=snapi,As Warren Buffett Waves Goodbye – 5 Dividend Stocks That Never Leave Berkshire Hathaway,"If any investor has stood the test of time, it's Warren Buffett, and with good reason.",24/7 Wall Street,"Sat, 08 Nov 2025 07:31:06 -0500","['dividend', 'wbuffett']",AAPL
https://www.wsj.com/tech/apple-iphone-air-sales-response-7f0c01f1,Apple's iPhone Air Is a Marketing Win and a Sales Flop,"Just one in 10 iPhone 17 buyers opted for Air in the early weeks of sales, a consumer survey found, with some users dissatisfied with the Air's camera, sound quality, battery and price.",WSJ,"Sat, 08 Nov 2025 07:00:00 -0500","['product', 'paywall']",AAPL
https://www.fool.com/investing/2025/11/07/prediction-2-stocks-thatll-be-worth-more-than-pala/,Prediction: 2 Stocks That'll Be Worth More Than Palantir 10 Years From Now,"Palantir has been an exceptional stock to own over the past few years, but it's extremely expensive and has a niche market. Amazon has several large and growing businesses and should keep capturing market share.",The Motley Fool,"Fri, 07 Nov 2025 19:00:00 -0500",[],AAPL
https://www.cnbc.com/2025/11/07/big-techs-ai-spending-spree-smart-long-term-bet-or-short-term-risk.html,Big Tech's AI spending spree: Smart long-term bet or short-term risk?,CNBC's Paulina Likos and Zev Fima break down big tech's massive artificial intelligence spending spree,CNBC,"Fri, 07 Nov 2025 13:20:24 -0500",[],AAPL
https://www.reuters.com/sustainability/boards-policy-regulation/big-tech-may-win-reprieve-eu-mulls-easing-ai-rules-document-shows-2025-11-07/,"Big Tech may win reprieve as EU mulls easing AI rules, document shows","Apple , Meta Platforms and other tech giants may win a reprieve from the EU's landmark artificial intelligence rules as regulators consider easing sections of the legislation as part of a drive to simplify a slew of regulations adopted in the last two years.",Reuters,"Fri, 07 Nov 2025 12:46:43 -0500",[],AAPL
https://invezz.com/news/2025/11/07/apples-1b-bet-on-gemini-why-siri-makeover-is-a-turning-point-in-big-tech-ai/?utm_source=snapi,Apple's $1B bet on Gemini: why Siri makeover is a turning point in big tech AI,"Apple is rebuilding Siri, and this time it is bringing in outside help. The company is finalising a deal to pay Google around $1 billion annually to use its Gemini AI model.",Invezz,"Fri, 07 Nov 2025 08:46:33 -0500",[],AAPL
https://247wallst.com/forecasts/2025/11/07/apple-inc-aapl-price-prediction-and-forecast-2025-2030/?utm_source=snapi,Apple (NASDAQ: AAPL) Stock Price Prediction and Forecast 2025-2030 (Nov 2025),Apple Inc. (NASDAQ: AAPL) has long attracted students and tech-minded users with its ergonomic approach to computing and communications.,24/7 Wall Street,"Fri, 07 Nov 2025 08:30:20 -0500",[],AAPL
https://www.fool.com/investing/2025/11/07/prediction-these-5-stocks-will-be-worth-more-than/,Prediction: These 5 Stocks Will Be Worth More Than $5 Trillion by 2030,Nvidia recently became the first $5 trillion company. Microsoft and Alphabet have easy roads to $5 trillion by 2030.,The Motley Fool,"Fri, 07 Nov 2025 06:00:00 -0500",[],AAPL
https://www.reuters.com/technology/apple-tv-down-about-15000-users-downdetector-shows-2025-11-07/,"Apple TV down for about 15,000 of users, Downdetector shows","Apple's streaming service Apple TV was down for nearly 14,907 users in the U.S. on Thursday, according to outage tracking website Downdetector.com.",Reuters,"Thu, 06 Nov 2025 22:56:14 -0500",[],AAPL
https://seekingalpha.com/article/4839509-apple-iphone-17-cycle-setting-up-a-classic-holiday-beat,Apple: iPhone 17 Cycle Setting Up A Classic Holiday Beat,"Apple Inc. guided to its best iPhone quarter ever: double-digit iPhone growth and 47–48% gross margins. iPhone 17 is tracking 14% above iPhone 16 in the first 10 days, skewed to Pro, with China sales improving and management expecting a Q1 return to growth. I model AAPL's FQ1 iPhone revenue at $76.05–$77.44B, yielding $36.13–$37.94B in gross profit, assuming 47.5–49% GM; each extra 1M Pro/Pro Max units adds about $1.1B to revenue.",Seeking Alpha,"Thu, 06 Nov 2025 15:20:03 -0500","['product', 'paylimitwall']",AAPL
https://www.youtube.com/watch?v=yOJ8825O75Y,"Final Trades: Apple, Palo Alto Networks, Western Union and the RSPH",The Investment Committee give you thieir top stocks to watch for the second half.,CNBC Television,"Thu, 06 Nov 2025 13:19:21 -0500",[],AAPL
https://www.youtube.com/watch?v=gFQMXu5moTA,"QCOM Pivot from AAPL ""Crucial"" Moment, Data Centers Offer A.I. Bull Case","Qualcomm (QCOM) faced pressure post-earnings. Some of that downside action is attributed to the company's pivot from Apple (AAPL), argues Jim Kelleher.",Schwab Network,"Thu, 06 Nov 2025 13:00:49 -0500",[],AAPL
https://www.cnet.com/tech/services-and-software/apple-to-pay-google-1-billion-per-year-for-siris-custom-gemini-ai-model-report-says/,"Apple to Pay Google $1 Billion Per Year for Siri's Custom Gemini AI Model, Report Says",Apple reportedly chose Google over Anthropic because of cost.,CNET,"Thu, 06 Nov 2025 12:46:07 -0500",[],AAPL
https://www.forbes.com/sites/dividendchannel/2025/11/06/ex-dividend-reminder-apple-international-business-machines-and-ww-grainger/,"Ex-Dividend Reminder: Apple, International Business Machines And W.W. Grainger","On 11/10/25, Apple, International Business Machines, and W.W. Grainger will all trade ex-dividend for their respective upcoming dividends.",Forbes,"Thu, 06 Nov 2025 12:45:12 -0500","['dividend', 'paylimitwall']",AAPL
https://www.youtube.com/watch?v=vPltJd_hToI,Cramer's Stop Trading: Apple,Jim Cramer breaks down why he's keeping an eye on shares of Apple.,CNBC Television,"Thu, 06 Nov 2025 10:20:53 -0500",['cramer'],AAPL
https://www.barrons.com/articles/apple-stock-price-ai-google-8e3acadf,"Apple Will Turn to Google for AI, Report Says. That's a Sign of Weakness.",Apple's reported plan to pay for access to Google's AI underlines a shift in power between the two companies.,Barrons,"Thu, 06 Nov 2025 09:37:00 -0500",['paywall'],AAPL
https://www.benzinga.com/markets/equities/25/11/48683559/apples-q4-earnings-beat-1-billion-google-ai-deal-fuel-surge-in-growth-rankings?utm_source=snapi,"Apple's Q4 Earnings Beat, $1 Billion Google AI Deal Fuel Surge In Growth Rankings","Apple Inc. (NASDAQ:AAPL) is navigating a pivotal moment in its growth story, as its latest growth percentile ranking shows both dramatic improvement and underlying volatility.",Benzinga,"Thu, 06 Nov 2025 07:51:21 -0500","['earnings', 'paywall']",AAPL
https://www.pymnts.com/apple/2025/apple-seeks-googles-help-in-long-awaited-siri-ai-update/?utm_source=snapi,Apple Seeks Google's Help in Long-Awaited Siri AI Update,"Apple is reportedly nearing a $1-billion-per-year deal with Google to power its long-awaited Siri upgrade. That deal would give Apple access to a powerful 1.2 trillion parameter artificial intelligence (AI) model from Google, Bloomberg News reported Wednesday (Nov. 5), citing sources with knowledge of the matter.",PYMNTS,"Thu, 06 Nov 2025 06:54:44 -0500",[],AAPL
https://www.benzinga.com/markets/equities/25/11/48679929/stock-market-today-dow-jones-nasdaq-futures-slide-as-supreme-court-questions-trumps-tariffs-coherent-marvell-tech-applovin-apple-in-focus?utm_source=snapi,"Stock Market Today: Dow Jones, Nasdaq Futures Slide As Supreme Court Questions Trump's Tariffs—Coherent, Marvell Tech, Applovin, Apple In Focus",U.S. stock futures fell on Thursday after Wednesday's positive close. Futures of major benchmark indices were lower.,Benzinga,"Thu, 06 Nov 2025 05:24:24 -0500","['paywall', 'futures', 'marketclose']",AAPL
https://seekingalpha.com/article/4838965-top-50-high-quality-dividend-growth-stocks-for-november-2025,Top 50 High-Quality Dividend Growth Stocks For November 2025,"I track a universe of 50 high-quality dividend growth stocks to identify attractive investment opportunities based on valuation and future return potential. Recent performance diverged from the S&P 500, with the universe returning +9.71% YTD versus SPY's +17.02% and SCHD's -1.20%. Currently, 26 stocks offer estimated future returns of at least 10%, with 19 appearing undervalued using my Free Cash Flow model.",Seeking Alpha,"Thu, 06 Nov 2025 04:10:04 -0500","['dividend', 'paylimitwall']",AAPL
https://invezz.com/news/2025/11/06/apple-bets-on-googles-gemini-in-1b-deal-to-rebuild-siri-and-close-its-ai-gap-report/?utm_source=snapi,"Apple bets on Google's Gemini in $1B deal to rebuild Siri, close its AI gap: report","Apple Inc. is close to finalising a deal with Alphabet Inc.'s Google to use its powerful 1.2 trillion parameter Gemini AI model to overhaul Siri, Bloomberg reported, citing people familiar with the matter.",Invezz,"Thu, 06 Nov 2025 03:11:31 -0500",[],AAPL
https://www.zacks.com/commentary/2786375/2025-bull-market-persists-but-cracks-appear?cid=CS-STOCKNEWSAPI-FT-investment_ideas-2786375,"2025 Bull Market Persists, but Cracks Appear","While the 2025 bull market continues to push higher, subtle cracks in market breadth are appearing beneath the surface. Namely, the ""Hindenburg Omen"" suggests that caution may be warranted.",Zacks Investment Research,"Thu, 06 Nov 2025 01:16:05 -0500",[],AAPL
https://www.youtube.com/watch?v=0OdBa7rVN9g,"Fast Money: DAL, ROKU, AAPL, GPCR",The final trades of the day with CNBC's Melissa Lee and the 'Fast Money' traders.,CNBC Television,"Wed, 05 Nov 2025 18:21:14 -0500",[],AAPL
https://techcrunch.com/2025/11/05/apple-nears-deal-to-pay-google-1b-annually-to-power-new-siri-report-says/,"Apple nears deal to pay Google $1B annually to power new Siri, report says","Apple is nearing a deal with Google that would see the iPhone maker pay the tech giant roughly $1 billion a year for a custom version of Google's Gemini AI model to power its overhaul of Siri, according to a new report from Bloomberg.",TechCrunch,"Wed, 05 Nov 2025 15:37:47 -0500",[],AAPL
https://www.youtube.com/watch?v=ce2khKN711E,Apple Readies Cheaper Mac to Rival Chromebooks,Apple is developing a budget Mac aimed at luring away customers from Chromebooks and entry-level Windows PCs. Bloomberg's Sam Kelly discusses Apple's entry into the low-cost laptop market with Ed Ludlow on “Bloomberg Tech.,Bloomberg Technology,"Wed, 05 Nov 2025 15:31:59 -0500",['product'],AAPL
https://www.reuters.com/business/apple-use-googles-ai-model-run-new-siri-bloomberg-news-reports-2025-11-05/,"Apple to use Google's AI model to run new Siri, Bloomberg News reports","Apple plans to use a 1.2 trillion parameter artificial intelligence model developed by Google to help power an overhaul of the Siri voice assistant, Bloomberg News reported on Wednesday.",Reuters,"Wed, 05 Nov 2025 14:21:36 -0500",[],AAPL
https://seekingalpha.com/article/4838312-apple-q4-strong-results-explosive-upside,"Apple Q4: Strong Results, Explosive Upside","Apple Inc. delivered strong Q4 '25 results, with EPS beating estimates and record annual revenue of $416 billion, supporting my Strong Buy rating. Services segment grew 15%, driving high-margin, recurring revenue and offsetting hardware cyclicality, while gross and operating margins remain industry-leading. Key watchpoints for Q1 '26 include a rebound in China, resolving iPhone 17 supply constraints, and sustaining gross margin expansion despite tariff headwinds.",Seeking Alpha,"Wed, 05 Nov 2025 11:42:45 -0500","['earnings', 'paylimitwall']",AAPL
https://www.marketbeat.com/originals/why-apples-next-quarter-could-be-a-prove-it-iphone-17-moment/?utm_source=snapi,"Why Apple's Next Quarter Could Be a ""Prove It"" iPhone 17 Moment","Over recent years, tech giant Apple NASDAQ: AAPL has lost its distinction as the most-watched stock in the market. The company's sluggish product sales growth has led to it becoming a less discussed name among the Magnificent Seven.",MarketBeat,"Wed, 05 Nov 2025 09:32:04 -0500",['product'],AAPL
https://www.businesswire.com/news/home/20251105829681/en/Addigy-Apple-MDM-Adds-Prestigious-G2-and-SourceForge-Awards-to-Growing-List-of-Accolades/,Addigy Apple MDM Adds Prestigious G2 and SourceForge Awards to Growing List of Accolades,"MIAMI--(BUSINESS WIRE)-- #Addigy--Addigy Apple MDM is the preferred Apple device management platform, as ranked by MSPs and IT teams in G2, SourceForge and Channel Program awards.",Business Wire,"Wed, 05 Nov 2025 09:02:00 -0500",['PressRelease'],AAPL
https://seekingalpha.com/article/4838180-american-century-focused-dynamic-growth-fund-q3-2025-performance-contributors-and-detractors,American Century Focused Dynamic Growth Fund Q3 2025 Performance Contributors And Detractors,"Google's parent company received a relatively benign antitrust ruling that would not force Alphabet to sell its Chrome browser or Android operating system. Alnylam's shares benefited from a positive phase 3 trial by Regeneron Pharmaceuticals that uses Alnylam's technology. We initiated a position in AppLovin, the only scaled, global advertisement network for gaming properties.",Seeking Alpha,"Wed, 05 Nov 2025 08:10:00 -0500",['paylimitwall'],AAPL
https://www.zacks.com/stock/news/2785373/with-strong-holiday-outlook-for-iphones-can-apple-etfs-gain-ahead?cid=CS-STOCKNEWSAPI-FT-etf_news_and_commentary-2785373,"With Strong Holiday Outlook for iPhones, Can Apple ETFs Gain Ahead?","Apple's strong iPhone 17 demand and upbeat holiday outlook could favor Apple-heavy ETFs like FTEC, IYW and VGT. But slowing China sales and rich valuations are a drag.",Zacks Investment Research,"Wed, 05 Nov 2025 08:01:12 -0500",['product'],AAPL
