published_at,ticker,title,desc,url,source,sentiment,sentiment_score
2025-10-19 23:42:57+00:00,TSLA,Stock market today: Dow futures rally as Trump softens tone on trade war,"On Tuesday, Netflix and Texas Instruments are due. On Wednesday, Tesla and IBM will report, while Intel is scheduled for Thursday.",https://fortune.com/2025/10/19/stock-market-today-dow-futures-trump-trade-war-tech-earnings-inflation-cpi-report/,fortune.com,,
2025-10-19 23:34:00+00:00,TSLA,Tesla Q3 EPS Preview: Momentum Meets Uncertainty,"As Tesla prepares to report Q3 earnings, investors face a familiar mix of excitement and uncertainty. With the stock surging nearly 93% in the past sic months, expectations are high - yet tempered by Tesla's recent mixed track record.",https://www.zacks.com/commentary/2771943/tesla-q3-eps-preview-momentum-meets-uncertainty?cid=CS-ZC-FT-investment_ideas-2771943,zacks.com,,
2025-10-19 22:23:00+00:00,TSLA,Here's What Tesla's Latest Big Move Means for Investors,"Tesla's new models aren't game changers by themselves, but they will build on the company's sales momentum.",https://finance.yahoo.com/news/heres-teslas-latest-big-move-222300853.html,finance.yahoo.com,,
2025-09-19 20:49:29+00:00,TSLA,"ETF Tracker Newsletter For September 19, 2025","ETF Tracker StatSheet           You can view the latest version here. GOLD, SILVER RIP HIGHER WHILE SHORT SQUEEZE RALLY ROLLS ON  [Chart courtesy of MarketWatch.com] Stocks kept climbing, building on a record-setting week after the Fed finally delivered its much-anticipated rate cut. As expected, the decision to lower the benchmark rate by a quarter point gave equities another leg up—even ... Read More",https://theetfbully.com/2025/09/etf-tracker-newsletter-for-september-19-2025/,theetfbully.com,,
2025-09-19 20:07:36+00:00,TSLA,Wall Street Extends Rally to Record Highs as Fed Optimism Fuels Tech and Growth Stocks,"The U.S. stock market concluded a robust week, with major indexes hitting fresh record highs on Friday, September 19, 2025, extending gains fueled by optimism",https://stockmarketwatch.com/stock-market-news/wall-street-extends-rally-to-record-highs-as-fed-optimism-fuels-tech-and-growth-stocks/53353/,thestockmarketwatch.com,,
2025-09-19 17:34:15+00:00,TSLA,Stocks Edge Higher on Hopes of More Fed Rate Cuts,"The S&P 500 Index ($SPX ) (SPY ) today is up +0.11%, the Dow Jones Industrials Index ($DOWI ) (DIA ) is up +0.08%, and the Nasdaq 100 Index ($IUXX ) (QQQ ) is up +0.23%.  December E-mini S&P futures (ESZ25 ) are up +0.09%, and December E-mini Nasdaq futures...",https://www.nasdaq.com/articles/stocks-edge-higher-hopes-more-fed-rate-cuts,nasdaq.com,,
2025-08-20 23:13:28+00:00,TSLA,Tech Weakness and Negative Corporate News Weigh on Stocks,"The S&P 500 Index ($SPX ) (SPY ) today is down by -0.30%, the Dow Jones Industrials Index ($DOWI ) (DIA ) is down by -0.12%, and the Nasdaq 100 Index ($IUXX ) (QQQ ) is down by -0.67%.  September E-mini S&P futures (ESU25 ) are down -0.35%, and September...",https://www.nasdaq.com/articles/tech-weakness-and-negative-corporate-news-weigh-stocks,nasdaq.com,,
2025-08-20 21:08:04+00:00,TSLA,Tech Sell-Off Weighs on Wall Street as Retailers Deliver Mixed Results,"The U.S. stock market experienced a mixed session on Wednesday, August 20, 2025, with a notable downturn in technology stocks offsetting modest gains in the",https://stockmarketwatch.com/stock-market-news/tech-sell-off-weighs-on-wall-street-as-retailers-deliver-mixed-results/52113/,thestockmarketwatch.com,,
2025-08-20 19:00:00+00:00,TSLA,Tesla Breakout Above Pennant Formation Sets Stage for Next Bullish Leg,Market Analysis by  covering: Tesla Inc. Read 's Market Analysis on Investing.com,https://www.investing.com/analysis/tesla-breakout-above-pennant-formation-sets-stage-for-next-bullish-leg-200665624,investing.com,,
2025-07-21 23:35:11+00:00,TSLA,"Stock market today: Dow, S&P 500, Nasdaq futures wobble amid wave of earnings as tariffs bite GM profit","US stock futures traded flat as investors prepared for earnings season to pick up steam, with Big Tech earnings ahead.",https://finance.yahoo.com/news/live/stock-market-today-dow-sp-500-nasdaq-futures-wobble-amid-wave-of-earnings-as-tariffs-bite-gm-profit-233511151.html,finance.yahoo.com,,
2025-07-21 22:35:12+00:00,TSLA,Fed Should Act As Economy Slows—Will Politics Delay It?,"The Fed continues to be very concerned (overly so, in our view) about the impact of Trump’s tariffs on inflation...",https://www.forbes.com/sites/greatspeculations/2025/07/21/fed-should-act-as-economy-slows-will-politics-delay-it/,forbes.com,,
2025-07-21 21:50:13+00:00,TSLA,Mixed Performance for Chinese Stocks as Nasdaq Hits New Highs,"On Monday, most popular Chinese stocks experienced declines. The Nasdaq Golden Dragon China Index (HXC) fell by 0.28%. Among the gainers, Alibaba increased by 0",https://www.gurufocus.com/news/2991717/mixed-performance-for-chinese-stocks-as-nasdaq-hits-new-highs,gurufocus.com,,
2025-06-21 20:05:00+00:00,TSLA,Better EV Stock: Ford vs. Tesla,"One company stands best placed to deliver affordable electric vehicles.  -The comparison between Ford (NYSE: F) and Tesla (NASDAQ: TSLA) is valuable and valid because it speaks to where the auto industry is headed and highlights the relative position of each company as it moves toward electric vehicles and robotaxis.  Whether it's a legacy automaker (Ford) or a dedicated battery electric vehicle company(Tesla), the key opportunities and challenges are the same.",https://finance.yahoo.com/news/better-ev-stock-ford-vs-200500011.html,finance.yahoo.com,,
2025-06-21 14:38:25+00:00,TSLA,Tesla’s Robotaxi Bet Could Unlock $1 Trillion Opportunity,"Tesla, Inc. (TSLA) will launch its robotaxi service in Austin on June 22, using about 20 Model Y vehicles, a move Wedbush Securities calls a key milestone that could add $1 trillion to Tesla’s valuation. Wedbush maintains an 'Outperform' rating with a $500 price target, projecting Tesla’s robotaxi expansion to…",https://wallstreetpit.com/127654-teslas-robotaxi-bet-could-unlock-1-trillion-opportunity/,wallstreetpit.com,,
2025-06-21 13:00:12+00:00,TSLA,Musk's robotaxi revolution begins this weekend with invite-only CyberCab rides,Waymo and Amazon-owned Zoox are already operating in multiple cities across the United States.,https://www.foxbusiness.com/technology/musks-robotaxi-revolution-begins-weekend-invite-only-cybercab-rides,foxbusiness.com,,
2025-05-22 21:50:16+00:00,TSLA,Tech Stocks Rise as US Markets React to Tax Reform Concerns,"The U.S. House passed Trump's tax reform bill, escalating market concerns about the national deficit. Following a significant sell-off previously, U.S. stocks c",https://www.gurufocus.com/news/2884663/tech-stocks-rise-as-us-markets-react-to-tax-reform-concerns,gurufocus.com,,
2025-05-22 20:09:25+00:00,TSLA,Stocks close mixed with the Dow and S&P little changed. Nasdaq higher.,,https://www.forexlive.com/news/stocks-close-mixed-with-the-dow-and-sp-little-changed-nasdaq-higher-20250522/,forexlive.com,,
2025-05-22 18:29:31+00:00,TSLA,"Market Rebounds After Steep Sell-Off: Stock Market Recap for Thursday, May 22, 2025","The U.S. stock market showed signs of stabilization on Thursday, May 22, 2025, as investors cautiously returned after Wednesday's significant sell-off. The",https://thestockmarketwatch.com/stock-market-news/market-rebounds-after-steep-sell-off-stock-market-recap-for-thursday-may-22-2025/49499/,thestockmarketwatch.com,,
2025-04-22 23:46:29+00:00,TSLA,"Stock market today: Dow, S&P 500, Nasdaq futures jump as Trump says he has 'no intention' of firing Powell","US stock futures jumped after President Trump said he has 'no intention' of firing Federal Reserve Chair Jerome Powell, easing fears on Wall Street that the central bank's independence was under threat.",https://finance.yahoo.com/news/live/stock-market-today-dow-sp-500-nasdaq-futures-jump-as-trump-says-he-has-no-intention-of-firing-powell-234629325.html,finance.yahoo.com,,
2025-04-22 23:21:17+00:00,TSLA,Tesla: A Disastrous Q1 2025 That Brings My Fair Value Way Down (NASDAQ:TSLA),"Tesla, Inc.'s Q1 2025 results disappointed with revenue declines, profitability woes, and reliance on credits. Click for my updated look at TSLA post earnings.",https://seekingalpha.com/article/4776993-tesla-a-disastrous-q1-2025-that-brings-my-fair-value-way-down,seekingalpha.com,,
2025-04-22 23:19:07+00:00,TSLA,"ASX Market Open: Aussie market to rise on Wall Street optimism on US-China trade war | April 23, 2025","The ASX200 is set to open 2% higher today, after Wall Street rallied on greater confidence that the US-China tariff war could be resolved.",https://themarketonline.com.au/asx-market-open-aussie-market-to-rise-on-wall-street-optimism-on-us-china-trade-war-2025-04-23/,themarketherald.com.au,,
2025-03-23 23:57:54+00:00,TSLA,"VALUE: After Hours (S07 E11): Christopher Bloomstran on Warren Buffett, $BRK Berkshire, $SPY Valuation and Debt",,https://acquirersmultiple.com/2025/03/value-after-hours-s07-e11-christopher-bloomstran-on-warren-buffett-brk-berkshire-spy-valuation-and-debt/,acquirersmultiple.com,,
2025-03-23 23:00:00+00:00,TSLA,BYD Earnings May Move the Needle in Market-Cap Fight With CATL,"(Bloomberg) -- BYD Co.’s earnings later Monday could be the factor cementing the electric-vehicle leader’s place as China’s most valuable non-state onshore stock. Most Read from BloombergThey Built a Secret Apartment in a Mall. Now the Mall Is Dying.Chicago Transit Faces ‘Doomsday Scenario,’ Regional Agency SaysLA Faces $1 Billion Budget Hole, Warns of Thousands of LayoffsNew York Subway Ditches MetroCard After 32 Years for Tap-And-GoDespite Cost-Cutting Moves, Trump Plans to Remake DC in His St",https://finance.yahoo.com/news/byd-earnings-may-move-needle-230000068.html,finance.yahoo.com,,
2025-03-23 22:20:00+00:00,TSLA,If I Could Buy Only 1,"Nvidia has been the top-performing stock among the ""Magnificent Seven"" over the last few years, but I see another megacap AI stock as the better long-term buy.",https://finance.yahoo.com/news/could-buy-only-1-magnificent-222000983.html,finance.yahoo.com,,
2025-02-21 23:50:23+00:00,TSLA,Tech Stocks Decline as Chinese Equities Shine; NVDA Loses $139 Billion in Value,"U.S. stock markets experienced a significant downturn, with major indices closing lower. The Dow Jones Industrial Average fell by 748.63 points, marking a subst",https://www.gurufocus.com/news/2709510/tech-stocks-decline-as-chinese-equities-shine-nvda-loses-139-billion-in-value,gurufocus.com,,
2025-02-21 22:47:13+00:00,TSLA,"Dow Jones Futures: Nvidia Looms After Palantir, Axon, Tesla Lead Stock Market Sell-Off. Here's What To Do.","Dow Jones futures: The stock market tumbled for the week, led by highly valued growth plays such as Palantir and Tesla. Nvidia earnings loom.",https://www.investors.com/market-trend/stock-market-today/dow-jones-futures-nvidia-palantir-axon-tesla-sell-off/,investors.com,,
2025-02-21 22:47:00+00:00,TSLA,Buy This Artificial Intelligence (AI) Stock Hand Over Fist. Dan Ives Expects It to Soar 52%.,Analyst Dan Ives thinks Tesla stock could soar from current levels thanks to a potential $1 trillion catalyst.,https://finance.yahoo.com/news/buy-artificial-intelligence-ai-stock-224700290.html,finance.yahoo.com,,
2025-01-22 21:44:04+00:00,TSLA,U.S. Stocks Close Higher Again; Nasdaq Rises 1.3 P.c.,"U.S. stocks closed on a firm note on Wednesday as investors reacted positively to some upbeat earnings updates and corporate news, and on continued optimism about a few interest rate cuts by the Federal Reserve this year.",https://www.rttnews.com/3505157/u-s-stocks-close-higher-again-nasdaq-rises-1-3-p-c.aspx?type=ts,rttnews.com,,
2025-01-22 21:42:11+00:00,TSLA,Musk and Altman spar over 'Stargate' AI venture hyped by Trump,Elon Musk questioned if companies that joined Donald Trump’s 'Stargate' initiative could follow through on their promises. Read more here,https://financialpost.com/technology/tech-news/musk-altman-spar-over-stargate-ai,financialpost.com,,
2025-01-22 21:15:02+00:00,TSLA,5 charts that explain Trump's presidency so far,"Stocks are approaching records in the first couple of days of Trump's presidency, with more pronounced moves in specific corners of the market this week.",https://markets.businessinsider.com/news/stocks/donald-trump-stock-market-ai-ev-stocks-bitcoin-peso-dollar-2025-1,businessinsider.com,,
2024-12-23 22:32:04+00:00,TSLA,Dow Jones Futures: Bitcoin Continues To Slide; Nvidia Chipmaker Breaks Out,"Dow Jones Futures: Bitcoin continued to slide Monday, while Nvidia chipmaker TSMC is breaking out today past a new buy point.",https://www.investors.com/market-trend/stock-market-today/dow-jones-futures-bitcoin-nvidia-tsmc-stock/,investors.com,,
2024-12-23 22:18:11+00:00,TSLA,"US stock market today: S&P 500, Dow Jones, Nasdaq climb, Magnificent Seven tech stocks soar; Check top gaining shares","US stock market is entering 'Santa Claus Rally' as Wall Street's indexes S&P 500, Dow Jones Industrial Average, and Nasdaq Composite will look to consolidate.",https://economictimes.indiatimes.com/news/international/us/us-stock-market-today-sp-500-dow-jones-nasdaq-climb-magnificent-seven-tech-stocks-soar-check-top-gaining-shares/articleshow/116610867.cms,economictimes.indiatimes.com,,
2024-12-23 22:10:15+00:00,TSLA,Tech Giants Propel U.S. Stock Market Rebound Amid Weak Consumer Confidence,Major technology stocks led a rebound in U.S. markets following weaker-than-expected consumer confidence data. The shortened trading week saw the S&P 500 closin,https://www.gurufocus.com/news/2639961/tech-giants-propel-us-stock-market-rebound-amid-weak-consumer-confidence,gurufocus.com,,
2024-11-23 18:31:37+00:00,TSLA,Tesla: A Decade of Innovation and Expansion,"In the annals of automotive history, few stories are as compelling or as meteoric as that of Tesla Inc. Over the last decade, Tesla has not merely grown; it has redefined what growth means for an…",https://medium.com/@JPStanleyX/tesla-a-decade-of-innovation-and-expansion-e664983739ab,medium.com,,
2024-11-23 18:00:21+00:00,TSLA,"Musk Tweet Sparks Dogecoin Surge, Fuels Speculation On X Payments",Dogecoin (CRYPTO: DOGE) experienced a 5% surge following a tweet by Elon Musk on X. This has sparked fresh speculations about the imminent payments service on Musk’s social app.,https://www.benzinga.com/markets/cryptocurrency/24/11/42152684/musk-tweet-sparks-dogecoin-surge-fuels-speculation-on-x-payments,benzinga.com,,
2024-11-23 16:06:23+00:00,TSLA,Musk Ducks Sanction For Choosing Rocket Launch Over SEC Meeting,"A judge declined to sanction Elon Musk for skipping a meeting with the US Securities and Exchange Commission to watch one of his rockets launch. 
US District Judge Jacqueline Scott Corley said Friday there is no need to sanction Musk because he already agreed to reimburse the SEC $2,923 to cover airfare for the trio of agency lawyers he stood up in Los Angeles in September. Musk finally met with the SEC lawyers to give testimony on Oct. 3, Corley noted.",https://www.ndtvprofit.com/world/musk-ducks-sanction-for-choosing-rocket-launch-over-sec-meeting,bloombergquint.com,,
2024-10-24 23:46:28+00:00,TSLA,"Nasdaq, S&P both end higher",The Nasdaq and the S&P 500 gained overnight – driven by Tesla's positive earnings forecast and a decline in treasury yields from a three-month high.,https://www.businessnews.com.au/article/Nasdaq-SP-both-end-higher,businessnews.com.au,,
2024-10-24 23:30:00+00:00,TSLA,The US Market Has Shot Up to New Highs This Year: Can This Momentum be Sustained?,"With the US market surging to new all-time highs, could there still be a case for investing there?",https://thesmartinvestor.com.sg/the-us-market-has-shot-up-to-new-highs-this-year-can-this-momentum-be-sustained/,thesmartinvestor.com.sg,,
2024-10-24 22:49:01+00:00,TSLA,Stock market today: Capital One soars on positive earnings while CPRI plummets in after-hours trading,Asian markets largely sagged but Tesla and Europe provided bright spots with earnings reports that beat expectations.,https://fortune.com/2024/10/24/stock-market-today-dow-sp500-nasdaq-capital-one-ibm-tesla-elon-musk/,fortune.com,,
2024-09-24 22:34:02+00:00,TSLA,"Dow Jones Futures: Nvidia, Tesla Rival Jump Into Buy Areas With Stock Market At Bullish Levels","Dow Jones futures: The stock market is acting well with the S&P 500 at highs and the Nasdaq above 18,000. Nvidia and Tesla rival BYD jumped.",https://www.investors.com/market-trend/stock-market-today/dow-jones-futures-nvidia-tesla-rival-jump-buy-areas-bullishlevels/,investors.com,,
2024-09-24 21:45:19+00:00,TSLA,Tesla (TSLA) Laps the Stock Market: Here's Why,"In the most recent trading session, Tesla (TSLA) closed at $254.27, indicating a +1.71% shift from the previous trading day.",https://www.zacks.com/stock/news/2340842/tesla-tsla-laps-the-stock-market-heres-why?cid=CS-ZC-FT-tale_of_the_tape|yseop_template_6-2340842,zacks.com,,
2024-09-24 20:39:24+00:00,TSLA,U.S. Stocks Close Higher Again; S&P Posts Fresh Record Closing High,"U.S. stocks closed higher on Tuesday after a somewhat choppy ride, and the S&P 500 hit a fresh record high, as investors made largely cautious moves while awaiting more data for directional cues.",https://www.rttnews.com/story.aspx?Id=3477128,rttnews.com,,
2024-08-25 14:43:05+00:00,TSLA,Nvidia earnings highlight a busy end of August: What to know this week,A highly anticipated earnings release from Nvidia is expected to have implications for investor sentiment across the broader market in the week ahead.,https://finance.yahoo.com/news/nvidia-earnings-highlight-a-busy-end-of-august-what-to-know-this-week-144305612.html,finance.yahoo.com,,
2024-08-25 09:28:47+00:00,TSLA,Top 5 things to watch in markets in the week ahead By Investing.com,Top 5 things to watch in markets in the week ahead,https://www.investing.com/news/economy/top-5-things-to-watch-in-markets-in-the-week-ahead-3586128,investing.com,,
2024-08-25 08:08:54+00:00,TSLA,Telegram CEO Arrest In France Sends Toncoin (TON) Plummeting By Over 20%: Elon Musk Calls For Freeing Pavel Durov,The cryptocurrency Toncoin (CRYPTO: TON) experienced a significant drop following the arrest of Telegram CEO Pavel Durov in Fr,https://www.benzinga.com/markets/cryptocurrency/24/08/40542711/telegram-ceo-arrest-in-france-sends-toncoin-ton-plummeting-by-over-20-elon-musk-calls-for-,benzinga.com,,
2024-07-26 23:05:00+00:00,TSLA,S&P 500 ends wild week nearly 1% lower as tech keeps bleeding (NYSEARCA:SPY),"The S&P 500 (SP500) on Friday retreated 0.84% for the week to end at 5,459.10 points, posting losses in three out of five sessions. Read more here.",https://seekingalpha.com/news/4129211-sp-500-ends-wild-week-nearly-1-lower-as-tech-keeps-bleeding-eyes-turn-to-fed,seekingalpha.com,,
2024-07-26 22:32:19+00:00,TSLA,"Market Today: Nvidia Faces Technical Challenges, 3M's Remarkable Surge, and EVgo's Strategic Moves","Stocks had a solid performance today. Despite some choppiness, major indices maintained gains throughout the session. The S&P 500 (+1.1%), Nasdaq Composite (+1.",https://www.gurufocus.com/news/2483604/market-today-nvidia-faces-technical-challenges-3ms-remarkable-surge-and-evgos-strategic-moves,gurufocus.com,,
2024-07-26 21:54:02+00:00,TSLA,"Dow Jones Futures: Apple Leads Huge AI Earnings, Fed Rate Pivot Looms; What To Do","Dow Jones futures: Apple, Microsoft, Amazon and Meta report earnings, with AI in focus. The Fed is expected to signal rate cuts soon.",https://www.investors.com/market-trend/stock-market-today/dow-jones-futures-apple-microsoft-ai-earnings-fed-rate-pivot/,investors.com,,
2024-06-26 22:52:00+00:00,TSLA,5 Reasons to Own Tesla into Year-End,"If Elon Musk and Tesla can execute on their new plan, investors should expect shares to rise much higher in 6-12 months. Stock Strategist Andrew Rocco breaks it all down.",https://www.zacks.com/commentary/2294020/5-reasons-to-own-tesla-into-year-end?cid=CS-ZC-FT-investment_ideas-2294020,zacks.com,,
2024-06-26 22:38:29+00:00,TSLA,"Wall Street ends slightly up, trade choppy ahead of inflation data","(June 27): Major U.S. stock indexes closed with modest gains on Wednesday after a choppy trading session, with investors holding their cards close to the vest ahead of a presidential debate and an inflation report closely watched by Federal Reserve policy makers.",https://theedgemalaysia.com/node/716971,theedgemarkets.com,,
2024-06-26 22:32:22+00:00,TSLA,"Market Today: Micron's Guidance Overshadows Strong Q3, Levi Strauss Misses Revenue, Intel's AI","Market Summary
The S&P 500 (+0.2%) and the Nasdaq Composite (+0.5%) closed at or near their highs of the day after a surge of buying in the mega cap space in th",https://www.gurufocus.com/news/2464601/market-today-microns-guidance-overshadows-strong-q3-levi-strauss-misses-revenue-intels-ai,gurufocus.com,,
2024-05-27 23:56:15+00:00,TSLA,What is the Success Rate of Trend Following Trading Strategies,"If you’re asking ‘what is the success rate of trend-following trading strategies,’ you’re looking for clear-cut numbers and straightforward facts. Trend",https://www.quantifiedstrategies.com/what-is-the-success-rate-of-trend-following-trading-strategies/,quantifiedstrategies.com,,
2024-05-27 18:50:51+00:00,TSLA,Stellantis Offers Two More Models for Italy to Defuse Row,"Stellantis NV proposed building two more hybrid vehicles in Italy, part of its efforts to appease local politicians as the Fiat maker eyes moving some…",https://financialpost.com/pmn/business-pmn/stellantis-offers-two-more-models-for-italy-to-defuse-row,financialpost.com,,
2024-05-27 17:06:23+00:00,TSLA,"Argentine President Milei to meet Apple, Google, Meta CEOs in US By Reuters","Argentine President Milei to meet Apple, Google, Meta CEOs in US",https://www.investing.com/news/stock-market-news/argentine-president-milei-to-meet-apple-google-meta-ceos-in-us-3457904,investing.com,,
2024-04-27 20:16:13+00:00,TSLA,"Elon Musk Take Fight For Free Speech Abroad, Feuds With Australia And Brazil Over Content Restriction - Tesla (NASDAQ:TSLA)",Elon Musk's acquisition of X sparks global debate as clashes with Brazil and Australia over free speech restrictions intensify.,https://www.benzinga.com/markets/equities/24/04/38477389/elon-musk-take-fight-for-free-speech-abroad-feuds-with-australia-and-brazil-over-content-restric,benzinga.com,,
2024-04-27 13:32:46+00:00,TSLA,"Lynas Rare Earths Stock: The Storm Is Not Over, Yet","Discover Lynas Rare Earths' disappointing Q3 results, declining prices, inventory management, and progress on projects. Read the article for more details.",https://seekingalpha.com/article/4686995-lynas-rare-earths-the-storm-is-not-over-yet-lyscf-lysdy-stock,seekingalpha.com,,
2024-04-27 13:00:00+00:00,TSLA,"Magnificent Seven Earnings Scorecard: Who Did Well, Who Got Richer (And Poorer)",With four of the seven “magnificent seven” companies reporting earnings—and their stocks moving hundreds of billions of dollars in accordance—it was a massive week for investors.,https://www.forbes.com/sites/dereksaul/2024/04/27/magnificent-seven-earnings-scorecard-who-did-well-who-got-richer-and-poorer/,forbes.com,,
2024-03-28 23:02:21+00:00,TSLA,25 Countries with the Highest Average Salaries in the World,"In this article, we will look at the 25 countries with the highest average salaries in the world. We have also discussed the global unemployment rates. If you want to skip our detailed analysis, head straight to the 10 Countries with the Highest Average Salaries in the World. The International Labour Organization (ILO) has reported […]",https://finance.yahoo.com/news/25-countries-highest-average-salaries-230221647.html?.tsrc=rss,finance.yahoo.com,,
2024-03-28 22:40:29+00:00,TSLA,Market Today: Elevated Options Trading on DJT Amid Gamma Squeeze Speculation,"Market Summary
Today's trading session ended mixed, with minor gains and losses across major indices. The S&P 500 and Dow Jones Industrial Average each saw a sl",https://www.gurufocus.com/news/2399667/market-today-elevated-options-trading-on-djt-amid-gamma-squeeze-speculation,gurufocus.com,,
2024-03-28 21:10:27+00:00,TSLA,Dow Jones Futures: Stock Market Strong Before Inflation Data; Will Nvidia AI Chip Peer Forge Base?,Dow Jones futures: The stock market impressed heading into inflation data. Nvidia peer and AI chip IPO Astera Labs could be starting a base.,https://www.investors.com/market-trend/stock-market-today/dow-jones-futures-will-nvidia-ai-chip-ipo-forge-base/,investors.com,,
2024-02-27 23:11:22+00:00,TSLA,Siblings help China's BYD grab early lead in Thai EV market By Reuters,Siblings help China's BYD grab early lead in Thai EV market,https://www.investing.com/news/stock-market-news/siblings-help-chinas-byd-grab-early-lead-in-thai-ev-market-3317525,investing.com,,
2024-02-27 21:25:10+00:00,TSLA,Apple scrapping electric car project,"Apple is giving up on its decade-long effort to build an autonomous electric vehicle and will instead focus on artificial intelligence, according to a new report.",https://www.foxbusiness.com/markets/apple-scrapping-electric-car-project,foxbusiness.com,,
2024-02-27 21:05:56+00:00,TSLA,"Apple cancels work on electric car, source says By Reuters","Apple cancels work on electric car, source says",https://www.investing.com/news/economy/apple-cancels-work-on-electric-car-source-says-3317226,investing.com,,
2024-01-28 22:27:31+00:00,TSLA,Big Tech earnings 'crucial' to markets this week,Microsoft and Alphabet are among the tech giants best positioned to benefit from the AI boom.,https://fortune.com/2024/01/28/big-tech-earnings-stock-market-investing-microsoft-amazon-meta-alphabet-apple/,fortune.com,,
