published_at,ticker,title,desc,url,source,sentiment,sentiment_score
2025-10-18 22:00:00+00:00,GOOGL,Billionaire Steven Cohen Sold 100% of Point72's Stake in SoundHound AI and Is Piling Into This Supercharged Stock-Split Stock,"During the second quarter, Steven Cohen's hedge fund completely exited its position in SoundHound AI in favor of the biggest name in the market.",https://finance.yahoo.com/news/billionaire-steven-cohen-sold-100-220000102.html,finance.yahoo.com,,
2025-10-18 15:11:00+00:00,GOOGL,Ready To Retire? These 8%+ CEFs Show The Way,I’m regularly struck by something American investors always seem to take for granted: The many choices we have available to gain financial independence.,https://www.forbes.com/sites/michaelfoster/2025/10/18/ready-to-retire-these-8-cefs-show-the-way/,forbes.com,,
2025-10-18 12:50:53+00:00,GOOGL,"Gold surpasses 'magnificent seven stocks': Is Yellow metal now more precious than Apple, Microsoft, Alphabet, Amazon, Meta Platforms, Nvidia, Tesla?","""Magnificent Seven"" stocks are Apple (AAPL), Microsoft (MSFT), Alphabet (GOOGL), Amazon (AMZN), Meta Platforms (META), Nvidia (NVDA), and Tesla (TSLA).",https://economictimes.indiatimes.com/news/international/us/gold-surpasses-magnificent-seven-stocks-is-yellow-metal-now-more-precious-than-apple-microsoft-alphabet-amazon-meta-platforms-nvidia-tesla/articleshow/124667130.cms,economictimes.indiatimes.com,,
2025-09-18 21:45:05+00:00,GOOGL,Why Alphabet (GOOGL) Outpaced the Stock Market Today,"Alphabet (GOOGL) reached $252.06 at the closing of the latest trading day, reflecting a +1.01% change compared to its last close.",https://www.zacks.com/stock/news/2753692/why-alphabet-googl-outpaced-the-stock-market-today?cid=CS-ZC-FT-tale_of_the_tape|yseop_template_6-2753692,zacks.com,,
2025-09-18 19:27:15+00:00,GOOGL,"Billionaire David Tepper Hates This Market, But Don't Fight The Fed - NVIDIA (NASDAQ:NVDA)","Appaloosa's David Tepper sees valuations as way too high, but he will not fight the Fed.",https://www.benzinga.com/markets/hedge-funds/25/09/47749830/billionaire-david-tepper-wont-fight-the-fed-but-he-hates-this-market,benzinga.com,,
2025-09-18 18:07:50+00:00,GOOGL,Navigating the Currents: Markets Rally on Tech Surge and Fed’s Measured Approach,"U.S. equities are experiencing a robust rally this Thursday afternoon, September 18, 2025, with major indexes hitting new record highs, largely propelled by a",https://stockmarketwatch.com/stock-market-news/navigating-the-currents-markets-rally-on-tech-surge-and-feds-measured-approach/53296/,thestockmarketwatch.com,,
2025-08-19 23:19:41+00:00,GOOGL,Alphabet (GOOGL) Boosts Capex With $9B AI and Cloud Expansion,Alphabet Inc.,https://www.insidermonkey.com/blog/alphabet-googl-boosts-capex-with-9b-ai-and-cloud-expansion-1593959/,insidermonkey.com,,
2025-08-19 21:36:14+00:00,GOOGL,"Why We Believe The US Mulling A 10% Stake In Intel Is Negative - Intel (NASDAQ:INTC), SoftBank Group (OTC:SFTBY)",,https://www.benzinga.com/general/market-summary/25/08/47223009/why-we-believe-the-us-mulling-a-10-stake-in-intel-is-negative,benzinga.com,,
2025-08-19 18:42:22+00:00,GOOGL,PatentVest Releases First-Ever Quantum Computing Rankings,"Designed for investors, board members, and CEOs, the latest PatentVest Pulse Report reveals which companies are emerging as true leaders as quantum computing shifts from R&D to commercialization",https://www.manilatimes.net/2025/08/20/tmt-newswire/globenewswire/patentvest-releases-first-ever-quantum-computing-rankings/2170568,manilatimes.net,,
2025-07-20 23:57:53+00:00,GOOGL,"Stock market today: Dow, S&P 500, Nasdaq jump to start busy week of Big Tech-dominated earnings",Earnings season dominates market focus this week with tariffs still on the table.,https://finance.yahoo.com/news/live/stock-market-today-dow-sp-500-nasdaq-jump-to-start-busy-week-of-big-tech-dominated-earnings-235753115.html,finance.yahoo.com,,
2025-07-20 23:50:12+00:00,GOOGL,Tech Earnings and Trade Tensions Keep Investors on Edge,U.S. stock futures showed little movement as investors focused on trade developments and awaited major tech earnings. Dow Jones Industrial Average futures dippe,https://www.gurufocus.com/news/2989107/tech-earnings-and-trade-tensions-keep-investors-on-edge,gurufocus.com,,
2025-07-20 22:59:51+00:00,GOOGL,"Dow futures dip as investors brace for a big week of earnings, housing market data and Jerome Powell","On Tuesday, Federal Reserve Chairman Jerome Powell and Governor Michelle Bowman are due to speak at a banking conference.",https://fortune.com/2025/07/20/stock-market-today-dow-futures-tesla-earnings-jerome-powell-housing-market/,fortune.com,,
2025-06-20 23:26:08+00:00,GOOGL,Alphabet (GOOG) Faces Setback with EU Fine Appeal,"Alphabet's (GOOG) stock has recently experienced a decline of around 3.59%, driven primarily by ongoing regulatory issues within the European Union. This drop i",https://www.gurufocus.com/news/2938044/alphabet-goog-faces-setback-with-eu-fine-appeal,gurufocus.com,,
2025-06-20 20:00:21+00:00,GOOGL,Tesla (TSLA) Faces Regulatory Challenges for Robotaxi Launch in Austin,"Tesla (TSLA) is set to test its long-awaited Robotaxi service in Austin, Texas, starting June 22. However, the service faces regulatory hurdles as Texas Democra",https://www.gurufocus.com/news/2937732/tesla-tsla-faces-regulatory-challenges-for-robotaxi-launch-in-austin,gurufocus.com,,
2025-06-20 19:45:33+00:00,GOOGL,Google (GOOG) Leverages YouTube to Enhance AI Models | GOOG Stock News,"Google (GOOG) is utilizing its vast repository of YouTube content to advance the development of its AI models, including Gemini and Veo 3. This initiative invol",https://www.gurufocus.com/news/2937708/google-goog-leverages-youtube-to-enhance-ai-models-goog-stock-news,gurufocus.com,,
2025-05-21 22:30:17+00:00,GOOGL,U.S. Stock Market Declines Amid Treasury Yield Surge and Economic Concerns,The U.S. stock market experienced significant declines due to rising deficits concerns and a weak 20-year Treasury bond auction. The 30-year Treasury yield soar,https://www.gurufocus.com/news/2881526/us-stock-market-declines-amid-treasury-yield-surge-and-economic-concerns,gurufocus.com,,
2025-05-21 22:10:17+00:00,GOOGL,U.S. Stock Market Tumbles Amid Concerns Over Tax Bill and Rising Bond Yields,"The U.S. stock market experienced a significant downturn, with major indices dropping over 1%. Concerns are mounting over a Republican tax bill potentially exac",https://www.gurufocus.com/news/2881456/us-stock-market-tumbles-amid-concerns-over-tax-bill-and-rising-bond-yields,gurufocus.com,,
2025-05-21 21:56:44+00:00,GOOGL,GOOG Integrates Ads into AI Mode to Enhance User Engagement,Google's (GOOG) strategic ad integration in AI Mode promises enhanced interactivity and revenue potential.    Analysts project a potential upside of 18.52%,https://www.gurufocus.com/news/2881244/goog-integrates-ads-into-ai-mode-to-enhance-user-engagement,gurufocus.com,,
2025-04-21 21:31:00+00:00,GOOGL,Applied Digital: AI Data Center Hype or Real Value?,"Market Analysis by  covering: Microsoft Corporation, Oracle Corporation, Alphabet Inc Class A, Amazon.com Inc. Read 's Market Analysis on Investing.com",https://www.investing.com/analysis/applied-digital-ai-data-center-hype-or-real-value-200659767,investing.com,,
2025-04-21 21:25:40+00:00,GOOGL,"Trump Justice Department, Google spar over 'illegal monopoly,' remedies in landmark antitrust case",Google and Justice Department lawyers faced off in court Monday as a three-week remedies trial kicks off and will feature testimony from Google's CEO and other major players.,https://www.foxbusiness.com/fox-news-politics/trump-justice-department-google-spar-over-illegal-monopoly-remedies-landmark-antitrust-case,foxbusiness.com,,
2025-04-21 21:14:00+00:00,GOOGL,Are Netflix’s Lofty Ambitions Grounded in Reality?,"Market Analysis by  covering: Microsoft Corporation, Alphabet Inc Class A, Apple Inc, Amazon.com Inc. Read 's Market Analysis on Investing.com",https://www.investing.com/analysis/are-netflixs-lofty-ambitions-grounded-in-reality-200659766,investing.com,,
2025-03-22 22:30:00+00:00,GOOGL,AI Stocks: The Silver Lining in an Otherwise Stormy Tech Market,"Artificial intelligence (AI) stocks fueled stock market gains over the past two years as investors viewed AI as the next game-changing technology -- one that could join discoveries like electricity or developments like the internet.  The Federal Reserve was wrapping up its interest rate increases and on track to start lowering rates -- and this happened.  Against this backdrop, growth stocks also lifted benchmarks as these types of companies thrive in better economic environments -- it's easier for them to expand, and their customers generally have more money to spend on products and services.",https://finance.yahoo.com/news/ai-stocks-silver-lining-otherwise-223000287.html,finance.yahoo.com,,
2025-03-22 16:30:35+00:00,GOOGL,Alphabet (GOOGL) Makes $32B AI-Powered Cybersecurity Bet with Wiz Acquisition,"We recently published a list of 10 High-Flying AI Stocks to Watch Today. In this article, we are going to take a look at where Alphabet Inc.",https://www.insidermonkey.com/blog/alphabet-googl-makes-32b-ai-powered-cybersecurity-bet-with-wiz-acquisition-1489320/,insidermonkey.com,,
2025-03-22 16:15:03+00:00,GOOGL,Alphabet Stock: Too Early To Buy The Dip (NASDAQ:GOOGL),Alphabet stock is a hold amidst economic uncertainty. Learn why GOOGL stock could see growth with positive shifts in AI or Fed policy.,https://seekingalpha.com/article/4769710-alphabet-too-early-to-buy-dip,seekingalpha.com,,
2025-02-20 20:28:00+00:00,GOOGL,Intel: What Are the Chances of a Restructuring and Who Are the Likely Benefactors?,"Stocks Analysis by The Tokenist (Timothy Fries) covering: Intel Corporation, Microsoft Corporation, Alphabet Inc Class A, Qualcomm Incorporated. Read The Tokenist (Timothy Fries)'s latest article on Investing.com",https://www.investing.com/analysis/intel-what-are-the-chances-of-a-restructuring-and-who-are-the-likely-benefactors-200657579,investing.com,,
2025-02-20 18:10:25+00:00,GOOGL,Watching Nvidia and Apple crater shook my resolve. Here is what got me through it,I made my,https://www.cnbc.com/2025/02/20/cramer-nvidia-apple-swoons-shook-me-here-is-what-got-me-through.html,cnbc.com,,
2025-02-20 18:05:18+00:00,GOOGL,Alphabet Inc. (GOOG): Among the Best Long-Term Stocks to Buy According to Ken Fisher,"We recently compiled a list of the 12 Best Long-Term Stocks to Buy According to Ken Fisher. In this article, we are going to take a look at where Alphabet Inc.",https://www.insidermonkey.com/blog/alphabet-inc-goog-among-the-best-long-term-stocks-to-buy-according-to-ken-fisher-1458959/,insidermonkey.com,,
2025-01-21 23:06:39+00:00,GOOGL,Here's Why This Medical AI Stock Soared 35% on Tuesday,Tempus AI stock had its best day on record on Tuesday after the medical tech company launched an AI-powered health concierge and former House Speaker Nancy Pelosi revealed she's bet on the stock.,https://www.investopedia.com/why-tempus-ai-stock-soared-35-percent-on-tuesday-nancy-pelosi-8778148,investopedia.com,,
2025-01-21 22:45:19+00:00,GOOGL,Alphabet (GOOGL) Outpaces Stock Market Gains: What You Should Know,"In the most recent trading session, Alphabet (GOOGL) closed at $198.05, indicating a +1.05% shift from the previous trading day.",https://www.zacks.com/stock/news/2400816/alphabet-googl-outpaces-stock-market-gains-what-you-should-know?cid=CS-ZC-FT-tale_of_the_tape|yseop_template_6-2400816,zacks.com,,
2025-01-21 22:45:18+00:00,GOOGL,Alphabet Inc. (GOOG) Laps the Stock Market: Here's Why,"The latest trading day saw Alphabet Inc. (GOOG) settling at $199.63, representing a +1.05% change from its previous close.",https://www.zacks.com/stock/news/2400822/alphabet-inc-goog-laps-the-stock-market-heres-why?cid=CS-ZC-FT-tale_of_the_tape|yseop_template_6-2400822,zacks.com,,
2024-12-22 19:00:45+00:00,GOOGL,"Quantum Computing: The New AI? A Look at the Rapidly Expanding Market and Top Stocks For 2025 - Global X Cloud Computing ETF (NASDAQ:CLOU), ARK Next Generation Internet ETF (ARCA:ARKW)","Quantum computing is poised to revolutionize industries by 2025, offering immense growth opportunities for investors in top stocks and ETFs.",https://www.benzinga.com/markets/equities/24/12/42638753/quantum-computing-the-new-ai-a-look-at-the-rapidly-expanding-market-and-top-stocks-for-2025,benzinga.com,,
2024-12-22 17:30:00+00:00,GOOGL,Should You Buy Quantum Computing Stocks in 2025?,"There are plenty to choose from, and they're all soaring in price. That doesn't necessarily mean you should buy the stocks, though.",https://finance.yahoo.com/news/buy-quantum-computing-stocks-2025-173000148.html,finance.yahoo.com,,
2024-12-22 16:18:27+00:00,GOOGL,Why Alphabet Inc. (GOOGL) Is Among the Best Stocks to Buy and Hold for 3 Years?,"We recently published a list of the 10 Best Stocks to Buy and Hold For 3 Years. In this article, we are going to take a look at where Alphabet Inc.",https://www.insidermonkey.com/blog/why-alphabet-inc-googl-is-among-the-best-stocks-to-buy-and-hold-for-3-years-1411900/,insidermonkey.com,,
2024-11-22 23:59:35+00:00,GOOGL,"Dow Jones Futures: Stay Cool In Hot Stock Market; Forget Nvidia, Meet The New AI Chip Leader","Dow Jones futures: The stock market rally is hot, but keep a cool head. Nvidia is the giant, but Astera Labs is the new AI chip stock leader.",https://www.investors.com/market-trend/stock-market-today/dow-jones-futures-forget-nvidia-ai-chip-leader-astera-labs/?src=A00220&yptr=yahoo,finance.yahoo.com,,
2024-11-22 23:28:20+00:00,GOOGL,JPMorgan Maintains Overweight Rating on Alphabet Inc. (GOOG) Amid Google Antitrust Case Concerns and Potential Apple Shift,"We recently compiled a list of the 15 Trending AI Stocks on Latest News and Ratings. In this article, we are going to take a look at where Alphabet Inc.",https://www.insidermonkey.com/blog/jpmorgan-maintains-overweight-rating-on-alphabet-inc-goog-amid-google-antitrust-case-concerns-and-potential-apple-shift-1396162/,insidermonkey.com,,
2024-11-22 21:30:53+00:00,GOOGL,"Stocks Climb Led by Small Caps, Bitcoin Soars: Markets Wrap",It’s shaping up to be a good week for blue-chip and small-cap stocks which led Friday’s advance as this year’s big tech winners struggled to gain ground.,https://www.livemint.com/news/stocks-climb-led-by-small-caps-bitcoin-soars-markets-wrap-11732311053446.html,livemint.com,,
2024-10-23 22:32:25+00:00,GOOGL,Market Today: Tesla's Earnings Beat and Peloton's Surge Highlight the Day,"Market Overview

The stock market faced significant pressure today due to losses in major stocks and concerns about rising Treasury yields. The 2-year note yiel",https://www.gurufocus.com/news/2564317/market-today-teslas-earnings-beat-and-pelotons-surge-highlight-the-day,gurufocus.com,,
2024-10-23 22:25:18+00:00,GOOGL,ServiceNow Sales Growth Fails to Impress AI-Hungry Investors,"(Bloomberg) -- ServiceNow Inc. reported strong third-quarter sales and bookings, but failed to clear the lofty expectations of investors looking for a bigger boost from artificial intelligence.Most Read from BloombergClimate Change Is Killing Buildings in Slow MotionOman Sees an Urban Future Distinct From Dubai and Abu DhabiTransportation Policy Gets Left Behind in Presidential RaceHow Kyiv Became a Leader in Digital Services Amid Wartime StrainDhaka's Revolutionary Makeover Pits Visions of Peac",https://finance.yahoo.com/news/servicenow-reports-strong-sales-growth-202304985.html,finance.yahoo.com,,
2024-10-23 21:37:30+00:00,GOOGL,NVIDIA (NVDA) Resolves Blackwell AI Chip Design Flaw with TSMC's Assistance,"NVIDIA (NVDA) CEO Jensen Huang announced the resolution of a design flaw in the company's latest Blackwell AI chip, achieved with the assistance of Taiwan Semic",https://www.gurufocus.com/news/2563986/nvidia-nvda-resolves-blackwell-ai-chip-design-flaw-with-tsmcs-assistance,gurufocus.com,,
2024-09-23 22:32:52+00:00,GOOGL,"Market Today: Novo Nordisk Faces Senate Scrutiny, GameStop Completes $400M Equity Offering","Market Performance
The Dow Jones Industrial Average rose by 0.2%, and the S&P 500 increased by 0.3%, both extending into record territory. The Nasdaq Composite",https://www.gurufocus.com/news/2532817/market-today-novo-nordisk-faces-senate-scrutiny-gamestop-completes-400m-equity-offering,gurufocus.com,,
2024-09-23 21:56:11+00:00,GOOGL,"Exclusive-Meta's AI chatbot to start speaking in the voices of Judi Dench, John Cena, others, source says By Reuters","Exclusive-Meta's AI chatbot to start speaking in the voices of Judi Dench, John Cena, others, source says",https://www.investing.com/news/world-news/exclusivemetas-ai-chatbot-to-start-speaking-in-the-voices-of-judi-dench-john-cena-others-source-says-3628880,investing.com,,
2024-09-23 21:45:21+00:00,GOOGL,Alphabet Inc. (GOOG) Stock Falls Amid Market Uptick: What Investors Need to Know,"In the most recent trading session, Alphabet Inc. (GOOG) closed at $163.07, indicating a -0.95% shift from the previous trading day.",https://www.zacks.com/stock/news/2340118/alphabet-inc-goog-stock-falls-amid-market-uptick-what-investors-need-to-know?cid=CS-ZC-FT-tale_of_the_tape|yseop_template_6-2340118,zacks.com,,
2024-08-24 22:01:00+00:00,GOOGL,Billionaire Bill Gates Has 83% of His $48 Billion Portfolio in Just 4 Stocks,"While he has more than two dozen stocks in his portfolio, four make up the vast majority of his holdings.",https://finance.yahoo.com/news/billionaire-bill-gates-83-48-220100442.html,finance.yahoo.com,,
2024-08-24 18:24:27+00:00,GOOGL,Will Alphabet (GOOG) AI Phones Crush Apple’s AI Plans?,AI stocks have pulled back considerably over the past few weeks and analysts believe this is exactly the healthy correction long-term investors were looking for.,https://www.insidermonkey.com/blog/will-alphabet-goog-ai-phones-crush-apples-ai-plans-1338315/,insidermonkey.com,,
2024-08-24 15:05:00+00:00,GOOGL,"Meet the Supercharged Growth Stock That Could Join Apple, Microsoft, and Nvidia in the $3 Trillion Club by 2031",Strong growth and secular tailwinds should help drive this tech titan to new heights.,https://finance.yahoo.com/news/meet-supercharged-growth-stock-could-150500142.html,finance.yahoo.com,,
2024-07-25 21:56:28+00:00,GOOGL,Morning Bid: Stocks not out of the woods after trying to recover By Reuters,Morning Bid: Stocks not out of the woods after trying to recover,https://www.investing.com/news/economy-news/morning-bid-stocks-not-out-of-the-woods-after-trying-to-recover-3537862,investing.com,,
2024-07-25 21:55:50+00:00,GOOGL,"Stocks mostly climb after recent selloff; yields fall, yen rises","NEW YORK (July 26): World stock indexes mostly rose on Thursday, with the S&P 500 gaining after the previous day's megacap-led selloff, while Treasury yields fell as a solid reading on U.S. economic growth failed to alter expectations for an interest rate cut from the Federal Reserve.

...",https://theedgemalaysia.com/node/720480,theedgemarkets.com,,
2024-07-25 21:26:39+00:00,GOOGL,"Google: The More It Drops, The More I’ll Buy (NASDAQ:GOOG)","Despite strong earnings from Google, tech valuations are under pressure. Google stock fell 5% despite exceeding profit estimates. Click for my GOOG earnings update.",https://seekingalpha.com/article/4706838-google-the-more-it-drops-the-more-ill-buy,seekingalpha.com,,
2024-06-25 22:40:06+00:00,GOOGL,Nasdaq ends higher on tech strength; Dow pulls back,"(June 26): The Nasdaq rallied 1.3% on Tuesday, buoyed by strength in Nvidia and other tech megacaps, while the Dow slipped as retailers weighed and investors waited for crucial inflation data due out this week.

AI chip firm Nvidia climbed 6.8%, bouncing back after a three-session sell-o...",https://theedgemalaysia.com/node/716809,theedgemarkets.com,,
2024-06-25 20:45:00+00:00,GOOGL,Energy Crunch Opportunities: Balancing AI Innovation And Data Center Demands,AI is advancing so quickly that the World Economic Forum reports the computational power required to sustain AI’s rise doubles roughly every 100 days. Click to read.,https://seekingalpha.com/article/4701030-energy-crunch-opportunities-balancing-ai-innovation-and-data-center-demands,seekingalpha.com,,
2024-06-25 18:35:33+00:00,GOOGL,"Nvidia Bounces After Touching Mini Support, Wait For Micron Earnings, Airbus Falters - NVIDIA (NASDAQ:NVDA)","To gain an edge, this is what you need to know today.",https://www.benzinga.com/24/06/39487814/nvidia-bounces-after-touching-mini-support-wait-for-micron-earnings-airbus-falters,benzinga.com,,
2024-05-26 20:08:51+00:00,GOOGL,Is Alphabet (GOOG) The Best AI Stock for 2024 According to Billionaire David Tepper?,Alphabet Inc. (NASDAQ:GOOG) ranks 6th on our list of 10 Best AI Stocks to Buy for 2024 According to Billionaire David Tepper. Click to see 10 Best AI Stocks to Buy for 2024 According to Billionaire David Tepper. Billionaire David Tepper of Appaloosa Management recently made headlines when his latest portfolio showed the 66-year-old owner […],https://finance.yahoo.com/news/alphabet-goog-best-ai-stock-200851259.html?.tsrc=rss,finance.yahoo.com,,
2024-05-26 20:03:23+00:00,GOOGL,10 Best AI Stocks to Buy for 2024 According to Billionaire David Tepper,Billionaire David Tepper of Appaloosa Management recently made headlines when his latest portfolio showed the 66-year-old owner of Carolina Panthers was piling into Chinese stocks while clearly cutting...,https://www.insidermonkey.com/blog/10-best-ai-stocks-to-buy-for-2024-according-to-billionaire-david-tepper-1306827/,insidermonkey.com,,
2024-05-26 16:20:57+00:00,GOOGL,"IETC ETF: Achieving US Tech Independence Is Unrealistic, Sub-Optimal (BATS:IETC)",An article discussing the pros and cons of iShares U.S. Tech Independence Focused ETF,https://seekingalpha.com/article/4695732-ietc-etf-achieving-us-tech-independence-unrealistic-even-sub-optimal,seekingalpha.com,,
2024-04-26 23:30:12+00:00,GOOGL,Big Tech earnings power S&P to best week since October 2023 (NYSEARCA:SPY),"The S&P 500 (SP500) on Friday climbed 2.67% for the week to end at 5,099.96 points, posting gains in four out of five sessions. Read more here.",https://seekingalpha.com/news/4095190-big-tech-earnings-power-sp-to-best-week-since-october-2023-focus-turns-to-fed-meet,seekingalpha.com,,
2024-04-26 22:55:50+00:00,GOOGL,"Alphabet director John L. Hennessy sells $369,096 in stock By Investing.com","Alphabet director John L. Hennessy sells $369,096 in stock",https://www.investing.com/news/company-news/alphabet-director-john-l-hennessy-sells-369096-in-stock-93CH-3401755,investing.com,,
2024-04-26 22:40:33+00:00,GOOGL,"Market Today: Tech Giants Reignite AI Craze, Alibaba Continues Winning Streak","Weekly Stock Market OverviewThe stock market showed signs of recovery after a slow start to the month, buoyed by positive earnings reports from key companies an",https://www.gurufocus.com/news/2419941/market-today-tech-giants-reignite-ai-craze-alibaba-continues-winning-streak,gurufocus.com,,
2024-03-27 22:40:45+00:00,GOOGL,Market Today: Johnson & Johnson Wins Right to Challenge Talc Evidence; Ford Slashes Workforce Amid,"Market Overview
Today's trading session ended on a high note, with a positive trend as advancers outnumbered decliners. This upward movement was evident at both",https://www.gurufocus.com/news/2398765/market-today-johnson-johnson-wins-right-to-challenge-talc-evidence-ford-slashes-workforce-amid,gurufocus.com,,
2024-03-27 20:19:47+00:00,GOOGL,17 Countries with the Highest Number of Road Traffic Deaths,"In this article, we will take a look at the 17 countries with the highest number of road traffic deaths. If you want to skip our detailed analysis, you can go directly to 5 Countries with the Highest Number of Road Traffic Deaths. Are Self Driving Vehicles Really That Safe? According to a report by […]",https://finance.yahoo.com/news/17-countries-highest-number-road-201947261.html?.tsrc=rss,finance.yahoo.com,,
2024-03-27 18:46:18+00:00,GOOGL,Altimeter Capital CEO: 'The wheels are starting to change for Alphabet.' (NASDAQ:GOOGL),"Alphabet’s (GOOGL) ownership of mistake towards Gemini’s launch is what got Altimeter Capital CEO Bradley Gerstner back into the stock, he said.",https://seekingalpha.com/news/4084600-altimeter-capital-ceo-the-wheels-are-starting-to-change-for-alphabet,seekingalpha.com,,
2024-02-26 23:37:16+00:00,GOOGL,Stocks end slightly lower as focus shifts to data,"STORY: U.S. stocks ended slightly lower on Monday after last week's AI-fueled rally, as the focus shifted to upcoming economic data that could affect the timing of the Federal Reserve's expected...",https://www.marketscreener.com/quote/currency/AUSTRALIAN-DOLLAR-US-DOLL-2373531/news/Stocks-end-slightly-lower-as-focus-shifts-to-data-46033209/,marketscreener.com,,
2024-02-26 23:33:50+00:00,GOOGL,Berkshire March Toward $1 Trillion Value Stalls on Results,Berkshire Hathaway Inc. retreated on Monday after touching a record high that pushed the market value of Warren Buffett’s conglomerate even closer to $1 trillion.,https://www.livemint.com/news/berkshire-march-toward-1-trillion-value-stalls-on-results-11708990430938.html,livemint.com,,
2024-02-26 23:30:53+00:00,GOOGL,Live news: Big Tech rally loses steam as US stocks close lower,,https://www.ft.com/content/38c5c4d1-1312-4e7f-9e72-bd06740bea1a,ft.com,,
2024-01-27 22:35:27+00:00,GOOGL,Where Will Google Stock Be in 2024?,Alphabet is at the top of my list of stocks to buy in 2024.,https://finance.yahoo.com/news/where-google-stock-2024-223527161.html,finance.yahoo.com,,
2024-01-27 16:35:00+00:00,GOOGL,Lyrical Asset Management 2023 U.S. Value Review Letter,"Lyrical Asset Management's CS composite returned 27.2%, outperforming the S&P 500 by 90 bps. Click here to read the full fund letter. I",https://seekingalpha.com/article/4665559-lyrical-asset-management-2023-us-value-review-letter,seekingalpha.com,,
