news_url,title,text,source_name,date,topics,tickers
https://www.fool.com/investing/2025/11/08/2-ai-stocks-that-could-go-parabolic/,2 AI Stocks That Could Go Parabolic,"Companies early to the AI market could score a big win, and that's why investors have rushed to get in on these stocks. Valuations have taken off, but some AI stocks remain reasonably priced -- and the following two are actually bargains.",The Motley Fool,"Sat, 08 Nov 2025 18:10:00 -0500",[],GOOGL
https://247wallst.com/investing/2025/11/08/the-1-number-that-shows-why-alphabet-is-a-buy-today/?utm_source=snapi,The 1 Number That Shows Why Alphabet Is a Buy Today,"In the competitive tech stock landscape, Alphabet ( NASDAQ:GOOG )  stands out because of its diverse revenue streams, from search advertising to cloud computing.",24/7 Wall Street,"Sat, 08 Nov 2025 16:16:40 -0500",[],GOOGL
https://www.fool.com/investing/2025/11/08/these-stocks-could-deliver-market-beating-returns/,Prediction: These Stocks Could Deliver Market-Beating Returns Over the Next Decade,"Alphabet is a great long-term play on the cloud, AI, and digital advertising markets. Meta's social media platforms will continue to attract new users and advertisers.",The Motley Fool,"Sat, 08 Nov 2025 08:00:00 -0500",[],GOOGL
https://www.wsj.com/business/media/disney-youtube-tv-reactions-aecebab8,Disney-YouTube TV Blackout Has Customers Scrambling and Getting Creative,Fans of football and ‘Dancing With the Stars' are hooking up antennas to stay tuned in.,WSJ,"Sat, 08 Nov 2025 05:30:00 -0500",['paywall'],GOOGL
https://www.wsj.com/business/autos/china-robotaxi-self-driving-waymo-254ce0a1,Riding in a Chinese Robotaxi Is Pretty Smooth—That's a Problem for Waymo,"While U.S. companies dominate their home market, other countries are looking to China for driverless technology.",WSJ,"Fri, 07 Nov 2025 23:00:00 -0500",['paywall'],GOOGL
https://seekingalpha.com/article/4840646-alphabet-the-ride-has-just-begun,Alphabet: The Ride Has Just Begun,"GOOG remains a strong buy, driven by robust Q3 2025 results and leadership in AI monetization, showcasing a record $102B quarterly revenue and high profitability. GOOG's plans to realize significant investments through 2026 should be taken with optimism, as they are key to drive Google Cloud and AI integration into existing environment further. Despite a higher valuation, GOOG's growth trajectory and adaptability to the AI era justify its premium and long-term investment appeal.",Seeking Alpha,"Fri, 07 Nov 2025 18:32:42 -0500",['paylimitwall'],GOOGL
https://www.businessinsider.com/disney-youtube-tv-standoff-heats-up-pr-battle-intensifies-2025-11,Why Disney is losing the PR war with YouTube TV as their contract dispute drags on,"Disney and YouTube TV are waging a PR war to sway viewers as their contract dispute drags on. Disney has painted itself as the underdog, but some surveys show it's getting more blame.",Business Insider,"Fri, 07 Nov 2025 15:06:03 -0500",['paywall'],GOOGL
https://www.businessinsider.com/youtube-tv-google-leverage-disney-espn-carriage-dispute-fight-cable-2025-11,YouTube's leverage in its fight with Disney goes beyond support from Google,"YouTube TV is driving a hard bargain with Disney, whose channels are off the service. Media analysts say YouTube TV has leverage since it's supported by Google.",Business Insider,"Fri, 07 Nov 2025 14:15:50 -0500",['paywall'],GOOGL
https://www.fool.com/investing/2025/11/07/what-is-one-of-the-best-tech-stocks-to-buy-now/,What Is One of the Best Tech Stocks to Buy Now?,Alphabet's stock price has more than doubled since hitting a 52-week low in April. Alphabet is competitively positioned in the cloud market due to its world-class artificial intelligence (AI) infrastructure.,The Motley Fool,"Fri, 07 Nov 2025 13:26:47 -0500",['StocksToWatch'],GOOGL
https://www.cnbc.com/2025/11/07/big-techs-ai-spending-spree-smart-long-term-bet-or-short-term-risk.html,Big Tech's AI spending spree: Smart long-term bet or short-term risk?,CNBC's Paulina Likos and Zev Fima break down big tech's massive artificial intelligence spending spree,CNBC,"Fri, 07 Nov 2025 13:20:24 -0500",[],GOOGL
https://www.reuters.com/business/media-telecom/disney-youtube-tv-remain-talks-restore-abc-espn-2025-11-07/,"Disney, YouTube TV remain in talks to restore ABC and ESPN",Disney said on Friday that it is continuing negotiations with Google's YouTube TV to bring back ABC and ESPN after the entertainment giant's networks went dark on the pay-TV service.,Reuters,"Fri, 07 Nov 2025 13:04:25 -0500",[],GOOGL
https://www.forbes.com/sites/greatspeculations/2025/11/07/meta-vs-alphabet-stock-which-offers-more-upside/,Meta Vs. Alphabet Stock: Which Offers More Upside?,"Meta Platforms (META) and Alphabet (GOOGL) remain two of the strongest players in digital advertising, but their recent performance reveals a growing divide. While both continue to deliver steady revenue growth, Meta's efficiency gains and faster operating momentum have drawn investor attention — especially given its more attractive valuation compared to Alphabet.",Forbes,"Fri, 07 Nov 2025 12:35:03 -0500",['paylimitwall'],GOOGL
https://www.investopedia.com/these-analysts-predict-an-ai-sell-off-here-s-the-long-short-trade-they-suggest-11845401,These Analysts Predict an AI Sell-Off. Here's the Long-Short Trade They Suggest,"The boom-bust cycle that has lately powered a pullback in cryptocurrencies and precious metals is coming for AI stocks, according to BCA Research. And they have an idea for how to play it.",Investopedia,"Fri, 07 Nov 2025 12:00:49 -0500",[],GOOGL
https://www.fool.com/investing/2025/11/07/why-alphabet-rallied-157-in-october/,Why Alphabet Rallied 15.7% in October,"Alphabet delivered strong earnings with accelerating Search and cloud growth. Its next-gen ventures in autonomous driving, genAI, and quantum computing also received good news.",The Motley Fool,"Fri, 07 Nov 2025 08:00:00 -0500",[],GOOGL
https://www.cnbc.com/2025/11/07/googles-decade-long-bet-on-tpus-companys-secret-weapon-in-ai-race.html,Google's decade-long bet on custom chips is turning into company's secret weapon in AI race,"Google has spent more than a decade developing silicon, a bet that's paying off in a big way from the AI boom. The company says increased demand for its Tensor Processing Units, or TPUs, is one reason for the recent growth in its cloud unit.",CNBC,"Fri, 07 Nov 2025 07:30:01 -0500",[],GOOGL
https://www.fool.com/investing/2025/11/07/prediction-alphabet-stock-will-soar-50-by-2026/,Prediction: Alphabet Stock Will Soar 50% by 2026,"Alphabet (GOOGL +0.11%) (GOOG +0.16%) just delivered record-breaking earnings, surpassing $100 billion in revenue and accelerating its AI-driven transformation. With Gemini scaling globally and Google Cloud hitting new highs, Alphabet's momentum looks unstoppable.",The Motley Fool,"Fri, 07 Nov 2025 07:15:00 -0500",['podcast'],GOOGL
https://seekingalpha.com/article/4840043-oakmark-concentrated-strategy-6-stocks-that-raised-guidance-and-drove-innovation,Oakmark Concentrated Strategy: 6 Stocks That Raised Guidance And Drove Innovation,"Warner Bros Discovery reported merger with Paramount-Skydance could generate meaningful cost synergies and create a scaled competitor with a deep and unmatched content library. Innovations in the Google Search experience are driving both engagement and revenue benefits for Alphabet. IQVIA's R&D solutions business showed signs of gaining share, with its win rate improving significantly.",Seeking Alpha,"Fri, 07 Nov 2025 02:15:00 -0500",['paylimitwall'],GOOGL
https://www.pymnts.com/google/2025/google-finance-rolls-out-ai-driven-deep-search-prediction-market-data/?utm_source=snapi,"Google Finance Rolls Out AI-Driven Deep Search, Prediction-Market Data","Google introduced on Thursday (Nov. 6) new AI features to Google Finance, adding Deep Search, enhanced charting and prediction-market data. The update, outlined in Google's blog, integrates the company's Gemini models into its finance product and broadens beyond basic stock listings and headlines.",PYMNTS,"Thu, 06 Nov 2025 16:19:31 -0500",[],GOOGL
https://techcrunch.com/2025/11/06/google-to-buy-carbon-credits-from-massive-amazonian-reforestation-project/,Google to buy carbon credits from massive Amazonian reforestation project,"Google announced Thursday it is buying 200,000 metric tons of carbon removal from Mombak, a forest restoration company based in Brazil. The project will buy farmland in the Amazon and reforest it.",TechCrunch,"Thu, 06 Nov 2025 15:28:50 -0500",[],GOOGL
https://www.youtube.com/watch?v=YguoCAygbwc,Google opens access to its most powerful AI chip,CNBC's MacKenzie Sigalos reports on news regarding Google.,CNBC Television,"Thu, 06 Nov 2025 14:17:52 -0500",[],GOOGL
https://www.cnet.com/tech/services-and-software/apple-to-pay-google-1-billion-per-year-for-siris-custom-gemini-ai-model-report-says/,"Apple to Pay Google $1 Billion Per Year for Siri's Custom Gemini AI Model, Report Says",Apple reportedly chose Google over Anthropic because of cost.,CNET,"Thu, 06 Nov 2025 12:46:07 -0500",[],GOOGL
https://www.youtube.com/watch?v=hkq8SXmhB5s,Google's AI chip 'Ironwood' takes on Nvidia,CNBC's MacKenzie Sigalos joins 'Money Movers' with the latest details on Google's new custom chip efforts and how they stack up against Nvidia.,CNBC Television,"Thu, 06 Nov 2025 12:23:36 -0500",[],GOOGL
https://www.benzinga.com/Opinion/25/11/48691283/long-only-spread-trading-strategy-using-microsoft-alphabet-stocks?utm_source=snapi,Long-Only Spread Trading Strategy Using Microsoft And Alphabet Stocks,"In this article, we explore a quantitative approach to spread trading with a slightly different setup than the classic model.",Benzinga,"Thu, 06 Nov 2025 10:47:05 -0500",['paywall'],GOOGL
https://www.barrons.com/articles/apple-stock-price-ai-google-8e3acadf,"Apple Will Turn to Google for AI, Report Says. That's a Sign of Weakness.",Apple's reported plan to pay for access to Google's AI underlines a shift in power between the two companies.,Barrons,"Thu, 06 Nov 2025 09:37:00 -0500",['paywall'],GOOGL
https://www.marketwatch.com/story/google-may-be-nvidias-biggest-rival-in-chips-and-now-its-upping-its-game-a85c0092,Google may be Nvidia's biggest rival in chips — and now it's upping its game,The company's seventh-generation TPU chip is custom-built to handle tasks such as large-scale AI model training and high-volume AI inference.,Market Watch,"Thu, 06 Nov 2025 08:06:00 -0500",['paylimitwall'],GOOGL
https://www.cnbc.com/2025/11/06/google-unveils-ironwood-seventh-generation-tpu-competing-with-nvidia.html,"Google's rolling out its most powerful AI chip, taking aim at Nvidia with custom silicon","Google said it's making Ironwood, the company's most powerful chip yet, widely available in the coming weeks. Ironwood, the seventh generation of Google's Tensor Processing Unit (TPU), was initially introduced in April for testing.",CNBC,"Thu, 06 Nov 2025 08:00:01 -0500",[],GOOGL
https://venturebeat.com/ai/google-debuts-ai-chips-with-4x-performance-boost-secures-anthropic-megadeal,"Google debuts AI chips with 4X performance boost, secures Anthropic megadeal worth billions","Google Cloud is introducing what it calls its most powerful artificial intelligence infrastructure to date, unveiling a seventh-generation Tensor Processing Unit and expanded Arm-based computing options designed to meet surging demand for AI model deployment — what the company characterizes as a fundamental industry shift from training models to serving them to billions of users. The announcement, made Thursday, centers on Ironwood , Google's latest custom AI accelerator chip, which will become generally available in the coming weeks.",VentureBeat,"Thu, 06 Nov 2025 08:00:00 -0500",[],GOOGL
https://www.benzinga.com/markets/equities/25/11/48683559/apples-q4-earnings-beat-1-billion-google-ai-deal-fuel-surge-in-growth-rankings?utm_source=snapi,"Apple's Q4 Earnings Beat, $1 Billion Google AI Deal Fuel Surge In Growth Rankings","Apple Inc. (NASDAQ:AAPL) is navigating a pivotal moment in its growth story, as its latest growth percentile ranking shows both dramatic improvement and underlying volatility.",Benzinga,"Thu, 06 Nov 2025 07:51:21 -0500","['earnings', 'paywall']",GOOGL
https://seekingalpha.com/article/4839076-alphabet-the-ai-transformation-is-just-beginning,Alphabet: The AI Transformation Is Just Beginning,"The rapid adoption of the Gemini series of models should position Google as a leader for both enterprise and consumer use of AI. GCP growth continues to accelerate, with rising demand for AI workloads to be run through the cloud. While near term spending will remain elevated, this will set the foundation for long term growth and operating leverage.",Seeking Alpha,"Thu, 06 Nov 2025 07:39:59 -0500",['paylimitwall'],GOOGL
https://techxplore.com/news/2025-11-google-epic-games-legal-app.html,"Google, Epic Games settle long legal fight over app store","Google and Epic Games Inc., maker of the popular Fortnite game, reached a settlement in their five-year antitrust fight over how developers distribute and monetize apps on Android phones, according to a court filing.",TechXplore,"Thu, 06 Nov 2025 06:59:25 -0500",[],GOOGL
https://www.pymnts.com/apple/2025/apple-seeks-googles-help-in-long-awaited-siri-ai-update/?utm_source=snapi,Apple Seeks Google's Help in Long-Awaited Siri AI Update,"Apple is reportedly nearing a $1-billion-per-year deal with Google to power its long-awaited Siri upgrade. That deal would give Apple access to a powerful 1.2 trillion parameter artificial intelligence (AI) model from Google, Bloomberg News reported Wednesday (Nov. 5), citing sources with knowledge of the matter.",PYMNTS,"Thu, 06 Nov 2025 06:54:44 -0500",[],GOOGL
https://invezz.com/news/2025/11/06/google-quadruples-down-on-amazon-reforestation-with-top-brazilian-carbon-supplier-startup/?utm_source=snapi,Google quadruples down on Amazon reforestation with top Brazilian carbon supplier startup,"In its largest carbon removal commitment to date, Google has partnered with Brazilian startup Mombak to finance the restoration of the Amazon rainforest, securing high-quality carbon credits to offset the substantial emissions generated by its energy-intensive data centers.",Invezz,"Thu, 06 Nov 2025 05:48:57 -0500",[],GOOGL
https://www.fool.com/investing/2025/11/06/massive-news-for-alphabet-stock-investors/,Massive News for Alphabet Stock Investors!,Alphabet (GOOG +2.41%) (GOOGL +2.44%) is spending aggressively to develop its artificial intelligence capabilities and is borrowing $25 billion to fund some of those investments.,The Motley Fool,"Thu, 06 Nov 2025 05:30:00 -0500",['podcast'],GOOGL
https://www.reuters.com/sustainability/cop/google-deal-amazon-reforestation-makes-brazilian-startup-its-top-carbon-credit-2025-11-06/,Exclusive: Google deal for Amazon reforestation makes Brazilian startup its top carbon credit supplier,"Google has struck its biggest carbon removal deal, agreeing to finance restoration of the Amazon rainforest with Brazilian startup Mombak, as big tech hunts for high-quality credits to offset emissions tied to energy-hungry data centers.",Reuters,"Thu, 06 Nov 2025 05:02:46 -0500",[],GOOGL
https://www.reuters.com/world/europe/google-announce-biggest-ever-investment-germany-tuesday-2025-11-06/,Google to announce biggest-ever investment in Germany on Tuesday,Google said on Thursday that it is to announce its biggest-ever investment plan for Germany on Tuesday alongside German Finance Minister Lars Klingbeil.,Reuters,"Thu, 06 Nov 2025 04:52:28 -0500",[],GOOGL
https://www.proactiveinvestors.co.uk/companies/news/1081923?SNAPI,Google set to unveil record investment plan for Germany,"Google is preparing to unveil what is expected to be its biggest-ever investment in Germany, according to reports in Handelsblatt. The company will announce the plans at a press conference on November 11, alongside Finance Minister Lars Klingbeil.",Proactive Investors,"Thu, 06 Nov 2025 03:16:54 -0500",[],GOOGL
https://www.reuters.com/world/asia-pacific/google-planning-powerful-ai-data-centre-tiny-australian-indian-ocean-outpost-2025-11-06/,Exclusive: Google planning powerful AI data centre on tiny Australian Indian Ocean outpost,"Google plans to build a large artificial intelligence data centre on Australia's remote Indian Ocean outpost of Christmas Island after signing a cloud deal with the Department of Defence earlier this year, according to documents reviewed by Reuters and interviews with officials.",Reuters,"Thu, 06 Nov 2025 02:58:30 -0500",[],GOOGL
https://www.zacks.com/commentary/2786375/2025-bull-market-persists-but-cracks-appear?cid=CS-STOCKNEWSAPI-FT-investment_ideas-2786375,"2025 Bull Market Persists, but Cracks Appear","While the 2025 bull market continues to push higher, subtle cracks in market breadth are appearing beneath the surface. Namely, the ""Hindenburg Omen"" suggests that caution may be warranted.",Zacks Investment Research,"Thu, 06 Nov 2025 01:16:05 -0500",[],GOOGL
https://www.reuters.com/business/google-announce-largest-ever-investment-plan-germany-handelsblatt-reports-2025-11-06/,"Google to announce largest-ever investment plan for Germany, Handelsblatt reports","U.S. tech giant Google plans to present its largest-ever investment plan for Germany next week, business news outlet Handelsblatt reported on Thursday.",Reuters,"Thu, 06 Nov 2025 00:58:06 -0500",[],GOOGL
https://www.barrons.com/articles/nvidia-meta-alphabet-sharkninja-stocks-471f0260,"Nvidia, Meta, Alphabet, and SharkNinja? This Manager Thinks All Four Are Winners.",Sonu Kalra has built a stellar record as manager of the Fidelity Blue Chip Growth fund. He calls ChatGPT's 2022 launch AI's “iPhone moment.,Barrons,"Thu, 06 Nov 2025 00:30:00 -0500",['paywall'],GOOGL
https://www.reuters.com/business/google-early-talks-boost-investment-anthropic-business-insider-reports-2025-11-06/,"Google in early talks to boost investment in Anthropic, Business Insider reports","Google is in early discussions to deepen its investment in Anthropic, the Business Insider reported on Wednesday, citing people familiar with the matter.",Reuters,"Wed, 05 Nov 2025 22:21:26 -0500",[],GOOGL
https://www.businessinsider.com/google-deepen-investment-in-ai-anthropic-2025-11,Google is in early talks to deepen its investment in Anthropic,"The talks come as Anthropic and its main rival, OpenAI, are in a multitrillion-dollar race to dominate AI. Big Tech companies are taking sides, with Amazon and Google backing Anthropic and Microsoft and Nvidia investing in OpenAI.",Business Insider,"Wed, 05 Nov 2025 21:36:13 -0500",['paywall'],GOOGL
https://deadline.com/2025/11/disney-youtube-tv-blackout-antitrust-fcc-sinclair-ceo-1236608469/,"Disney-YouTube TV Carriage Fight Is Breaking Antitrust Laws & FCC Rules, Sinclair CEO Says","Chris Ripley, CEO of TV station giant Sinclair, ripped Disney and YouTube TV's ongoing carriage fight for depriving audiences of local programming and running afoul of regulatory rules.",Deadline,"Wed, 05 Nov 2025 17:31:35 -0500",['CEO'],GOOGL
https://techcrunch.com/2025/11/05/apple-nears-deal-to-pay-google-1b-annually-to-power-new-siri-report-says/,"Apple nears deal to pay Google $1B annually to power new Siri, report says","Apple is nearing a deal with Google that would see the iPhone maker pay the tech giant roughly $1 billion a year for a custom version of Google's Gemini AI model to power its overhaul of Siri, according to a new report from Bloomberg.",TechCrunch,"Wed, 05 Nov 2025 15:37:47 -0500",[],GOOGL
https://www.marketwatch.com/story/why-this-critical-google-business-may-be-seriously-underestimated-on-wall-street-a2c91ce2,Why this critical Google business may be seriously underestimated on Wall Street,Wall Street sees Google Cloud growing at 31% in 2026 — but one analyst is modeling a path to 50%.,Market Watch,"Wed, 05 Nov 2025 15:13:00 -0500",['paylimitwall'],GOOGL
https://www.fastcompany.com/91435800/google-and-epic-end-their-feud-with-a-deal-that-changes-how-android-works,Google and Epic end their feud with a deal that changes how Android works,Fortnite maker Epic Games and Google just agreed on a “comprehensive settlement” that could be the final chapter in Epic's long battle over app store rules.,Fast Company,"Wed, 05 Nov 2025 14:41:04 -0500",['paylimitwall'],GOOGL
