news_url,title,text,source_name,date,topics,tickers
https://seekingalpha.com/article/4842855-riverpark-longshort-opportunity-fund-q3-2025-top-and-bottom-performers,RiverPark Long/Short Opportunity Fund: Q3 2025 Top And Bottom Performers,"GOOG was our top contributor in the quarter, benefiting from accelerating momentum in its core Search and YouTube franchises. We continue to view Alphabet as among the best-positioned secular growth franchises in the market. NVDA shares advanced during the quarter after once again reporting blowout results that exceeded even elevated expectations.",Seeking Alpha,"Wed, 12 Nov 2025 20:00:00 -0500",['paylimitwall'],GOOGL
https://www.pymnts.com/google/2025/eu-reportedly-investigating-google-over-alleged-demotion-of-news-publishers/?utm_source=snapi,EU Reportedly Investigating Google Over Alleged Demotion of News Publishers,"Two unnamed officials told The Financial Times that the European Commission, the EU's antitrust watchdog, is preparing to launch a new investigation into Google's parent company, Alphabet.",PYMNTS,"Wed, 12 Nov 2025 16:51:17 -0500",[],GOOGL
https://www.marketwatch.com/story/waymos-driverless-cars-are-headed-to-the-highways-in-a-milestone-for-the-industry-a3d06bd0,Waymo's driverless cars are headed to the highways — in a milestone for the industry,The robotaxi startup will be the first in the U.S. to offer trips on freeways without a safety monitor.,Market Watch,"Wed, 12 Nov 2025 16:18:00 -0500",['paylimitwall'],GOOGL
https://www.cnet.com/tech/services-and-software/apple-to-reportedly-pay-google-1-billion-a-year-for-siris-custom-gemini-ai-model/,Apple to Reportedly Pay Google $1 Billion a Year for Siri's Custom Gemini AI Model,"Apple is choosing Google over Anthropic because of cost, per report.",CNET,"Wed, 12 Nov 2025 13:36:40 -0500",[],GOOGL
https://www.youtube.com/watch?v=5hCP6e3sEFU,Waymo brings paid robotaxi rides to highways,CNBC's Deirdre Bosa joins 'Money Movers' with the latest news on Waymo's expansion onto freeways in California.,CNBC Television,"Wed, 12 Nov 2025 13:02:26 -0500",[],GOOGL
https://www.cnet.com/roadshow/news/waymo-s-driverless-rides-are-hitting-freeways-starting-in-these-cities/,"Waymo's Driverless Rides Are Hitting Freeways, Starting in These Cities","Faster, shorter rides can get passengers to their destinations more quickly. The feature rolls out today and will gradually expand to more customers.",CNET,"Wed, 12 Nov 2025 11:33:42 -0500",[],GOOGL
https://www.reuters.com/business/waymo-launches-robotaxi-freeway-service-san-francisco-la-phoenix-2025-11-12/,"Waymo launches robotaxi freeway service in San Francisco, LA, Phoenix","Alphabet's Waymo said on Wednesday it will begin offering robotaxi rides that use freeways across San Francisco, Los Angeles, and Phoenix, as it steps up expansion amid competition in the self-driving industry.",Reuters,"Wed, 12 Nov 2025 11:02:43 -0500",[],GOOGL
https://www.cnbc.com/2025/11/12/waymo-robotaxi-starts-freeway-highway-rides.html,"Waymo begins offering freeway robotaxi rides in San Francisco, LA and Phoenix","Waymo robotaxis will now take passengers on freeways in three major U.S. cities, marking a major milestone for the driverless, ride-hailing company. The company said it'll begin offering those types of trips in the San Francisco, Phoenix and the Los Angeles markets ""when a freeway route is meaningfully faster.",CNBC,"Wed, 12 Nov 2025 11:00:01 -0500",[],GOOGL
https://www.businessinsider.com/waymo-freeway-rides-expands-bay-area-coverage-how-many-robotaxis-2025-11,Waymo just added freeway rides. It shaved 15 minutes off my robotaxi commute.,"Waymo will begin freeway rides for some users in SF, LA, and Phoenix on Wednesday. The company is also expanding its fleet to over 1,000 robotaxis for the Bay Area region.",Business Insider,"Wed, 12 Nov 2025 11:00:01 -0500",['paywall'],GOOGL
https://techcrunch.com/2025/11/12/waymo-robotaxis-are-now-giving-rides-on-freeways-in-these-3-cities/,"Waymo robotaxis are now giving rides on freeways in LA, San Francisco, and Phoenix","Sixteen years ago, engineers working on the Google self-driving project conducted their first autonomous vehicle tests on the freeway that connects Silicon Valley to San Francisco.",TechCrunch,"Wed, 12 Nov 2025 11:00:00 -0500",[],GOOGL
https://seekingalpha.com/article/4842383-wall-street-breakfast-podcast-gm-targets-china-free-supply-chain,Wall Street Breakfast Podcast: GM Targets China-Free Supply Chain,"General Motors (GM) is reportedly pushing suppliers to eliminate China-sourced components, aiming for a complete supply chain shift away from China by 2027. AMD (AMD) projects the AI data center market to reach $1 trillion by 2030, citing unprecedented demand and strong gross margin guidance.",Seeking Alpha,"Wed, 12 Nov 2025 07:01:51 -0500","['podcast', 'paylimitwall']",GOOGL
https://www.fool.com/investing/2025/11/12/the-best-stocks-to-buy-with-1000-right-now/,"The Best Stocks to Buy With $1,000 Right Now",Nvidia has a massive backlog of chip demand it must churn through. Taiwan Semiconductor will be supplying chips to nearly every competitor in the AI race.,The Motley Fool,"Wed, 12 Nov 2025 07:00:00 -0500",['StocksToWatch'],GOOGL
https://seekingalpha.com/article/4842350-alphabet-google-cloud-is-a-force-to-be-reckoned-with-upgrade,Alphabet: Google Cloud Is A Force To Be Reckoned With (Upgrade),"Alphabet (GOOG) is upgraded to Buy with a $322 price target, driven by robust Google Cloud growth and AI integration across platforms. Google Cloud backlog surged 46% sequentially, with margin-accretive revenue expansion highlighting economies of scale. Alphabet signed a major deal with Anthropic to deliver over 1 million TPUs as part of a multi-cloud strategy for the AI developer.",Seeking Alpha,"Wed, 12 Nov 2025 05:59:51 -0500",['paylimitwall'],GOOGL
https://seekingalpha.com/article/4842347-oakmark-global-concentrated-strategy-q3-2025-top-contributors-detractors,Oakmark Global Concentrated Strategy Q3 2025 Top Contributors And Detractors,Alibaba Group was a contributor during the quarter. The stock price rose significantly following earnings that reflected rapid Chinese AI growth. Alphabet was a contributor during the quarter. The stock price appreciated following a favorable ruling in the Google Search antitrust case and Q2 earnings that exceeded expectations across the board. Charter Communications was a detractor during the quarter. The broadband leader's stock price declined after it reported weak second-quarter earnings.,Seeking Alpha,"Wed, 12 Nov 2025 05:43:00 -0500",['paylimitwall'],GOOGL
https://www.cnbc.com/2025/11/12/google-e-zpass-usps-text-scam-phishing-suit.html,"Google sues cybercriminal group behind E-ZPass, USPS text phishing scams","Google filed a lawsuit against a cybercriminal group largely based in China that is behind a massive text message phishing operation, or ""smishing."" The organization uses a ""Lighthouse,"" a phishing-as-a-service kit, to steal sensitive financial information by sending fraudulent text messages.",CNBC,"Wed, 12 Nov 2025 05:00:02 -0500",[],GOOGL
https://invezz.com/news/2025/11/12/ai-privacy-breach-google-sued-for-allegedly-letting-gemini-read-private-emails-chats/?utm_source=snapi,"AI privacy breach? Google sued for allegedly letting Gemini read emails, chats","Google is facing a major class-action lawsuit that accuses it of covertly enabling its Gemini AI assistant to monitor private user data across Gmail, Chat and Meet without prior consent or notification.",Invezz,"Wed, 12 Nov 2025 03:50:33 -0500",[],GOOGL
https://www.reuters.com/sustainability/climate-energy/totalenergies-agrees-renewable-power-deal-with-google-ohio-data-centres-2025-11-12/,TotalEnergies agrees renewable power deal with Google for Ohio data centres,French oil major TotalEnergies announced on Wednesday it has signed a 15-year power purchase agreement to supply Google with 1.5 terawatt-hours of certified renewable electricity from its Montpelier solar farm in Ohio.,Reuters,"Wed, 12 Nov 2025 02:43:31 -0500",[],GOOGL
https://seekingalpha.com/article/4842260-alphabet-stock-keeps-delivering-so-deserves-to-keep-spending,"Alphabet: Keeps Delivering, So Deserves To Keep Spending","Alphabet delivered a stellar Q3, beating top- and bottom-line estimates, with Search and Cloud segments showing robust double-digit growth. GOOGL's advancements in AI, including Gemini and ad tools, are driving revenue growth and justifying increased capex to build out AI infrastructure. My LSTM neural network model projects a 20% upside to a $349 price target, supporting a continued BUY rating despite overbought technicals.",Seeking Alpha,"Wed, 12 Nov 2025 00:10:45 -0500",['paylimitwall'],GOOGL
https://www.reuters.com/business/media-telecom/turkcell-google-sign-cooperation-agreement-cloud-technologies-2025-11-12/,"Turkcell, Google sign cooperation agreement on cloud technologies","Turkish telecoms operator Turkcell signed an agreement with Google on Wednesday for strategic cooperation on cloud technologies, the company said in a notice.",Reuters,"Tue, 11 Nov 2025 23:35:24 -0500",[],GOOGL
https://www.youtube.com/watch?v=PNr6-BU_8og,"The Big 3: GOOGL, AAPL, TSM","Jessica Inskip (@jessicainskip) focuses on Big Tech for today's Big 3. She explains how Alphabet's (GOOGL) TPU growth and Google search play into a long-term bull thesis, Apple's (AAPL) ever-changing ecosystem and product diversification, and TSMC's (TSM) cash war chest and role in the center of the A.I.",Schwab Network,"Tue, 11 Nov 2025 12:30:07 -0500",[],GOOGL
https://invezz.com/news/2025/11/11/google-pledges-e5-5b-for-german-cloud-ai-and-office-expansion/?utm_source=snapi,"Google pledges €5.5B for German cloud, AI and office expansion","Alphabet Inc.'s Google said on Tuesday it will invest €5.5 billion ($6.4 billion) in Germany over the next four years, deepening its cloud and artificial-intelligence infrastructure footprint as European governments push for larger domestic data-centre capabilities. The announcement was made in Berlin at an event attended by German federal ministers.",Invezz,"Tue, 11 Nov 2025 12:12:32 -0500",[],GOOGL
https://www.zacks.com/stock/news/2789249/earnings-growth-price-strength-make-alphabet-googl-a-stock-to-watch?cid=CS-STOCKNEWSAPI-FT-tale_of_the_tape|zacks_education_focus_list-2789249,Earnings Growth & Price Strength Make Alphabet (GOOGL) a Stock to Watch,The Zacks Focus List offers investors a way to easily find top-rated stocks and build a winning investment portfolio. Here's why you should take advantage.,Zacks Investment Research,"Tue, 11 Nov 2025 10:31:44 -0500",['earnings'],GOOGL
https://www.reuters.com/sustainability/boards-policy-regulation/google-says-it-will-invest-around-64-billion-cloud-infrastructure-germany-2025-11-11/,Google says it will invest around $6.4 billion in cloud infrastructure in Germany,Alphabet's Google said on Tuesday that it will invest 5.5 billion euros ($6.41 billion) in Germany in the coming years in a push to expand its infrastructure and data centre capacity in Europe's largest economy.,Reuters,"Tue, 11 Nov 2025 10:08:49 -0500",[],GOOGL
https://www.fxempire.com/forecasts/article/amzn-aapl-and-goog-forecast-major-us-stocks-quiet-in-premarket-1560434,"AMZN, AAPL and GOOG Forecast – Major US Stocks Quiet in Premarket","Tech stocks were subdued in pre-market trading on Tuesday. The analyst sees short-term consolidation across Amazon, Apple, and Google but maintains a bullish long-term outlook, viewing any pullbacks as potential buying opportunities.",FXEmpire,"Tue, 11 Nov 2025 08:45:18 -0500",[],GOOGL
https://seekingalpha.com/article/4841810-alphabet-quietly-dominating-ai-one-layer-at-a-time,"Alphabet: Quietly Dominating AI, One Layer At A Time","Alphabet (GOOGL) delivered record Q3 2025 results, with $102B in revenue and $35B in operating income, driven by AI integration across its ecosystem. GOOGL's full-stack AI approach—spanning Gemini, TPUs, Search, YouTube, and Cloud—creates a durable moat and positions it ahead of most tech peers. Google Cloud's 33% YoY growth, expanding margins, and deep enterprise AI adoption highlight its rising competitiveness versus AWS and Azure.",Seeking Alpha,"Tue, 11 Nov 2025 08:35:41 -0500",['paylimitwall'],GOOGL
https://www.reuters.com/sustainability/boards-policy-regulation/google-invest-mid-single-digit-billion-amount-germany-says-industry-source-2025-11-11/,"Google to invest mid-single-digit billion amount in Germany, says industry source","Alphabet's Google will invest a mid-single-digit billion amount in Germany, an industry source told Reuters on Tuesday.",Reuters,"Tue, 11 Nov 2025 05:15:36 -0500",[],GOOGL
https://www.reuters.com/world/asia-pacific/south-korea-delays-decision-googles-request-map-data-transfer-says-ministry-2025-11-11/,"South Korea delays decision on Google's request for map data transfer, says ministry","South Korea said on Tuesday it has delayed a decision on Google's request for permission to export map data, saying it will make a final ruling once the company submits additional documents.",Reuters,"Mon, 10 Nov 2025 23:10:20 -0500",[],GOOGL
https://seekingalpha.com/article/4841607-q3-2025-portfolio-focusing-on-resilience-attractive-valuation-and-sound-capital-allocation,"Q3 2025 Portfolio: Focusing On Resilience, Attractive Valuation And Sound Capital Allocation","GOOG was a top performer following strong core business results and the accelerated adoption of its AI offerings. TEL was a top performer as it is benefiting from AI spending plus delivering stronger margins despite a mixed demand environment in other end markets. Trucking stocks in general, and ODFL specifically, have had challenging performance during the quarter due to the lingering softness in the industrial economy.",Seeking Alpha,"Mon, 10 Nov 2025 19:45:00 -0500",['paylimitwall'],GOOGL
https://www.youtube.com/watch?v=vrzDn-i01PA,"Alphabet is well positioned with AI applications, says GMO's Tom Hancock","Tom Hancock, GMO portfolio manager, joins 'The Exchange' to discuss the recent rally in megacap stocks, Hancock's thoughts on Alphabet and uch more.",CNBC Television,"Mon, 10 Nov 2025 16:19:50 -0500",[],GOOGL
https://www.zacks.com/commentary/2788850/making-sense-of-the-market-s-tech-worries?cid=CS-STOCKNEWSAPI-FT-earnings_preview-2788850,Making Sense of the Market's Tech Worries,"The recent pullback in leading artificial intelligence stocks has rekindled concerns about the group's stock price momentum and market leadership. The absence of economic data due to the government shutdown, at a time of economic vulnerabilities, is adding to market angst.",Zacks Investment Research,"Mon, 10 Nov 2025 15:29:21 -0500",[],GOOGL
https://www.youtube.com/watch?v=y13sN8beOIY,"NextEra Energy CEO on Google partnership: Great opportunity for us, Google and Iowa","John Ketchum, NextEra CEO, joins 'The Exchange' to discuss Google's deal with NextEra Energy, if it'll be accretive to earnings and much more.",CNBC Television,"Mon, 10 Nov 2025 14:22:49 -0500",['CEO'],GOOGL
https://www.cnbc.com/2025/11/10/waymo-announces-new-cfo-steve-fieler.html,Waymo announces new CFO Steve Fieler,Alphabet's self-driving car unit Waymo appointed a new CFO Monday. The company tapped Google finance executive Steve Fieler.,CNBC,"Mon, 10 Nov 2025 13:56:01 -0500",['CFO'],GOOGL
https://www.fool.com/investing/2025/11/10/why-alphabet-stock-popped-today/,Why Alphabet Stock Popped Today,Apple may pay Alphabet $1 billion a year to use Gemini AI to power Siri. Bloomberg reported this news last week -- and then again today.,The Motley Fool,"Mon, 10 Nov 2025 11:47:15 -0500",[],GOOGL
https://www.marketbeat.com/stock-ideas/3-stocks-showing-relative-strength-as-markets-pull-back/?utm_source=snapi,3 Stocks Showing Relative Strength as Markets Pull Back,"The market is starting to show signs of exhaustion this week, just as seasonal weakness begins to weigh on sentiment. Coming into Friday, the popular SPDR S&P 500 ETF Trust NYSEARCA: SPY, a broad market benchmark, was down 1.4%.",MarketBeat,"Mon, 10 Nov 2025 11:41:27 -0500",[],GOOGL
https://seekingalpha.com/article/4841120-alphabet-stock-q3-breakout-here-robust-advertising-cloud-ai-monetization-prospects,Alphabet's Breakout Is Here - Robust Advertising/Cloud/AI Monetization Prospects,"The market finally rewards GOOG's well-diversified Big Tech offerings across advertising monetization (through search and YouTube), AI/ cloud computing, and robo-taxi, amongst others. GOOG continues to maintain its leading market share for search engine/ browser/ streaming end markets, which explains the double digits growth observed in the advertising segment. This is on top of its vertically integrated compute/ TPU/ AI capabilities, allowing Google Cloud to report profitable growth and growing multi-year backlog to $157.7B.",Seeking Alpha,"Mon, 10 Nov 2025 11:15:00 -0500",['paylimitwall'],GOOGL
https://www.reuters.com/sustainability/boards-policy-regulation/critics-call-proposed-changes-landmark-eu-privacy-law-death-by-thousand-cuts-2025-11-10/,Critics call proposed changes to landmark EU privacy law 'death by a thousand cuts',"Privacy activists say proposed changes to Europe's landmark privacy law, including making it easier for Big Tech to harvest Europeans' personal data for AI training, would flout EU case law and gut the legislation.",Reuters,"Mon, 10 Nov 2025 10:04:20 -0500",[],GOOGL
https://www.forbes.com/sites/tylerroush/2025/11/10/nvidia-meta-more-lead-stock-rally-as-shutdown-deal-advances/,"Nvidia, Meta, More Lead Stock Rally As Shutdown Deal Advances","Nvidia, Meta and Alphabet headlined a broader market surge Monday after eight Senate Democrats joined Republicans to back a deal that would end the government shutdown, as Americans have expressed growing concerns about its potential impact on the economy.",Forbes,"Mon, 10 Nov 2025 10:00:06 -0500",['paylimitwall'],GOOGL
https://www.cnbc.com/2025/11/10/majestic-labs-meta-google-ai-funding.html,"Former Google, Meta executives raise $100 million for high-capacity AI servers startup","Three former Meta and Google silicon executives on Monday announced they've raised $100 million to build technology they say will reduce cloud companies' spend on data center buildouts. Majestic Labs makes patent-pending server architecture that promises more memory capacity than is on the market today, according to the company.",CNBC,"Mon, 10 Nov 2025 09:00:01 -0500",[],GOOGL
https://247wallst.com/investing/2025/11/10/here-are-mondays-top-wall-street-analyst-research-calls-advanced-micro-devices-alphabet-apple-eli-lilly-carmax-hubspot-and-more/?utm_source=snapi,"Here Are Monday's Top Wall Street Analyst Research Calls: Advanced Micro Devices, Alphabet, Apple, Eli Lilly, CarMax, HubSpot, and More","The futures are trading higher as the new week begins, with most investors and traders relieved that last week has come to a close.",24/7 Wall Street,"Mon, 10 Nov 2025 08:11:02 -0500",['manda'],GOOGL
https://www.fool.com/investing/2025/11/10/3-cheap-tech-stocks-to-buy-right-now/,3 Cheap Tech Stocks to Buy Right Now,Investors seem to appreciate the AI-driven potential of Google parent Alphabet. Increasing saturation in the social media space is driving a more AI-oriented focus for Meta Platforms.,The Motley Fool,"Mon, 10 Nov 2025 08:05:00 -0500",['StocksToWatch'],GOOGL
https://www.fool.com/investing/2025/11/10/think-late-buy-google-stock-reason-still-time/,Think It's Too Late to Buy Alphabet (Google) Stock? Here's the 1 Reason Why There's Still Time.,"Alphabet's stock has surged 47% year to date, outperforming the Nasdaq Composite. Alphabet is successfully monetizing its AI technology across consumer apps and its Google Cloud business.",The Motley Fool,"Mon, 10 Nov 2025 06:46:00 -0500",[],GOOGL
https://seekingalpha.com/article/4841209-alphabet-can-still-thrive-even-in-the-era-of-chatgpt,"Alphabet Can Still Thrive, Even In The Era Of ChatGPT (Rating Downgrade)","Alphabet (GOOG, GOOGL) has delivered stellar returns, driven by robust growth in Google Cloud and broad-based revenue expansion. Despite strong fundamentals, GOOG's valuation has become less attractive, prompting a downgrade from 'strong buy' to 'hold.' Risks are emerging from competitors like OpenAI's ChatGPT, but Alphabet's entrenched market position and innovation remain strengths.",Seeking Alpha,"Mon, 10 Nov 2025 06:11:38 -0500",['paylimitwall'],GOOGL
https://www.fool.com/investing/2025/11/10/got-500-2-top-growth-stocks-to-buy-that-could-doub/,Got $500? 2 Top Growth Stocks to Buy That Could Double Your Money,Alphabet's Google and Meta Platforms are two growth stocks with the potential to double in value in the next five years. These companies serve billions of users across their services every day.,The Motley Fool,"Mon, 10 Nov 2025 06:00:00 -0500",['StocksToWatch'],GOOGL
https://www.fool.com/investing/2025/11/10/3-technology-buys-that-wall-street-loves/,3 Technology Buys That Wall Street Loves,Wall Street analysts advise buying these stocks and expecting them to climb in the coming 12 months. These companies are key players in the artificial intelligence market.,The Motley Fool,"Mon, 10 Nov 2025 05:15:00 -0500",[],GOOGL
https://seekingalpha.com/article/4841174-alphabet-ai-supercycle-powered-by-cloud-capex-and-tpus,"Alphabet: AI Supercycle Powered By Cloud, CapEx, And TPUs","Google Cloud is the pillar of my bull case: Q3 revenue $15.16B (up 34% YoY), $3.59B operating income (23.7% margin), with $155B backlog (up 46% sequentially). I see strong AI-led momentum, with GCP products growing faster than the total Cloud segment, mainly driven by the adoption of enterprise AI products. Ironwood (Gen-7 TPU) should soon be GA. In my view, it could credibly compete in large-scale inference, with validation from Anthropic's expanded access to up to 1M TPUs.",Seeking Alpha,"Mon, 10 Nov 2025 04:56:34 -0500",['paylimitwall'],GOOGL
https://www.fool.com/investing/2025/11/10/want-to-invest-in-quantum-computing-3-stocks-that/,Want to Invest in Quantum Computing? 3 Stocks That Are Great Buys Right Now,Alphabet's Google Quantum AI achieved quantum advantage with its Willow quantum chip last month. Amazon thinks its technology can dramatically lower the costs of quantum error correction.,The Motley Fool,"Mon, 10 Nov 2025 04:44:00 -0500",[],GOOGL
https://www.fool.com/investing/2025/11/10/could-buying-stock-today-set-you-up-for-life/,Could Buying Alphabet Today Set You Up for Life?,Alphabet has already produced life-changing returns. The company's multiple growth avenues and strong moat mean it can do so again.,The Motley Fool,"Mon, 10 Nov 2025 04:06:00 -0500",[],GOOGL
https://seekingalpha.com/article/4841063-first-eagle-us-fund-q3-2025-portfolio-review,First Eagle U.S. Fund Q3 2025 Portfolio Review,"First Eagle U.S. Fund A Shares (without sales charge*) posted a return of 7.55% in third quarter 2025. Materials and industrials were the leading contributors among equity sectors, while consumer staples detracted and real estate was flattish. The gold price continued to set new record nominal highs during the quarter.",Seeking Alpha,"Sun, 09 Nov 2025 14:01:00 -0500",['paylimitwall'],GOOGL
https://seekingalpha.com/article/4841060-virtus-sga-global-growth-q3-2025-contributors-and-detractors,Virtus SGA Global Growth Q3 2025 Contributors And Detractors,"Nvidia was a contributor to the portfolio's performance again in Q3, driven by continued surging demand for accelerated computing and AI infrastructure. Chipotle was a detractor during the quarter as its comparable sales growth fell just 1% short of consensus (declining 4% against a very tough 11% comparison in the year ago period). Intuit was a detractor from performance during the quarter as cautious guidance for FY 2026 led to investor disappointment, despite strong fiscal-year (July) results.",Seeking Alpha,"Sun, 09 Nov 2025 13:11:00 -0500",['paylimitwall'],GOOGL
https://finbold.com/google-to-pay-dividends-on-december-15-heres-how-much-100-googl-shares-will-earn/?utm_source=snapi,Google to pay dividends on December 15; Here's how much $100 GOOGL shares will earn,"Alphabet (NASDAQ: GOOGL), the parent company of Google, is set to reward investors with dividends, with the next payout scheduled for December 15, 2025.",Finbold,"Sun, 09 Nov 2025 09:02:24 -0500",['dividend'],GOOGL
https://www.fool.com/investing/2025/11/09/the-top-cloud-stock-for-ai-investors-to-buy-before/,The Top Cloud Stock for AI Investors to Buy Before It Surges 20%,Alphabet's Google Cloud saw revenue jump 33% in the last year. Its backlog rose 46% to $155 billion.,The Motley Fool,"Sun, 09 Nov 2025 08:25:00 -0500",[],GOOGL
https://www.cnbc.com/2025/11/09/top-wall-street-analysts-favor-3-tech-stocks-for-their-growth-outlook.html,Top Wall Street analysts favor these 3 tech stocks for their growth outlook,"TipRanks' ranking service discusses three stocks that are favored by Wall Street, including Amazon and Alphabet.",CNBC,"Sun, 09 Nov 2025 07:28:05 -0500",[],GOOGL
https://www.fool.com/investing/2025/11/09/googles-latest-ai-chip-puts-the-focus-on-inference/,Google's Latest AI Chip Puts the Focus on Inference,Google expects an explosion in demand for AI inference computing capacity. The company's new Ironwood TPUs are designed to be fast and efficient for AI inference workloads.,The Motley Fool,"Sun, 09 Nov 2025 06:42:00 -0500",[],GOOGL
https://www.fool.com/investing/2025/11/09/nasdaq-will-soar-in-2026-my-top-ai-stocks/,History Says the Nasdaq Will Soar in 2026: My Top 10 Artificial Intelligence (AI) Growth Stocks to Buy Before It Does,"The Nasdaq Composite bull market continued in 2025, but history suggests there's additional upside ahead. Businesses are developing new applications for generative AI, and demand continues to climb.",The Motley Fool,"Sun, 09 Nov 2025 03:01:00 -0500",['StocksToWatch'],GOOGL
