news_url,title,text,source_name,date,topics,tickers
https://www.fool.com/investing/2025/11/11/nov-19-will-be-a-big-day-for-nvidia-should-you-buy/,Nov. 19 Will Be a Big Day for Nvidia. Should You Buy or Sell the Stock Now?,"Nvidia has confirmed its dominance as the AI chip leader. Other tech giants, in recent earnings reports, have spoken of ongoing strong demand for AI products and services.",The Motley Fool,"Tue, 11 Nov 2025 20:10:00 -0500",[],NVDA
https://www.cnbc.com/2025/11/12/softbank-shares-plunge-as-much-as-10percent-after-selling-nvidia-stake.html,SoftBank shares plunge as much as 10% after selling Nvidia stake,"In its earnings report, SoftBank said it sold 32.1 million Nvidia shares in October. While the decision to unload Nvidia shares may have caught some investors off guard, it isn't SoftBank's first exit from the U.S. chip heavyweight.",CNBC,"Tue, 11 Nov 2025 19:58:07 -0500",[],NVDA
https://www.zacks.com/stock/news/2789603/nvidia-nvda-stock-slides-as-market-rises-facts-to-know-before-you-trade?cid=CS-STOCKNEWSAPI-FT-tale_of_the_tape|yseop_template_6-2789603,Nvidia (NVDA) Stock Slides as Market Rises: Facts to Know Before You Trade,"In the closing of the recent trading day, Nvidia (NVDA) stood at $193.16, denoting a -2.96% move from the preceding trading day.",Zacks Investment Research,"Tue, 11 Nov 2025 18:46:06 -0500",[],NVDA
https://www.investopedia.com/s-and-p-500-gains-and-losses-today-chip-stocks-slide-as-softbank-sells-nvidia-stake-paramount-skydance-pops-11847441,S&P 500 Gains & Losses Today: Chip Stocks Slide as SoftBank Sells Nvidia Stake; Paramount Skydance Pops,"Semiconductor stocks came under pressure Tuesday as a major investor sold its stake in Nvidia, the world's most valuable company. Meanwhile, shares of a media and entertainment giant pushed higher after the company boosted cost-savings targets and discussed heavy investment plans.",Investopedia,"Tue, 11 Nov 2025 17:35:36 -0500",['manda'],NVDA
https://www.schaeffersresearch.com/content/news/2025/11/11/3-chip-stocks-sinking-alongside-nvidia-lrcx-mrvl-wdc,"3 Chip Stocks Sinking Alongside Nvidia: LRCX, MRVL, WDC",Big Tech has seen plenty of volatility recently amid  AI overvaluation concerns.,Schaeffers Research,"Tue, 11 Nov 2025 15:07:00 -0500",[],NVDA
https://www.youtube.com/watch?v=npQJ-FhkYv8,"SoftBank's Nvidia exit fuels OpenAI push despite mounting losses, stiff competition from Anthropic",CNBC's MacKenzie Sigalos reports on news regarding OpenAI.,CNBC Television,"Tue, 11 Nov 2025 15:00:28 -0500",[],NVDA
https://techcrunch.com/2025/11/11/softbanks-nvidia-sale-rattles-market-raises-questions/,"SoftBank's Nvidia sale rattles market, raises questions","Masayoshi Son isn't known for half measures. The SoftBank founder's career has been studded with brow-raising bets, each one seemingly more outrageous than the last.",TechCrunch,"Tue, 11 Nov 2025 14:52:31 -0500",[],NVDA
https://www.marketbeat.com/originals/softbank-exits-nvidiaso-what-analysts-still-see-more-upside/?utm_source=snapi,SoftBank Exits NVIDIA—So What? Analysts Still See More Upside,"NVIDIA NASDAQ: NVDA made headlines again with a major backer exiting its stake. However, as newsworthy as it is, it is ultimately a so-what moment for the stock's price.",MarketBeat,"Tue, 11 Nov 2025 14:02:02 -0500",[],NVDA
https://seekingalpha.com/article/4841995-recent-ipo-earnings-focus-final-peak-week-q3-season,Recent IPO Earnings In Focus The Final Peak Week Of The Q3 Season,"Q3 Earnings growth continues to improve, with 91% of constituents reporting thus far, S&P 500® EPS growth for Q3 2025 accelerated to 13.1%. This week we get results from an onslaught of recent IPOs such as Gemini Space Station, Via Transportation, Figure Technology, StubHub and more. This marks the final peak week of the Q3 earnings season with 2,697 companies set to release results.",Seeking Alpha,"Tue, 11 Nov 2025 14:01:00 -0500","['earnings', 'paylimitwall']",NVDA
https://www.youtube.com/watch?v=tK0gox4MA2c,"AI trade in focus on Wall Street as SoftBank sells Nvidia stake, AMD Investor Day preview","Market Catalysts anchor Julie Hyman breaks down the latest financial news for November 11, 2025. Can the AI trade continue to make money?",Yahoo Finance,"Tue, 11 Nov 2025 13:38:35 -0500",[],NVDA
https://www.investopedia.com/softbank-says-it-sold-its-nvidia-stake-the-chip-stock-is-sliding-11847319,SoftBank Says It Sold Its Entire Nvidia Stake. The Chip Stock is Sliding.,SoftBank is out of Nvidia stock—but not the AI trade.,Investopedia,"Tue, 11 Nov 2025 13:35:50 -0500",[],NVDA
https://nypost.com/2025/11/11/business/softbank-sells-entire-5-8b-nvidia-stake-as-it-goes-all-in-on-openai-bet/,Softbank sells entire $5.8B Nvidia stake as it goes ‘all in' on OpenAI bet,Softbank has dumped its entire $5.83 billion stake in AI chip supplier Nvidia as it pours more resources into its “all-in” bet on Sam Altman's OpenAI.,New York Post,"Tue, 11 Nov 2025 13:11:34 -0500",[],NVDA
https://www.youtube.com/watch?v=B5U05mgItl4,Wells Fargo's Scott Wren: Here's how we're playing AI without leaning so hard into tech,"Scott Wren, Wells Fargo Investment Institute senior global market strategist, joins CNBC's 'Money Movers' to discuss how he's thinking about the AI trade, broader market outlooks, and much more.",CNBC Television,"Tue, 11 Nov 2025 12:57:02 -0500",[],NVDA
https://www.youtube.com/watch?v=KNNvMTq967k,Nvidia Shares Drop After SoftBank Sells Stake,SoftBank sold its entire stake in Nvidia for $5.83 billion to help bankroll AI investments. Nvidia shares fell on the news.,Bloomberg Technology,"Tue, 11 Nov 2025 12:10:34 -0500",[],NVDA
https://www.theguardian.com/business/2025/nov/11/softbank-sells-stake-in-nvidia-as-it-doubles-down-on-openai-bets,SoftBank sells stake in Nvidia for $5.8bn as it doubles down on OpenAI bets,"Shares in chipmaker Nvidia fall after announcement by Japanese investor, with other tech shares also slipping",The Guardian,"Tue, 11 Nov 2025 11:44:33 -0500",[],NVDA
https://www.nytimes.com/2025/11/11/business/dealbook/softbank-nvidia-divest.html,SoftBank Sells $5.8 Billion Stake in Nvidia to Pay for OpenAI Deals,The move has further stoked concerns among some investors that the rally in artificial intelligence stocks was overdone.,NYTimes,"Tue, 11 Nov 2025 11:40:31 -0500",['paywall'],NVDA
https://www.youtube.com/watch?v=g0bBVUhgbVk,CoreWeave Tumbles on Q3 Results; Nvidia Slips After SoftBank Stake Sale | Stock Movers,"On this episode of Stock Movers with Lisa Mateo: - Shares of Nvidia (NVDA) slipped in the premarket session after SoftBank Group sold the entirety of its stake of the chipmaking giant for $5.83 billion to help bankroll AI investments, even as investors question the amount of capital pouring into a technology with uncertain returns. The Nvidia stake sale highlights how founder Masayoshi Son needs money to chase a plethora of projects that range from Stargate data centers to AI robot manufacturing sites in the US.",Bloomberg Markets and Finance,"Tue, 11 Nov 2025 11:26:35 -0500",['earnings'],NVDA
https://www.youtube.com/watch?v=jlE6P5_JTNw,"Softbank sells entire stake in Nvidia, the health of the AI trade, flight cancellations mount","Morning Brief anchor Julie Hyman breaks down the latest market news for November 11, 2025. SoftBank sells off its entire stake in Nvidia stock for $5.8 billion.",Yahoo Finance,"Tue, 11 Nov 2025 11:02:18 -0500",[],NVDA
https://www.businessinsider.com/softbank-nvidia-openai-masayoshi-son-sam-altman-bubble-ai-stock2025-11,SoftBank just sold the world's hottest AI stock — so it can buy more AI,Who sells Nvidia stock in 2025? SoftBank CEO Masayoshi Son just did.,Business Insider,"Tue, 11 Nov 2025 10:40:57 -0500",['paywall'],NVDA
https://www.zacks.com/stock/news/2789220/nvidia-nvda-crossed-above-the-20-day-moving-average-what-that-means-for-investors?cid=CS-STOCKNEWSAPI-FT-tale_of_the_tape|20_day_moving_average_(yseop)-2789220,Nvidia (NVDA) Crossed Above the 20-Day Moving Average: What That Means for Investors,"Nvidia (NVDA) reached a significant support level, and could be a good pick for investors from a technical perspective. Recently, NVDA broke through the 20-day moving average, which suggests a short-term bullish trend.",Zacks Investment Research,"Tue, 11 Nov 2025 10:35:30 -0500",['tanalysis'],NVDA
https://invezz.com/news/2025/11/11/nvidia-stock-slip-after-softbank-sells-5-83b-stake-to-fund-openai-bet/?utm_source=snapi,Nvidia stock slip after SoftBank sells $5.83B stake to fund OpenAI bet,"Nvidia shares slipped early Tuesday after Japan's SoftBank Group disclosed it had sold its entire stake in the chipmaker for $5.83 billion in October. The stock fell 2.3% to $194.43 on Tuesday morning, following a 5.8% gain the previous day amid optimism surrounding the end of the US government shutdown.",Invezz,"Tue, 11 Nov 2025 10:06:46 -0500",[],NVDA
https://www.forbes.com/sites/greatspeculations/2025/11/11/nvidia-stock-to-260/,Nvidia Stock To $260?,NVDA stock has risen by 5.8% over the past day and is presently trading at $199.05. The gains come as both the S&P 500 and Nasdaq indices soared on Monday as Congress takes a big step toward ending the record-breaking government shutdown that had raised concerns about the U.S. economy.,Forbes,"Tue, 11 Nov 2025 09:50:17 -0500",['paylimitwall'],NVDA
https://seekingalpha.com/article/4841840-nvidia-global-alliances-are-a-potential-liberation-from-us-ai-cycles,Nvidia: Global Alliances Are A Potential 'Liberation' From U.S. AI Cycles,"Nvidia Corporation and Palantir Technologies Inc. face short-term vulnerability from energy and capex bottlenecks, though AI's long-term growth remains structurally unstoppable. Burry's NVDA/PLTR puts and HAL calls reflect a macro hedge on power scarcity—shorting AI exuberance while favoring energy cyclicals. Hedge near-term grid constraints, but stay long AI; global data-center alliances can neutralize cyclical risk and sustain secular growth.",Seeking Alpha,"Tue, 11 Nov 2025 09:46:45 -0500",['paylimitwall'],NVDA
https://247wallst.com/investing/2025/11/11/wall-street-loves-nike-nvidia-and-instacart/?utm_source=snapi,"Wall Street Loves Nike, NVIDIA and Instacart","Instacart (NASDAQ: CART): BMO analysts just upgraded the stock following earnings, noting Instacart continues to deepen its integration of AI technologies in tools for retail partners and enterprises.",24/7 Wall Street,"Tue, 11 Nov 2025 09:41:36 -0500",[],NVDA
https://www.reuters.com/business/media-telecom/softbanks-58-billion-nvidia-stake-sale-stirs-fresh-ai-bubble-fears-2025-11-11/,SoftBank's $5.8 billion Nvidia stake sale stirs fresh AI bubble fears,"SoftBank Group's $5.8 billion sale of its Nvidia stake jolted stock markets on Tuesday, stoking fears that the frenzy around artificial intelligence may have peaked, especially after recent warnings from Wall Street bank chiefs and a famed short seller.",Reuters,"Tue, 11 Nov 2025 09:26:52 -0500",[],NVDA
https://www.forbes.com/sites/tylerroush/2025/11/11/nvidia-shares-dip-2-after-softbank-sells-entire-stake/,Nvidia Shares Dip 2% After SoftBank Sells Entire Stake,This is a developing story.,Forbes,"Tue, 11 Nov 2025 08:50:03 -0500",['paylimitwall'],NVDA
https://www.proactiveinvestors.com/companies/news/1082257?SNAPI,SoftBank sells entire Nvidia stake for $5.8B to fund expanding AI investments,"Nvidia Corp (NASDAQ:NVDA, ETR:NVD) shares traded almost 2% lower before Tuesday's opening bell after it was revealed SoftBank sold its entire stake in the chipmaker for $5.83 billion. The Japanese conglomerate disclosed in its earnings statement that it sold 32.1 million Nvidia shares in October, alongside the sale of part of its stake in T-Mobile for $9.17 billion.",Proactive Investors,"Tue, 11 Nov 2025 08:44:24 -0500",[],NVDA
https://invezz.com/news/2025/11/11/why-analysts-are-flagging-nvidia-palantir-big-ai-winners-as-sell-heres-what-to-know/?utm_source=snapi,Why analysts are flagging these two big AI winners as ‘Sell': here's what to know,"Wall Street's most bullish AI darlings are facing a sudden credibility crisis. Despite stellar earnings and record growth, analysts at major brokerages are sounding the alarm on two mega-cap tech giants: Palantir and Nvidia.",Invezz,"Tue, 11 Nov 2025 08:39:28 -0500",[],NVDA
https://www.barrons.com/articles/softbank-openai-nvidia-stake-ai-5036b58b,Why SoftBank Is Ditching Nvidia for ChatGPT,SoftBank Group has decided to sell its stake in the chip maker in order to fuel an even bigger bet on OpenAI.,Barrons,"Tue, 11 Nov 2025 08:20:00 -0500",['paywall'],NVDA
https://www.cnbc.com/2025/11/11/5-things-to-know-before-the-stock-market-opens.html,"Paramount cuts costs, SoftBank sells its Nvidia stake, Warren Buffett's new tradition and more in Morning Squawk","The stock market rebounded after the Senate approved a deal to end the government shutdown. Paramount Skydance announced more plans to cut costs, lay off staff and increase streaming prices.",CNBC,"Tue, 11 Nov 2025 08:07:46 -0500",['wbuffett'],NVDA
https://247wallst.com/investing/2025/11/11/here-are-tuesdays-top-wall-street-analyst-research-calls-coreweave-instacart-qorvo-robinhood-markets-skyworks-solutions-viasat-and-more/?utm_source=snapi,"Here are Tuesday's Top Wall Street Analyst Research Calls: Coreweave, Instacart, Qorvo, Robinhood Markets, Skyworks Solutions, Viasat and More","The futures are trading mixed after a massive bounce-back rally on Monday across Wall Street, which saw all the major indices trade higher, with the NASDAQ closing up 2.27% at 23,554.",24/7 Wall Street,"Tue, 11 Nov 2025 08:06:46 -0500",['manda'],NVDA
https://www.investors.com/etfs-and-funds/sectors/sp500-dreaded-ai-bust-is-here-wipes-out-stock-value/,Dreaded AI Bust Is Here — Wipes Out $1.1 Trillion In Stock Value,Investors have worried when the music would stop for AI stocks in the S&P 500. It's looking like it already did.,Investors Business Daily,"Tue, 11 Nov 2025 08:00:33 -0500",[],NVDA
https://247wallst.com/forecasts/2025/11/11/nvidia-nvda-price-prediction-and-forecast/?utm_source=snapi,NVIDIA (NASDAQ: NVDA) Price Prediction and Forecast 2025-2030 for November 11,Shares of NVIDIA Corp. (NASDAQ:NVDA) lost 1.87% over the past five trading sessions after gaining 7.16%% the five prior.,24/7 Wall Street,"Tue, 11 Nov 2025 08:00:23 -0500",[],NVDA
https://seekingalpha.com/article/4841795-wall-street-breakfast-podcast-dream-home-lifetime-loan,"Wall Street Breakfast Podcast: Dream Home, Lifetime Loan","The Trump administration proposes 50-year mortgages to lower monthly payments, but risks higher interest costs and slower equity growth for homebuyers. SoftBank (OTCPK:SFTBY) sold its entire Nvidia (NVDA) stake for $5.8B, but remains exposed to AI through holdings in ARM and TSM.",Seeking Alpha,"Tue, 11 Nov 2025 07:01:36 -0500","['podcast', 'paylimitwall']",NVDA
https://247wallst.com/technology-3/2025/11/11/softbank-dumps-100-of-nvidia-shares/?utm_source=snapi,Softbank Dumps 100% of Nvidia Shares,"Softbank, the Japanese tech holding company run by legendary Masayoshi Son, sold 100% of its Nvidia Corp.",24/7 Wall Street,"Tue, 11 Nov 2025 06:40:36 -0500",[],NVDA
https://finbold.com/this-nvidia-stock-just-crashed-10/?utm_source=snapi,This Nvidia stock just crashed 10%,"CoreWeave (NASDAQ: CRWV), an  artificial intelligence (AI) infrastructure provider closely backed by Nvidia (NASDAQ: NVDA), saw its stock tumble nearly 10% in pre-market trading on Tuesday.",Finbold,"Tue, 11 Nov 2025 06:28:57 -0500",[],NVDA
https://finbold.com/this-company-just-dumped-5-8-billion-of-nvidia-stock/?utm_source=snapi,This company just dumped $5.8 billion of Nvidia stock,"SoftBank, a Japanese investment holding company, has fully backed out of its Nvidia (NASDAQ: NVDA) stake, selling 32.1 million shares for $5.83 billion.",Finbold,"Tue, 11 Nov 2025 06:26:14 -0500",[],NVDA
https://www.marketwatch.com/story/softbank-fully-cashed-out-its-nvidia-stake-for-an-even-bigger-ai-bet-aaffeaa5,SoftBank fully cashed out its Nvidia stake for an even bigger AI bet,"SoftBank Group , owned by the richest man in Japan, Masayoshi Son, revealed on Tuesday it had sold its entire stake in Nvidia last month — for an even bigger bet on artificial intelligence.",Market Watch,"Tue, 11 Nov 2025 06:15:00 -0500",['paylimitwall'],NVDA
https://www.youtube.com/watch?v=jdppl_nEsiQ,SoftBank Sells Nvidia Stake for $5.8 Billion to Fund AI Bets,"SoftBank sold its entire stake in Nvidia, pocketing $5.83 billion to help bankroll envisioned AI investments at a time investors are questioning the sheer amounts of capital chasing a technology with uncertain future returns. The stake sale highlights how founder Masayoshi Son needs money to chase a plethora of projects that range from Stargate data centers to AI robot manufacturing sites in the US.",Bloomberg Markets and Finance,"Tue, 11 Nov 2025 05:43:12 -0500",[],NVDA
https://www.barrons.com/articles/nvidia-stock-price-sell-stake-896790f3,Nvidia Stock Slips. This Big Investor Sold Its Stake in the AI Chip Maker.,The sale comes in the run up to Nvidia's earnings on Nov. 19,Barrons,"Tue, 11 Nov 2025 05:41:00 -0500",['paywall'],NVDA
https://www.fool.com/investing/2025/11/11/buy-apple-microsoft-nvidia-vanguard-tech-etf/,Apple and Microsoft Join Nvidia in the $4 Trillion Club. Here's How You Can Buy All 3 Growth Stocks for as Little as $1.,"Vanguard's dollar-based approach allows investors to buy ETFs for a specific dollar amount rather than having to purchase whole shares. The Vanguard Information Technology ETF has crushed the Nasdaq Composite and S&P 500 over the last three-, five-, and 10-year periods.",The Motley Fool,"Tue, 11 Nov 2025 05:20:00 -0500",[],NVDA
https://invezz.com/news/2025/11/11/softbank-posts-16-6-bn-profit-as-openai-bet-pays-off-sells-nvidia-stake-for-5-83-bn/?utm_source=snapi,"SoftBank posts $16.6B profit on OpenAI gains, sells $5.83B worth of Nvidia shares","SoftBank Group Corp. reported a net profit of 2.5 trillion yen ($16.6 billion) for the July–September quarter, its third consecutive profitable period, driven by a surge in the value of its Vision Fund investments. Separately, the company also said it has sold its entire stake or 32.1 million shares in Nvidia for $5.83 billion.",Invezz,"Tue, 11 Nov 2025 03:10:45 -0500",['earnings'],NVDA
https://www.cnbc.com/2025/11/11/softbank-sells-its-entire-stake-in-nvidia-for-5point83-billion.html,SoftBank sells its entire stake in Nvidia for $5.83 billion,The Japanese conglomerate said Tuesday it sold 32.1 million shares of Nvidia in October.,CNBC,"Tue, 11 Nov 2025 02:25:49 -0500",[],NVDA
https://www.fool.com/investing/2025/11/10/where-will-nvidia-stock-be-in-5-years/,Where Will Nvidia Stock Be in 5 Years?,"The AI industry is booming as tech giants continue to pour billions into Nvidia's cutting-edge hardware. Despite its size, the company's valuation remains reasonable, considering its incredible growth rate.",The Motley Fool,"Mon, 10 Nov 2025 21:00:00 -0500",[],NVDA
https://www.zacks.com/stock/news/2788952/big-bounceback-trading-day-for-ai-tech?cid=CS-STOCKNEWSAPI-FT-ahead_of_wall_street-2788952,Big Bounceback Trading Day for AI & Tech,"This was the best single-day of trading on the Nasdaq since May, led by chipmakers generally and the AI infrastructure trade more specifically.",Zacks Investment Research,"Mon, 10 Nov 2025 19:55:32 -0500",[],NVDA
https://www.fool.com/investing/2025/11/10/nvda-stock-michael-burry-short-puts-ai-stocks/,Prediction: The $500 Billion Reason Nvidia Stock Will Show Bearish Billionaire Michael Burry Who Is Boss,"Last week, the Nasdaq Composite had it worst week since April, sparked by news that billionaire Michael Burry's hedge fund made bearish bets on AI stock darlings Nvidia and Palantir in the third quarter. Burry's name recognition stems in part from his being the subject of the 2015 film ""The Big Short,"" based on a book of the same name.",The Motley Fool,"Mon, 10 Nov 2025 18:00:00 -0500",[],NVDA
https://www.proactiveinvestors.com/companies/news/1082194?SNAPI,Nvidia set to deliver another earnings beat for Q3 despite China headwinds,"Nvidia Corp (NASDAQ:NVDA, ETR:NVD) is set to deliver another earnings beat for the third quarter when the chipmaker reports its latest financial results after US markets close on November 19, according to UBS analysts. Wall Street analysts on average expect revenue of $54.6 billion, representing year-over-year gorwht of about 55%, and earnings per share of $1.23, up 52%.",Proactive Investors,"Mon, 10 Nov 2025 15:24:15 -0500",['earnings'],NVDA
https://www.benzinga.com/analyst-stock-ratings/reiteration/25/11/48761406/nvidia-stock-particularly-compelling-could-see-70-earnings-growth-in-2026-analyst-says?utm_source=snapi,"Nvidia Stock 'Particularly Compelling,' Could See 70% Earnings Growth In 2026, Analyst Says","Bank of America Securities analyst Vivek Arya said skepticism around artificial intelligence (AI) spending is understandable but overstated, calling it a healthy correction within a long-term growth cycle.",Benzinga,"Mon, 10 Nov 2025 13:25:46 -0500","['earnings', 'paywall']",NVDA
https://www.fxempire.com/forecasts/article/nasdaq-100-and-sp-500-nvidia-microsoft-push-tech-sector-up-bullish-rebalancing-across-us-indices-1560293,"Nasdaq 100 and S&P 500: Nvidia, Microsoft Push Tech Sector Up — Bullish Rebalancing Across US Indices","Tech stocks surge as shutdown fears ease. Nasdaq 100 leads US indices higher, fueled by AI optimism and gains in Nvidia, AMD, and Microsoft.",FXEmpire,"Mon, 10 Nov 2025 13:05:06 -0500",[],NVDA
https://247wallst.com/investing/2025/11/10/wall-street-is-pounding-the-table-over-nvda-run-lly/?utm_source=snapi,"Wall Street is Pounding the Table Over NVDA, RUN, LLY","In addition, according to analysts at UBS, it sees Nvidia guiding fourth quarter revenue to a range of $63 billion to $64 billion.",24/7 Wall Street,"Mon, 10 Nov 2025 12:45:38 -0500",[],NVDA
https://finbold.com/wall-street-analyst-updates-nvidia-stock-price-ahead-of-q3-earnings/?utm_source=snapi,Wall Street analyst updates Nvidia stock price ahead of Q3 earnings,"Citi has raised its price target on Nvidia (NASDAQ: NVDA) to $220 from $210 while maintaining a ‘Buy' rating, as analyst Atif Malik anticipates strong third-quarter results and higher guidance supported by surging AI-related demand.",Finbold,"Mon, 10 Nov 2025 12:31:16 -0500",[],NVDA
https://www.benzinga.com/analyst-stock-ratings/analyst-color/25/11/48759641/nvidias-1-in-ai-chips-fuels-10-in-tech-growth-palantir-snowflake-mongodb-poised-to-ride-next-ai-growth-wave?utm_source=snapi,"Nvidia's $1 In AI Chips Fuels $10 in Tech Growth, Palantir, Snowflake, MongoDB Poised To Ride Next AI Growth Wave","Wedbush analyst Daniel Ives said the recent turbulence in tech stocks reflects short-term investor anxiety rather than a shift in the long-term artificial intelligence-driven bull market. The analyst noted that despite concerns about an ""AI bubble,"" Palantir Technologies Inc.'s (NASDAQ:PLTR) sharp selloff after stellar earnings, and uncertainty over Nvidia Corp's (NASDAQ:NVDA) China exposure, the sector's underlying fundamentals remain strong.",Benzinga,"Mon, 10 Nov 2025 12:25:22 -0500",['paywall'],NVDA
https://seekingalpha.com/article/4841348-nvidia-earnings-loom-as-smh-flashes-some-bullish-signals-upgrade,NVIDIA Earnings Loom As SMH Flashes Some Bullish Signals (Upgrade),"VanEck Semiconductor ETF is upgraded to a ""Buy,"" reflecting improved valuation and expectations for a year-end rally. SMH's portfolio is heavily weighted toward large-cap semiconductor stocks, with NVDA comprising nearly 20% of assets. Technical analysis shows a constructive outlook, with a long-term breakout and rising 200-day moving average, despite some near-term RSI concerns.",Seeking Alpha,"Mon, 10 Nov 2025 11:46:59 -0500","['earnings', 'paylimitwall']",NVDA
https://invezz.com/news/2025/11/10/nvidia-stock-rebounds-over-3-will-the-rally-sustain/?utm_source=snapi,Nvidia stock rebounds over 3%: will the rally sustain?,Nvidia stock rose early Monday as broader market relief over progress toward ending the US government shutdown combined with renewed optimism surrounding CEO Jensen Huang's meeting with senior executives at Taiwan Semiconductor Manufacturing Co. (TSMC). Nvidia stock up 3.5% at $194.,Invezz,"Mon, 10 Nov 2025 11:32:15 -0500",[],NVDA
https://www.zacks.com/stock/news/2788567/ai-optimism-powers-semiconductor-sales-5-stocks-to-buy-now?cid=CS-STOCKNEWSAPI-FT-analyst_blog|investment_ideas-2788567,AI Optimism Powers Semiconductor Sales: 5 Stocks to Buy Now,"AI-driven demand is fueling a semiconductor surge, with SLAB, ADI, NVDA, ASML and AEIS all poised for strong growth.",Zacks Investment Research,"Mon, 10 Nov 2025 10:45:59 -0500",['StocksToWatch'],NVDA
https://www.marketwatch.com/story/nvidias-stock-has-fallen-due-to-ai-bubble-fears-why-analysts-believe-concerns-are-overblown-d15fec40,Nvidia's stock has fallen due to AI bubble fears. Why analysts believe concerns are overblown.,"Despite recent concerns about the AI trade, demand for Nvidia's products remains as high as ever.",Market Watch,"Mon, 10 Nov 2025 10:32:00 -0500",['paylimitwall'],NVDA
https://www.youtube.com/watch?v=ycM3RjtqDyU,"TSM ""Slower"" Growth Still Holds ""Margin Driver,"" NVDA & Tech Rallies on Shutdown Ending","Kevin Green turns to the big headline taking up the oxygen Monday morning of a potential end to the government shutdown. While the ACA is something he sees remaining a contentious issue, SNAP funding being issued through next September offers a counterbalance of support.",Schwab Network,"Mon, 10 Nov 2025 10:30:51 -0500",[],NVDA
