news_url,title,text,source_name,date,topics,tickers
https://www.zacks.com/stock/news/2788363/nvidia-corporation-nvda-is-a-trending-stock-facts-to-know-before-betting-on-it?cid=CS-STOCKNEWSAPI-FT-tale_of_the_tape|most_searched_stocks-2788363,NVIDIA Corporation (NVDA) Is a Trending Stock: Facts to Know Before Betting on It,"Nvidia (NVDA) has received quite a bit of attention from Zacks.com users lately. Therefore, it is wise to be aware of the facts that can impact the stock's prospects.",Zacks Investment Research,"Mon, 10 Nov 2025 10:00:37 -0500",[],NVDA
https://www.forbes.com/sites/tylerroush/2025/11/10/nvidia-meta-more-lead-stock-rally-as-shutdown-deal-advances/,"Nvidia, Meta, More Lead Stock Rally As Shutdown Deal Advances","Nvidia, Meta and Alphabet headlined a broader market surge Monday after eight Senate Democrats joined Republicans to back a deal that would end the government shutdown, as Americans have expressed growing concerns about its potential impact on the economy.",Forbes,"Mon, 10 Nov 2025 10:00:06 -0500",['paylimitwall'],NVDA
https://www.investors.com/research/nvidia-nvda-stock-ai-earnings/,Nvidia Vaults Higher As Chief Huang Sees Strong AI Demand; Earnings Loom. Is Nvidia A Buy Now?,Nvidia stock jumped on Monday amid hopes of the government shutdown ending. Shares are rebounding from their 50-day line.,Investors Business Daily,"Mon, 10 Nov 2025 09:59:53 -0500","['earnings', 'CEO', 'paywall']",NVDA
https://finbold.com/nvidia-to-pay-dividends-on-december-26-heres-how-much-100-nvda-shares-will-earn/?utm_source=snapi,Nvidia to pay dividends on December 26; Here's how much 100 NVDA shares will earn,"Nvidia (NASDAQ: NVDA) is scheduled to pay its next quarterly dividend on December 26, 2025.",Finbold,"Mon, 10 Nov 2025 09:36:24 -0500",['dividend'],NVDA
https://www.zacks.com/stock/news/2788304/will-data-center-business-help-nvidia-beat-q3-sales-target-of-54b?cid=CS-STOCKNEWSAPI-FT-analyst_blog|quick_take-2788304,Will Data Center Business Help NVIDIA Beat Q3 Sales Target of $54B?,NVDA's surging data center business and booming AI chip demand are likely to aid it in topping Q3 sales expectations of $54 billion.,Zacks Investment Research,"Mon, 10 Nov 2025 09:25:45 -0500",['earnings'],NVDA
https://www.fxempire.com/forecasts/article/nvda-intc-and-amd-forecast-tech-stocks-celebrate-the-government-deal-in-the-usa-1560226,"NVDA, INTC and AMD Forecast – Tech Stocks Celebrate the Government Deal in the USA","U.S. stocks surged on Monday as optimism over a U.S. government reopening boosted risk appetite. Nvidia, Intel, and AMD are all set to gap higher, with strong uptrends intact and pullbacks likely offering renewed buying opportunities.",FXEmpire,"Mon, 10 Nov 2025 09:07:57 -0500",[],NVDA
https://seekingalpha.com/article/4841226-nvidias-q3-poised-for-another-blowout-rating-upgrade,Nvidia's Q3: Poised For Another Blowout (Rating Upgrade),"I'm upgrading Nvidia to a 'Buy' ahead of its Q3 earnings. Despite concerns about AI CAPEX slowdown, major tech companies are increasing spending, and current AI investments remain well below historical peaks, indicating significant growth runway. Nvidia is poised for another double-beating Q3, with conservative guidance and potential for H20 shipments to China, setting a low bar for exceeding market expectations.",Seeking Alpha,"Mon, 10 Nov 2025 09:00:00 -0500",['paylimitwall'],NVDA
https://investorplace.com/2025/11/8-companies-poised-to-soar-from-nvidia-and-openais-100-billion-alliance/,8 Companies Poised to Soar From Nvidia and OpenAI's $100 Billion Alliance,Editor's note: “8 Companies Poised to Soar From Nvidia and OpenAI's $100 Billion Alliance” was previously published in September 2025. It has since been updated to include the most relevant information available.,InvestorPlace,"Mon, 10 Nov 2025 08:55:00 -0500",[],NVDA
https://www.youtube.com/watch?v=XRN5x8Mh7O0,Government Shutdown Closer to End? NVDA A.I. Demand & Reality of 50-Year Mortgages,"Stocks are looking to break a losing streak, and a potential deal to end the government shutdown is giving them a boost. Kevin Green explains why a potential resolution to the shutdown could be just the catalyst the market needs to turn around.",Schwab Network,"Mon, 10 Nov 2025 08:36:38 -0500",[],NVDA
https://www.businesswire.com/news/home/20251110732393/en/vCluster-Labs-Introduces-Infrastructure-Tenancy-Platform-for-AI-to-Maximize-NVIDIA-GPU-Efficiency-on-Kubernetes-Environments/,vCluster Labs Introduces Infrastructure Tenancy Platform for AI to Maximize NVIDIA GPU Efficiency on Kubernetes Environments,"ATLANTA--(BUSINESS WIRE)-- #GPUInfrastructure--(KubeCon + CloudNativeCon North America 2025, Booth #421) — vCluster Labs, the company pioneering Kubernetes virtualization, today announced its Infrastructure Tenancy Platform for AI to help organizations build and operate high-performance AI infrastructure on GPU-focused compute clusters, including support for NVIDIA DGX systems. The company's new Reference Architecture for NVIDIA DGX systems is now available, offering architectural guidance for building secure, scal.",Business Wire,"Mon, 10 Nov 2025 08:00:00 -0500",['PressRelease'],NVDA
https://www.barrons.com/articles/nvidia-stock-price-today-ai-chips-4b05c87b,"Nvidia Stock Rebounds. How Shutdown Hopes, TSMC Are Boosting the AI Chip Maker.","Nvidia stock was rebounding, having fallen about 9% over the past five trading sessions.",Barrons,"Mon, 10 Nov 2025 06:45:00 -0500",['paywall'],NVDA
https://www.marketwatch.com/story/nvidias-jensen-huang-wants-wants-a-lot-more-production-from-taiwan-semi-heres-what-that-means-for-the-ai-story-7a04b3bd,Nvidia's Jensen Huang wants wants a lot more production from Taiwan Semi. Here's what that means for the AI story.,Shares of Taiwan Semi are climbing as tech stock rise and customer Nvidia is apparently demanding lots more of its wafers.,Market Watch,"Mon, 10 Nov 2025 05:56:00 -0500","['CEO', 'paylimitwall']",NVDA
https://www.benzinga.com/markets/equities/25/11/48746501/stock-market-today-sp-500-nasdaq-futures-rise-as-nvidia-tsmc-occidental-petroleum-lead-advances?utm_source=snapi,"Stock Market Today: S&P 500, Nasdaq Futures Rise As Nvidia, TSMC, Occidental Petroleum Lead Advances",U.S. stock futures rose on Monday after Friday's mixed close. Futures of major benchmark indices were higher.,Benzinga,"Mon, 10 Nov 2025 05:22:13 -0500","['paywall', 'futures', 'marketclose']",NVDA
https://www.fool.com/investing/2025/11/10/3-technology-buys-that-wall-street-loves/,3 Technology Buys That Wall Street Loves,Wall Street analysts advise buying these stocks and expecting them to climb in the coming 12 months. These companies are key players in the artificial intelligence market.,The Motley Fool,"Mon, 10 Nov 2025 05:15:00 -0500",[],NVDA
https://www.fool.com/investing/2025/11/10/should-you-buy-nvidia-hand-over-fist-before-nov-19/,Should You Buy Nvidia Hand Over Fist Before Nov. 19?,"Wall Street has great expectations for Nvidia's Q3 results. Nvidia has a history of beating analysts' estimates, and the odds look pretty good for the company doing it again on Nov. 19.",The Motley Fool,"Mon, 10 Nov 2025 04:44:00 -0500",[],NVDA
https://www.fool.com/investing/2025/11/10/2-ai-stocks-to-sell-before-drop-60-wall-street/,"2 Popular AI Stocks to Sell Before They Drop 47% and 60%, According to Wall Street Analysts","Shares of Palantir Technologies and Nvidia have advanced 1,960% and 1,290%, respectively, since the artificial intelligence boom started in late 2022. Palantir is a leader in artificial intelligence software, but its price-to-sales ratio is nearly three times higher than the next closest stock in the S&P 500.",The Motley Fool,"Mon, 10 Nov 2025 04:12:00 -0500",[],NVDA
https://finbold.com/nvidia-stock-flashes-biggest-green-flag-250-next/?utm_source=snapi,Nvidia stock flashes ‘biggest green flag'; $250 next?,"As American semiconductor giant Nvidia (NASDAQ: NVDA) gears up for its November 19 Q3 earnings release, the stock is displaying extraordinary strength, likely propelling it toward its $250 record high.",Finbold,"Mon, 10 Nov 2025 03:47:42 -0500",[],NVDA
https://www.fool.com/investing/2025/11/10/big-short-michael-burry-wager-ai-nvidia-palantir/,"""Big Short"" Investor Michael Burry Just Placed a Big Wager Against Artificial Intelligence (AI) Giants Nvidia and Palantir -- and History Is on His Side",Form 13Fs provide investors with a way to track the quarterly buying and selling activity of Wall Street's savviest money managers. Scion Asset Management's Michael Burry rose to fame with his wager against the U.S. housing market shortly before the financial crisis took shape in 2007.,The Motley Fool,"Mon, 10 Nov 2025 03:06:00 -0500",[],NVDA
https://www.fool.com/investing/2025/11/09/my-top-3-growth-stocks-2026-including-nvda-nflx/,"My Top 3 Growth Stocks to Buy for 2026 -- Including Nvidia and Netflix, and Netflix Isn't on the List Because of Its Upcoming 10-for-1 Stock Split, and One's Not a Stock",Nvidia is a semiconductor giant and recently became the first $5 trillion company. Netflix has grown so much that it's splitting 10-for-1.,The Motley Fool,"Sun, 09 Nov 2025 21:05:00 -0500",['StocksToWatch'],NVDA
https://www.fool.com/investing/2025/11/09/nvidias-quiet-move-into-quantum-computing-could-re/,Nvidia's Quiet Move Into Quantum Computing Could Reshape the Next Frontier of AI,"Nvidia is quietly positioning itself at the center of quantum computing by linking today's fastest AI GPUs with early quantum processors through its new NVQLink and CUDA-Q systems. This hybrid approach doesn't make qubits stronger -- it makes progress faster, allowing AI to stabilize and train quantum machines in real time, potentially pulling major breakthroughs years forward.",The Motley Fool,"Sun, 09 Nov 2025 20:27:00 -0500",[],NVDA
https://www.fool.com/investing/2025/11/09/got-5000-1-tech-stock-and-1-etf-to-buy-and-hold/,"Got $5,000? 1 Tech Stock and 1 ETF to Buy and Hold for the Long Term.","Nvidia's GPUs are ""everywhere"" and the stock is a can't-miss investment. This fund provides exposure to 25 of the top semiconductor companies in the world.",The Motley Fool,"Sun, 09 Nov 2025 18:01:00 -0500",[],NVDA
https://www.fool.com/investing/2025/11/09/why-nvidia-stock-plummeted-this-week/,Why Nvidia Stock Plummeted This Week,Nvidia stock lost ground as investors traded on AI-valuation-bubble concerns. News that Michael Burry's hedge fund had purchased put options against the stock also factored into sell-offs.,The Motley Fool,"Sun, 09 Nov 2025 16:55:00 -0500",[],NVDA
https://247wallst.com/investing/2025/11/09/nvidia-shares-dropped-7-this-week-3-catalysts-for-the-fall/?utm_source=snapi,NVIDIA Shares Dropped 7% This Week: 3 Catalysts For the Fall,"Shares of NVIDIA (Nasdaq: NVDA) dropped 7.1% this week, sinking sharply after hitting a high of $211.34 on Monday morning.",24/7 Wall Street,"Sun, 09 Nov 2025 15:00:44 -0500",[],NVDA
https://www.fool.com/investing/2025/11/09/does-burry-know-something-wallstreet-doesnt/,"Does Michael Burry of ""The Big Short"" Fame Know Something Wall Street Doesn't? He Just Made a Billion-Dollar Bet Against 2 Companies Driving the AI Boom.","Hedge fund manager Michael Burry predicted trouble in the U.S. housing market -- ahead of the subprime market crash. Burry's bet against the housing market won millions of dollars for his clients, as well as the respect of many investors.",The Motley Fool,"Sun, 09 Nov 2025 13:15:00 -0500",[],NVDA
https://seekingalpha.com/article/4841060-virtus-sga-global-growth-q3-2025-contributors-and-detractors,Virtus SGA Global Growth Q3 2025 Contributors And Detractors,"Nvidia was a contributor to the portfolio's performance again in Q3, driven by continued surging demand for accelerated computing and AI infrastructure. Chipotle was a detractor during the quarter as its comparable sales growth fell just 1% short of consensus (declining 4% against a very tough 11% comparison in the year ago period). Intuit was a detractor from performance during the quarter as cautious guidance for FY 2026 led to investor disappointment, despite strong fiscal-year (July) results.",Seeking Alpha,"Sun, 09 Nov 2025 13:11:00 -0500",['paylimitwall'],NVDA
https://www.fool.com/investing/2025/11/09/my-favorite-stock-to-buy-right-now-nvidia-nvda/,"My Favorite Stock to Buy Right Now -- and Yes, of Course It's Nvidia Stock (NVDA)","Nvidia's performance has been incredible. Its future isn't guaranteed to be golden, but signs point that way.",The Motley Fool,"Sun, 09 Nov 2025 10:34:00 -0500",[],NVDA
https://www.fool.com/investing/2025/11/09/has-palantir-technologies-become-a-better-artifici/,Has Palantir Technologies Become a Better Artificial Intelligence (AI) Stock to Buy Than Nvidia?,"Palantir's growth rate accelerated in its most recent quarter, while Nvidia's growth rate has been slowing. Nvidia, however, trades at a far more reasonable valuation with respect to earnings.",The Motley Fool,"Sun, 09 Nov 2025 09:35:00 -0500",[],NVDA
https://247wallst.com/investing/2025/11/09/3-reasons-why-nvidia-still-looks-like-a-buy-at-a-5-trillion-market-cap/?utm_source=snapi,3 Reasons Why Nvidia Still Looks Like a Buy at a $5 Trillion Market Cap,"Okay, I have to preface the title a bit – when I first started putting this piece together, Nvidia (NASDAQ:NVDA) was indeed trading at a market capitalization north of $5 trillion.",24/7 Wall Street,"Sun, 09 Nov 2025 07:55:06 -0500",[],NVDA
https://www.fool.com/investing/2025/11/09/reason-nvidia-smartest-ai-stock-to-buy-100/,1 Reason Nvidia Is the Smartest AI Stock to Buy With $100 Right Now,Nvidia is a key supplier to data centers and AI developers. Owning shares can make you a better AI investor.,The Motley Fool,"Sun, 09 Nov 2025 07:15:00 -0500",[],NVDA
https://www.fool.com/investing/2025/11/09/should-you-buy-nvidia-stock-before-nov-19/,Should You Buy Nvidia Stock Before Nov. 19?,Nvidia's dominance in creating GPUs is unchallenged. Nvidia's revenue is going to go through the roof again.,The Motley Fool,"Sun, 09 Nov 2025 05:06:00 -0500",[],NVDA
https://www.fool.com/investing/2025/11/09/3-stocks-that-will-benefit-most-from-the-ai-data-c/,3 Stocks That Will Benefit Most From the AI Data Center Power Boom,Nvidia provides the chips that power tomorrow's data centers. TSMC's foundries are earning more revenue from data center work.,The Motley Fool,"Sun, 09 Nov 2025 04:32:00 -0500",[],NVDA
https://www.fool.com/investing/2025/11/09/michael-burry-warning-ai-boom-stock-market-do-next/,Billionaire Michael Burry Sends Investors a $1 Billion Warning About the AI Boom. History Says the Stock Market Will Do This Next.,"Hedge fund manager Michael Burry has 66% of his $1.4 billion portfolio in put options on Palantir, and another 14% of his portfolio is invested in put options on Nvidia. Palantir is a leader in artificial intelligence (AI) decisioning platforms, and Nvidia is the gold standard in AI accelerators and networking equipment.",The Motley Fool,"Sun, 09 Nov 2025 04:06:00 -0500",[],NVDA
https://www.fool.com/investing/2025/11/09/nasdaq-will-soar-in-2026-my-top-ai-stocks/,History Says the Nasdaq Will Soar in 2026: My Top 10 Artificial Intelligence (AI) Growth Stocks to Buy Before It Does,"The Nasdaq Composite bull market continued in 2025, but history suggests there's additional upside ahead. Businesses are developing new applications for generative AI, and demand continues to climb.",The Motley Fool,"Sun, 09 Nov 2025 03:01:00 -0500",['StocksToWatch'],NVDA
https://www.fool.com/investing/2025/11/08/michael-burry-nvidia-nvda-palantir-pltr-ai-stocks/,Michael Burry's Bets Against AI Stocks Nvidia and Palantir: What Investors Should Know,"The S&P 500 and tech-heavy Nasdaq Composite indexes declined about 1.6% and 3.0%, respectively, this week. This week, shares of AI chip leader Nvidia declined 7.1%, and shares of Palantir, which operates an AI-driven data analysis platform, were down 11.2%.",The Motley Fool,"Sat, 08 Nov 2025 15:00:00 -0500",[],NVDA
https://www.fool.com/investing/2025/11/08/prediction-nvidia-will-stall-out-on-nov-20/,Prediction: Nvidia Stock Is Going to Stall Out on Nov. 20,Nvidia stock has climbed in the quadruple digits over the past few years. This momentum is thanks to Nvidia's leadership position in the artificial intelligence (AI) chip market.,The Motley Fool,"Sat, 08 Nov 2025 14:10:00 -0500",[],NVDA
https://www.fool.com/investing/2025/11/08/3-must-own-stocks-for-the-driverless-vehicle-revol/,3 Must-Own Stocks for the Driverless Vehicle Revolution,Ambarella products extract valuable data from video and radar streams. Nvidia is working with numerous partners across its autonomous technology ecosystem.,The Motley Fool,"Sat, 08 Nov 2025 13:14:00 -0500",[],NVDA
https://finbold.com/ai-sets-odds-of-nvidia-stock-trading-at-250-after-q3-earnings/?utm_source=snapi,AI sets odds of Nvidia stock trading at $250 after Q3 earnings,"American semiconductor giant Nvidia (NASDAQ: NVDA) is gearing up to announce its third-quarter earnings on November 19, with Wall Street expecting a bullish report.",Finbold,"Sat, 08 Nov 2025 10:34:11 -0500",['earnings'],NVDA
https://247wallst.com/investing/2025/11/08/nvidia-stocks-path-to-350-could-such-a-rally-pressure-burry-to-close-his-bet/?utm_source=snapi,Nvidia Stock's Path to $350. Could Such a Rally Pressure Burry to Close His Bet?,"Dr. Michael Burry, a man of “The Big Short” fame, has a lot of courage to bet against a high-flying company like Nvidia (NASDAQ:NVDA), which has always found a way to skyrocket higher, even after nail-biting periods of concern.",24/7 Wall Street,"Sat, 08 Nov 2025 08:34:20 -0500",[],NVDA
https://invezz.com/news/2025/11/08/nvidia-ceo-jensen-huang-seeks-more-chip-supply-from-tsmc-as-ai-demand-surges/?utm_source=snapi,Nvidia CEO Jensen Huang seeks more chip supply from TSMC as AI demand surges,Nvidia Corp. Chief Executive Officer Jensen Huang said on Saturday that he has asked Taiwan Semiconductor Manufacturing Co. (TSMC) for additional chip supplies as demand for artificial intelligence (AI) technologies continues to grow rapidly.,Invezz,"Sat, 08 Nov 2025 07:20:53 -0500",['CEO'],NVDA
https://seekingalpha.com/article/4840085-avoid-3-dividend-traps-before-they-wreck-your-retirement-income,Avoid These 3 Dividend Traps Before They Wreck Your Retirement Income,"Retiring on dividends requires balancing attractive yields with safety and growth to ensure sustainable, inflation-beating income over time. Many investors are shooting themselves in the foot with these 3 dividend traps. We detail how to avoid these dividend traps and instead build a sustainable dividend portfolio for retirement.",Seeking Alpha,"Sat, 08 Nov 2025 07:05:00 -0500","['dividend', 'paylimitwall']",NVDA
https://www.fool.com/investing/2025/11/08/5-top-artificial-intelligence-stocks-to-buy-in-nov/,5 Top Artificial Intelligence Stocks to Buy in November,Nvidia and Broadcom are building computing units to power the AI arms race. Taiwan Semiconductor is a key part of the AI chip supply chain.,The Motley Fool,"Sat, 08 Nov 2025 06:30:00 -0500",['StocksToWatch'],NVDA
https://www.fool.com/investing/2025/11/08/prediction-this-will-be-nvidias-stock-price-by-203/,Prediction: This Will Be Nvidia's Stock Price by 2030,Nvidia's GPUs are still the leading chips for powering AI systems. Nvidia's management is forecasting monster growth over the next five years.,The Motley Fool,"Sat, 08 Nov 2025 06:06:00 -0500",[],NVDA
https://www.fool.com/investing/2025/11/08/nvidias-ai-dominance-data-center-revenue-poised-fo/,Nvidia's AI Dominance: Data Center Revenue Poised for 165% Surge by 2027,Nvidia CEO Jensen Huang suggested the company has a big enough backlog to sustain the outstanding growth of the data center business. The prospects of Nvidia's data center business are aided by the huge amount of money that's going to be spent on AI infrastructure over the next couple of years.,The Motley Fool,"Sat, 08 Nov 2025 03:00:00 -0500",[],NVDA
